id,source_id,source_name,title,content,published_at
5194,the-new-york-times,The New York Times,Judiciary Panel Advances Impeachment Inquiry of Trump as Doubts Linger,The resolution itself under consideration on Thursday defines four authorities for the inquiry.  It would allow Mr. Nadler to designate any hearing of the full Judiciary Committee or its subcommittees as part of the investigation  a measure Democrats believe … [+2083 chars],2019-09-12T14:23:31Z
5198,the-new-york-times,The New York Times,Overlooked No More: Mihri Rassim  Feminist Artist in the Ottoman Empire,Rassim was representative of an era toward the end of the Ottoman Empire when the daughters of the elite were encouraged to learn about art  literature and music but then limited to becoming art teachers  if they were fortunate to have careers at all. Histori… [+1328 chars],2019-09-12T16:58:40Z
5202,the-irish-times,The Irish Times,Facebook insists pages punished for promoting vaccine misinformation,Facebook insists pages on its platform that spread misinformation about vaccinations are being punished by the company reducing the number of people who can see such posts.  The social media company said it was now promoting science-based content from authent… [+2934 chars],2019-09-12T14:10:14Z
5206,abc-news,ABC News,Google settles with labor board over employee speech,Google says it's reached a settlement over employees' ability to speak out about workplace issues.  Under the settlement with the National Labor Relations Board  Google has agreed to post a notice to remind employees of their rights.  A Wall Street Journal re… [+515 chars],2019-09-12T17:34:10Z
5210,cbs-news,CBS News,2020 Daily Trail Markers: HBCU Texas Southern University prepares to host the third Democratic debate,,2019-09-12T19:49:34Z
5214,business-insider,Business Insider,A Las Vegas hotel billionaire just unveiled an inflatable space pod designed to ferry NASA astronauts to the moon and Mars — take a look inside,Hotel mogul Robert Bigelow wants to take his idea to build inflatable space habitats and run with it — apparently  all the way to Mars.    On Thursday  the billionaire publicly unveiled Bigelow Aerospace's latest model of an expandable space station prototype… [+1259 chars],2019-09-12T18:30:00Z
5218,cbs-news,CBS News,Texas sees surge of women Democratic candidates running after 2018 defeats,,2019-09-12T02:21:36Z
5222,the-irish-times,The Irish Times,ECB cuts key rate to record low of -0.5%,The European Central Bank has cut interest rates and approved a new round of bond purchases to prop up euro zone growth and halt a worrisome drop in inflation expectations.  The ECB cut its deposit rate to a record low -0.5 per cent from -0.4 per cent and wil… [+683 chars],2019-09-12T11:59:27Z
5226,abc-news,ABC News,University of Tennessee offers admission  4-year scholarship to young Vol fan who was bullied over homemade T-shirt,A young boy who went viral for his homemade University of Tennessee T-shirt has been offered a four year scholarship to the school.   In recognition of the fourth-graders Volunteer spirit  the university has extended an offer of admission for him to join the … [+2420 chars],2019-09-12T16:06:52Z
5230,al-jazeera-english,Al Jazeera English,Why mainstream analyses of the upcoming recession are wrong,A recession is coming!  Is it?  If so  when? And we should ask why.  A headline in Fortune said  A Majority of Economists Think the Next Recession Will Come by the 2020 Election .  Business Insider's headline was  More than 70 percent of economists think a US… [+7521 chars],2019-09-12T18:26:05Z
5234,cnn,CNN,The US deficit topped $1 trillion. The year's not even over yet,Washington (CNN Business)The US budget deficit widened to $1.067 trillion for the first 11 months of the fiscal year  an increase of 19% over this time last year  the Treasury Department reported Thursday.  The current shortfall exceeds the full-year deficit … [+1369 chars],2019-09-12T18:28:43Z
5238,newsweek,Newsweek,MSNBC Contributor Blasts Trump's Bahamas' Decision: 'Extraordinary Measures' to Block 'Specific Skin Color' from U.S.,MSNBC contributor Mike Barnacle blasted President Donald Trump and his administration after it was reported that individuals from the Bahamas displaced by the devastation of Hurricane Dorian would not be granted temporary protected status in the United States… [+2675 chars],2019-09-12T16:09:28Z
5242,newsweek,Newsweek,Marianne Williamson Caught On Hot Mic: 'Fox News Is Nicer to Me Than the Lefties',Democratic 2020 presidential hopeful Marianne Williamson was caught on hot mic after an interview  claiming that right-wing cable network Fox News and conservatives are  nicer  to her than the political left.   What does it say that Fox News is nicer to me th… [+2487 chars],2019-09-12T14:33:35Z
5246,abc-news,ABC News,THC gummies at school; woman  11-year-old daughter charged,A 30-year-old Louisiana woman is accused of making THC-laced gummy candies  and her 11-year-old daughter is accused of giving them to classmates at school.  The St. Tammany Parish Sheriff's Office said in a news release Wednesday that a deputy assigned to the… [+553 chars],2019-09-12T17:20:41Z
5250,the-wall-street-journal,The Wall Street Journal,Report on Boat Fire Concludes Crew Was Asleep When Fire Began,Federal investigators on Thursday released a preliminary report on the Conception boat fire that killed nearly three-dozen people earlier this month off the coast of California  and said the entire crew was asleep when the blaze began. National Transportation… [+2888 chars],2019-09-12T18:44:00Z
5254,al-jazeera-english,Al Jazeera English,Australia PM 'pursuing' cases of three citizens detained in Iran,Australian Prime Minister Scott Morrison says his country is pursuing the cases of two women who are dual Australian-British citizens and an Australian man who have been detained in Iran  one of them sentenced to 10 years in prison.  Morrison told reporters i… [+3406 chars],2019-09-12T03:54:02Z
5258,cbs-news,CBS News,Eye Opener: The Trump administration moves to ban most flavored e-cigarettes,,2019-09-12T11:26:29Z
5262,abc-news,ABC News,1 300 registered as unaccounted for in the Bahamas in aftermath of Hurricane Dorian,As search-and-recovery crews comb through the hundreds of homes in the Bahamaswrecked by Hurricane Dorian  officials on the island nation released an alarming figure: 1 300 people have been registered by loved ones as unaccounted for.  Interested in Hurricane… [+4335 chars],2019-09-12T16:33:53Z
5266,reuters,Reuters,Skirting U.S. sanctions  Cubans flock to cryptocurrency to shop online  send funds,HAVANA (Reuters) - Jason Sanchez  35  was able to start buying spare parts online last year for his cellphone repair shop in Havana thanks to the advent of cryptocurrency trading in Communist-run Cuba.   Cuba  which in many ways remains stuck in the analogue … [+5260 chars],2019-09-12T18:19:40Z
5270,the-irish-times,The Irish Times,ECB cuts key interest rate to record low of -0.5%,The European Central Bank has cut interest rates and approved a new round of bond purchases to prop up euro zone growth and halt a worrisome drop in inflation expectations.  The ECB cut its deposit rate to a record low -0.5 per cent from -0.4 per cent and wil… [+683 chars],2019-09-12T11:59:27Z
5274,the-irish-times,The Irish Times,Channelling Clara – Frank McNally on the story of a celebrity German piano in Donegal,In the great Gershwin jazz opera Porgy and Bess  its one of the supporting characters Clara who gets to sing the stand-out song. She was present in spirit at a packed National Concert Hall on Wednesday night  when the RTÉ Concert Orchestra presented a live ve… [+4185 chars],2019-09-12T17:01:00Z
5278,newsweek,Newsweek,National Video Games Day: Top 10 Games of 2019 So Far,2019 has been an absolutely amazing year for video games  from sleeper hits to triple-A releases. In honor of National Video Game Day 2019  we've compiled a list of 10 great titles from this year that players should try before fall's blockbuster avalanche tru… [+4353 chars],2019-09-12T17:10:44Z
5282,the-wall-street-journal,The Wall Street Journal,When Wall Street Flips Municipal Bonds  Towns and Schools Pay the Price,When the West Contra Costa Unified School District in California needed money to repair and upgrade deteriorating classrooms  it hired   Piper Jaffray Co  s. to sell $191 million of municipal bonds.As far as school officials knew  the March 2016 sale went off… [+13172 chars],2019-09-12T15:41:00Z
5286,bbc-news,BBC News,UK: Boris Johnson denies lying to Queen over Parliament suspension,Britain's PM spoke after Scotland's highest civil court ruled shutdown was unlawful. The power to suspend - or prorogue - Parliament lies with the Queen  who follows advice of the PM.  Also  how Syrian doctors in Idlib have moved underground to escape airstri… [+122 chars],2019-09-12T15:15:00Z
5290,bbc-news,BBC News,Women's Champions League: Arsenal outclass Fiorentina 4-0 in Italy in last 32 first leg,Vivianne Miedema scored 22 goals and picked up 10 assists in 19 domestic appearances last season  Arsenal's star Dutch striker Vivianne Miedema returned from injury to inspire her side to a 4-0 win over Fiorentina in their Women's Champions League last 32 fir… [+1183 chars],2019-09-12T18:55:45Z
5294,newsweek,Newsweek,Facebook's Libra Cryptocurrency Could Be Blocked in Europe  Politician Says,Facebook's plan to roll out a new global currency hit a fresh hurdle today after it was criticized as a potential risk to  monetary sovereignty.   French Finance Minister Bruno Le Maire spoke out against the digital money  known as Libra  in a keynote address… [+4171 chars],2019-09-12T14:02:33Z
5298,al-jazeera-english,Al Jazeera English,Bolton was fired after disagreeing with Trump on Iran: Report,The sacking of John Bolton  US President Donald Trump's former national security adviser  is tied to a fundamental disagreement over the possible easing of US sanctions on Iran  Bloomberg reported on Wednesday  citing three people familiar with the matter.   … [+4669 chars],2019-09-12T08:59:00Z
5302,bbc-news,BBC News,Sudan crisis: Thousands demand justice over protester killings,Image copyrightGetty ImagesImage caption   There were clashes between the police and protesters as the crowd moved towards the palace  Thousands of people have protested in Sudan to demand justice for pro-democracy demonstrators who were killed earlier this y… [+2140 chars],2019-09-12T18:00:55Z
5306,bbc-news,BBC News,Neymar  Icardi  Messi  Sarri - this week's big talking points in European football,Lionel Messi scored 36 of Barcelona's 90 La Liga goals last season  After the international break  domestic top-flight football returns to Europe's top leagues this weekend.  Will Neymar make his first appearance of the season for Paris St-Germain? Is Mauro I… [+5352 chars],2019-09-12T19:10:08Z
5310,abc-news,ABC News,Over 100 business execs demand 'urgent action' from lawmakers over gun violence,Scores of executives from some of the nation's biggest business demanded  urgent action  from lawmakers on  America's gun violence crisis   writing in a letter that the tragedies are  preventable.   Uber CEO Dara Khosrowshahi  Yelp CEO and co-founder Jeremy S… [+2443 chars],2019-09-12T15:09:44Z
5314,newsweek,Newsweek,CIA Spy and His Family Extracted From Russia Are in Danger for the Rest of Their Lives  Says Friend of Murdered Ex-FSB Whistleblower,An expert on Russia's security services  who was friends and colleagues with a former FSB agent whose murder was blamed on the Kremlin  has given a chilling assessment of the future of the alleged U.S. spy reportedly extricated from Moscow.  Alexander Litvine… [+4105 chars],2019-09-12T16:30:07Z
5318,bbc-news,BBC News,Tafida Raqeeb: Brain-damaged girl's mum 'doesn't trust UK doctors',Image copyrightFamily HandoutImage caption   Tafida Raqeeb's parents want to move her to a children's hospital in Genoa  Italy  The mother of a brain-damaged girl has told a judge she no longer trusts UK doctors to care for her daughter.  Medics treating Tafi… [+1823 chars],2019-09-12T14:52:16Z
5322,bbc-news,BBC News,Aaron Persky: Brock Turner judge fired from coaching girls,Image copyrightGetty ImagesImage caption   Aaron Persky was recalled by voters after his controversial 2015 verdict  A California judge who lost his job after giving a lenient sentence to a college sex attacker has now been fired from coaching tennis to schoo… [+3106 chars],2019-09-12T14:41:08Z
5326,the-new-york-times,The New York Times,The Maybe Comet From Another Star,More observations are sure to follow. This object is going to be observable for some time  Dr. Holman said.  This is going to be a Christmas comet  said Michele Bannister  an astronomer and expert on small bodies at Queens University Belfast  who said she was… [+1051 chars],2019-09-12T18:27:07Z
5330,abc-news,ABC News,US envoy rejects claim of 'war crime' by key UN Syria panel,The United States' top envoy for Syria has rejected findings by U.N.-backed investigators that deadly airstrikes by the U.S.-led coalition earlier this year may amount to a war crime.  Ambassador James Jeffrey said Thursday the coalition takes  extreme care i… [+542 chars],2019-09-12T16:47:26Z
5334,the-wall-street-journal,The Wall Street Journal,No-Deal Brexit: 3 Things to Know About the U.K.’s ‘Worst-Case Scenario’,,2019-09-12T15:59:49Z
5338,bbc-news,BBC News,At least two men stabbed in 'linked' London attacks,Image copyrightGoogleImage caption   The condition of the man stabbed in Eastleigh Walk is not yet known  At least two men have been stabbed in south London in what police believe are linked attacks.  Police officers found one man with stab injuries after rep… [+896 chars],2019-09-12T13:44:59Z
5342,al-jazeera-english,Al Jazeera English,Saudi princess gets suspended jail in France for beating plumber,Hassa bint Salman  a Saudi princess  was on Thursday handed a 10-month suspended sentence by a French court for ordering a bodyguard to beat a workman at her luxury residence in Paris in 2016.  The 42-year-old  a sister of Crown Prince Mohammed bin Salman (MB… [+3710 chars],2019-09-12T18:16:56Z
5346,cnn,CNN,What digital nerds and bio geeks have to worry about,Bruce Schneier is the author of  Data and Goliath: The Hidden Battles to Collect Your Data and Control Your World.  Larisa Rudenko served as a senior advisor for biotechnology at FDA for 15 years; currently she is a research affiliate at the Program on Emergi… [+7567 chars],2019-09-12T18:41:17Z
5350,the-irish-times,The Irish Times,Janan Ganesh: Notion of a unified world populism is a myth,Populists are amassing an empire on which the sun never sets. Leaders of their stripe govern as far east as the Philippines and as far west as the US. The European branch now has no less a nation than Britain as its unofficial garrison. When Jair Bolsonaro wa… [+4358 chars],2019-09-12T12:23:48Z
5354,bbc-news,BBC News,Google Maps shows sunken car where missing man’s body was found,Image copyrightNational Missing and Unidentified Persons SystemImage caption   William Moldt went missing in Florida at the age of 40 in 1997  The remains of a man who went missing two decades ago in Florida have been found in a submerged car visible on Googl… [+2377 chars],2019-09-12T14:22:37Z
5358,cbs-news,CBS News,Patriots player Joe Cardona on balancing his love of football -- and his country,,2019-09-14T12:19:36Z
5362,cbs-news,CBS News,Sunday: Omar  Schiff  Cuccinelli  Rice  Power,The Supreme Court handed the Trump administration a major legal triumph on Wednesday by  allowing temporary nation-wide enforcement of a new rule that prevents most Central American migrants from seeking asylum in the United States.  The shift  which reverses… [+3754 chars],2019-09-14T00:34:41Z
5366,the-irish-times,The Irish Times,Anarchy at the cheese counter: how a US deli overturned the business model,Anarchism would seem to be the antithesis to capitalism  and yet it is the very basis of the astounding success of Zingermans  a tiny delicatessen in Michigan that has given the artsy  bookish city of Ann Arbor a large part of its identity in recent decades. … [+6606 chars],2019-09-14T05:00:00Z
5370,abc-news,ABC News,Libyan self-styled army says 3 fighters killed near Tripoli,The self-styled Libyan National Army says three of its forces  including two commanders  were killed in a drone attack by militias loosely allied with the U.N.-supported government.  It says the attack took place Friday in the town of Tarhuna  around 88 kilom… [+477 chars],2019-09-14T10:56:11Z
5374,abc-news,ABC News,Warren has her own plan for everything - except this,Elizabeth Warren has a plan for that. But on health care  she's with Bernie.  Interested in Democratic Party?  Add Democratic Party as an interest to stay up to date on the latest Democratic Party news  video  and analysis from ABC News.  Warren  a Massachuse… [+4461 chars],2019-09-14T14:30:28Z
5378,bbc-news,BBC News,2019/09/14 14:01 GMT,The latest five minute news bulletin from BBC World Service.,2019-09-14T14:04:00Z
5382,bbc-news,BBC News,DUP urged to  Think very carefully  about second referendum,Image caption   Former attorney general Dominic Grieve said there was nothing undemocratic about a second vote  Former attorney general Dominic Grieve has urged the DUP to  think very carefully  about supporting a second referendum and warned against  hanging… [+2795 chars],2019-09-14T16:06:15Z
5386,cnn,CNN,Joe Biden commits to releasing medical records before 2020 Iowa caucuses,(CNN)Democratic presidential hopeful Joe Biden committed to publicly releasing his medical records before the Iowa caucuses after questions of whether the 76-year-old former vice president is fit for the rigors of the presidency and to take on President Donal… [+2805 chars],2019-09-14T16:29:20Z
5390,abc-news,ABC News,Gunfire at Seattle train station kills 1  wounds 2,Authorities in Seattle say gunfire at a light-rail station has killed one person and wounded two others  and that police are searching for suspects.  The Seattle Times reports that the shooting happened on the northbound tunnel platform of the Westlake statio… [+321 chars],2019-09-14T05:48:24Z
5394,reuters,Reuters,Germany's climate protection measures to cost 40 billion euros by 2023: source,BERLIN (Reuters) - Climate protection measures that Chancellor Angela Merkel’s conservatives and their Social Democrat coalition partners want to unveil next week will cost at least 40 billion euros until 2023  a person briefed on the talks told Reuters on Sa… [+368 chars],2019-09-14T13:33:51Z
5398,bbc-news,BBC News,DR Congo ex-health minister arrested over Ebola funds,Image copyrightAFP/Getty ImagesImage caption   Oly Ilunga denies the accusation that he mismanaged funds meant to be used to fight the Ebola epidemic  Police in the Democratic Republic of Congo have arrested a former health minister for allegedly mismanaging … [+1493 chars],2019-09-14T17:01:15Z
5402,the-irish-times,The Irish Times,Robbie Henshaw an injury concern for World Cup,Robbie Henshaws availability for the World Cup opener against Scotland on Sunday week and the entire tournament is under threat after the 26-year-old is believed to have suffered a hamstring injury.   In a cruel twist  Henshaw also missed the tournament opene… [+9 chars],2019-09-14T13:23:26Z
5406,the-irish-times,The Irish Times,Ireland’s Rugby World Cup squad as you’ve never seen them before,Over the past six months the sports photographers Billy Stickland  Dan Sheridan and James Crombie have travelled the length and breadth of Ireland  capturing each member of the Rugby World Cup squad with the people and places that mean most to them. As they m… [+5213 chars],2019-09-14T05:05:00Z
5410,bbc-news,BBC News,Ashes: England's Joe Root edges Australia's Nathan Lyon to Steve Smith at slip,,2019-09-14T12:02:42Z
5414,reuters,Reuters,Tropical Storm Humberto lashes Bahamas  seen becoming hurricane,NASSAU (Reuters) - Tropical Storm Humberto lashed already devastated parts of the Bahamas with heavy rain and strong winds on Saturday  and forecasters said it was likely to become a hurricane before the end of the weekend.   The storm is expected to leave th… [+1231 chars],2019-09-14T13:57:13Z
5418,reuters,Reuters,Brazil's Amazon chief Raoni tapped for 2020 Nobel Peace Prize nomination,BRASILIA (Reuters) - A group of Brazilian anthropologists and environmentalists has put forward Chief Raoni Metuktire of the Kayapó tribe as a candidate for the 2020 Nobel Peace Prize for a lifetime of work protecting the Amazon rainforest.   Raoni  an unmist… [+2043 chars],2019-09-14T15:46:41Z
5422,cbs-news,CBS News,$1.25 million toilet stolen from Winston Churchill's birthplace,London — Thieves have stolen a solid gold toilet worth up to $1.25 million from the birthplace of British wartime leader Winston Churchill. The toilet  the work of Italian conceptual artist Maurizio Cattelan  had been installed only two days earlier at Blenhe… [+726 chars],2019-09-14T15:42:11Z
5426,the-wall-street-journal,The Wall Street Journal,Drone Strikes Spark Fires at Saudi Oil Facilities - The Wall Street Journal,Drone strikes caused fires that raged at two facilities of Saudi Arabias vast state oil company  the countrys interior ministry said  in what Yemens Houthi rebels described as one of their largest-ever operations inside the kingdom.The strikes mark the latest… [+3001 chars],2019-09-14T06:42:00Z
5430,reuters,Reuters,In break with past  Rome lets charity ship head to Italian port,LAMPEDUSA  Italy (Reuters) - Italy’s new government allowed a French charity ship to head to the island of Lampedusa on Saturday and bring ashore some 82 migrants  reversing the uncompromising  closed-door policy of the previous administration.   The Ocean Vi… [+1682 chars],2019-09-14T08:55:15Z
5434,bbc-news,BBC News,Wrightbus: NI businessman Darren Donnelly confirms bid,Image caption   Wrightbus is one of Ballymena's largest employers  Northern Ireland businessman Darren Donnelly has confirmed he is attempting to buy Ballymena bus manufacturer Wrightbus.  The bus firm is up for sale amid financial problems. A spokesman for M… [+842 chars],2019-09-14T11:59:20Z
5438,the-new-york-times,The New York Times,Running a Race Vs. Racing It,Welcome to the Running newsletter! Every Saturday morning  we email runners with news  advice and some motivation to help you get up and running. Sign up here to get it in your inbox.  Dear Readers   I dont know exactly how many races Ive run in my life  but … [+774 chars],2019-09-14T12:00:05Z
5442,abc-news,ABC News,AP Top Entertainment News at 3:06 a.m. EDT,Marvel's Kevin Feige honored at 45th Saturn Awards 'I was stupid': Huffman gets 14 days in college scam Prize winning historian Jean Edward Smith dead at 86 YouTube star Lilly Singh makes bold leap to late-night TV Eddie Money  'Two Tickets to Paradise' singe… [+304 chars],2019-09-14T07:06:39Z
5446,cnn,CNN,Solid gold toilet stolen from Blenheim Palace  birthplace of Winston Churchill,artsPublished 14th September 2019  A toilet made entirely of 18-carat-gold has been stolen from Blenheim Palace in Oxfordshire  England  the stately home where former prime minister Winston Churchill was born.  The fully functioning toilet was installed as pa… [+1765 chars],2019-09-14T12:00:57Z
5450,the-irish-times,The Irish Times,Ashes of €1.6m Sinn Féin donor buried in west Belfast,An Englishman who left £1.5 million (1.68 million)to Sinn Féin in his will had his ashes buried in west Belfast  according to the Irish News.  The party received the windfall from William E Hampton  who had been living in Wales. The money was paid in two inst… [+913 chars],2019-09-14T09:39:11Z
5454,abc-news,ABC News,Mine shutdowns in top US coal region bring new uncertainty,At two of the world's biggest coal mines  the finances got so bad that their owner couldn't even get toilet paper on credit.  Warehouse technician Melissa Worden divvied up what remained  giving four rolls to each mine and two to the mine supply facility wher… [+4842 chars],2019-09-14T16:04:14Z
5458,abc-news,ABC News,Collection of premiere proverb scholar opens at UVM,From  Strike while the iron is hot  to  Been there  done that   proverbs have been developed around the world for centuries  spread by word of mouth  writings  and nowadays social media.  University of Vermont Professor Wolfgang Mieder  thought to be the worl… [+3261 chars],2019-09-14T15:37:57Z
5462,the-wall-street-journal,The Wall Street Journal,Hey CEOs  Have You Hugged the Uncertainty Monster Lately?,Uncertainty is the monster that lives under the bed of every CEO. It waits until the door is shut and the lights are out  and even then  it bides its time. Pulses race  sweat beads  no move seems the right one. The first eight years of my life were spent in t… [+6362 chars],2019-09-14T04:07:02Z
5466,business-insider,Business Insider,'Minecraft' has been quietly dominating for over 10 years  and now has 112 million players every month (MSFT),For over 10 years  the wildly popular game   Minecraft  has been a cultural juggernaut.    Despite other major games sweeping up millions of players  like   Fortnite  and   Roblox    Minecraft  continues to quietly dominate.    As of this week  the game now h… [+2882 chars],2019-09-14T13:20:00Z
5470,abc-news,ABC News,Today in History,Today in History  Today is Saturday  Sept. 14  the 257th day of 2019. There are 108 days left in the year.  Today's Highlight in History:  On Sept. 14  1814  Francis Scott Key was inspired to write the poem  Defence of Fort McHenry  (later  The Star-Spangled … [+5660 chars],2019-09-14T04:01:27Z
