id,source_id,source_name,title,content,published_at
2,the-irish-times,The Irish Times,Louise Kennedy AW2019: Long coats  sparkling tweed dresses and emerald knits,Louise Kennedy is showing off her autumn-winter collection in Dublin tonight and the show will start with her glittering new take on Black Watch tartan.  Sixteen models will present more than 60 ensembles to over 200 guests  including the designers close frie… [+2156 chars],2019-09-03T14:40:00Z
6,reuters,Reuters,EU wants to see if lawmakers will block Brexit before striking new deal: UK's Johnson,LONDON (Reuters) - The European Union is waiting to see if British lawmakers block Brexit before giving Britain concessions to strike a new withdrawal agreement  Prime Minister Boris Johnson said.   Johnson  who has pledged that Britain will leave the EU on O… [+777 chars],2019-09-03T16:25:41Z
10,al-jazeera-english,Al Jazeera English,The Afghan 'peace' deal will not bring peace to the Afghan people,In 2001  The United States government invaded Afghanistan with the explicit aim to remove the Islamic fundamentalist group  the Taliban  from power. Some 18 years later  the US government is negotiating a peace deal with the same violent group.  Since the US … [+5158 chars],2019-09-03T15:54:56Z
14,bbc-news,BBC News,Neil Lennon: Celtic manager 'very pleased' with the club's transfer business,Media playback is not supported on this device  'A very good transfer window' - Lennon  Celtic have had a  very good  transfer window despite  sniping  from outside the club  says manager Neil Lennon.  The deadline-day arrival of Kilmarnock left-back Greg Tay… [+1702 chars],2019-09-03T17:06:05Z
18,the-irish-times,The Irish Times,Exchequer boost for Government ahead of budget,The Government has received a timely boost ahead of next months budget with the latest exchequer returns showing it is on course to hit its tax and spending targets for the year.  The figures  which will be central to the budgetary arithmetic  show the Govern… [+1889 chars],2019-09-03T15:30:19Z
22,the-new-york-times,The New York Times,Natural Wines Will Get Some New Showcases This Fall,Natural has become the attention-grabbing word in the wine world  referring to wines that are made with minimal intervention  like chemical additives or commercial yeast. Natural wines will populate the lists of several restaurants coming this fall  and theyr… [+1196 chars],2019-09-03T17:43:23Z
26,al-jazeera-english,Al Jazeera English,India's Chandrayaan-2 ready for moon landing,The landing module of India's unmanned moon mission separated successfully from the orbiter on Monday ahead of its planned touchdown on the moon's south polar region this weekend  the country's space agency said.  All the systems of the orbiter and the lander… [+1021 chars],2019-09-03T01:46:36Z
30,business-insider,Business Insider,Trump said he skipped a diplomatic trip to monitor Hurricane Dorian. Then he spent the weekend golfing.,President Donald Trump announced last week that he was canceling a diplomatic trip to Poland so he could monitor Hurricane Dorian from Camp David as the Category 4 storm made its way toward the southeastern US. Trump said he canceled the trip because it was  … [+4010 chars],2019-09-03T15:31:09Z
34,business-insider,Business Insider,Trump says a deal with China will be 'MUCH TOUGHER' if he gets re-elected in 2020,Getty Images/Alex Wong  <ul><li>President Donald Trump suggested on Tuesday that a more than yearlong trade dispute with China could potentially last until 2020.</li><li>He said that any agreement to defuse tensions would be 'tougher' if he were to win re-ele… [+2249 chars],2019-09-03T14:40:39Z
38,cnn,CNN,Want to live longer? You may want to ditch these drinks,,2019-09-03T15:03:51Z
42,the-irish-times,The Irish Times,At The Border  Cross – Frank McNally on the stresses of driving through the former Yugoslavia,On a family road trip through the former Yugoslavia recently  we got used to crossing international borders  some less eventfully than others. The mountain pass that took us from Croatia into Bosnia-Herzegovina  for example  was so devoid of traffic as to mak… [+4145 chars],2019-09-03T17:01:00Z
46,bbc-news,BBC News,No-deal opponents argue for Commons control,Image copyrightUK Parliament  Tory rebels and opposition MPs have cleared the first hurdle in their attempt to pass a law designed to prevent a no-deal Brexit.   Commons Speaker John Bercow granted them a debate and a vote on taking control of the Commons age… [+773 chars],2019-09-03T18:09:35Z
50,newsweek,Newsweek,Hurricane Dorian Flight Cancellations Reach Nearly 2 000 in U.S. While More Than 1 400 Routes Are Delayed,As residents in Florida brace themselves for the incoming Hurricane Dorian  hundreds of people traveling out of the state are now scrambling to find alternative routes following massive flight cancellations.  Nearly 2 000 flights across the U.S. were canceled… [+3013 chars],2019-09-03T16:17:27Z
54,the-wall-street-journal,The Wall Street Journal,Streaming Services Draw New Subscribers With Old-Time Rock ’n’ Roll,Joel Shaffer usually listens to current pop stars like Drake  Kygo and Migos during his 30-minute commute to work outside Boston. But when he recently stumbled onto Nine Inch Nails 1989 song Head Like a Hole  he was hooked.  This led me down a three-day  bing… [+233 chars],2019-09-03T14:06:00Z
58,cnn,CNN,Cancer now tops heart disease as the No. 1 cause of death in these countries,,2019-09-03T09:37:52Z
62,business-insider,Business Insider,How to restart an Xbox One on the console or a controller  or shut it down,Even an Xbox One  one of the most advanced gaming consoles yet developed  can experience its fair share of glitches.    If your Xbox is running too slowly  having response or connectivity issues  or is experiencing any other bugs  usually the best thing to do… [+2032 chars],2019-09-03T14:07:00Z
66,the-new-york-times,The New York Times,Is Dying at Home Overrated?,The system is imperfect  though. Unless a family has the significant resources necessary to hire aides or nurses  informal caregivers become responsible for nearly everything from feeding to bathing to toileting. These tasks often get harder as the dying pers… [+3047 chars],2019-09-03T09:00:03Z
70,reuters,Reuters,Illinois joins lawsuit to ask court to stop merger of T-Mobile  Sprint,WASHINGTON (Reuters) - Illinois has joined a multistate lawsuit aimed at stopping the merger of U.S. wireless carriers T-Mobile US Inc (TMUS.O) and Sprint Corp (S.N)  the New York attorney general’s office  which is leading the effort along with California  s… [+180 chars],2019-09-03T17:10:47Z
74,espn,ESPN,Sources: Urgency in Zeke talks; RB flying back,Ezekiel Elliott and the Dallas Cowboys are acting with a sense of urgency to finalize a deal in the next 24 hours that would allow the star running back to practice Wednesday and play in Sunday's season opener against the New York Giants  sources told ESPN's … [+1329 chars],2019-09-03T14:22:00Z
78,cnn,CNN,US manufacturing sector shrinks for first time in three years,,2019-09-03T15:21:34Z
82,cnn,CNN,Here's what Hurricane Dorian is expected to do as it crawls toward the US,,2019-09-03T12:00:49Z
86,bbc-news,BBC News,Ariana Grande says Forever 21 'stole' name in lawsuit,Image copyrightGetty ImagesImage caption   Ariana Grande  Singer Ariana Grande is asking for $10m (£8.3m) in damages from Forever 21  saying the retailer  stole her name  to promote its clothing and beauty products.  She said the firm published at least 30  u… [+1708 chars],2019-09-03T18:11:18Z
90,abc-news,ABC News,US construction spending rose a slight 0.1% in July,U.S. construction spending ticked up just 0.1% in July  aided by government spending on schools  sewers and the water supply.  The Commerce Department said Tuesday that spending on construction projects in July occurred at a seasonally adjusted annual pace of… [+622 chars],2019-09-03T14:04:53Z
94,business-insider,Business Insider,Cloudflare eyes $3.5 billion valuation in upcoming IPO,Cloudflare  a security startup that protects websites from attacks and helps pages load quickly  set a price range for its upcoming IPO  which could value the San Francisco company as high as $3.5 billion.    In a filing Tuesday  the company said it plans to … [+1382 chars],2019-09-03T13:30:50Z
98,abc-news,ABC News,Feds offers reprieve on immigrant medical care cases,Federal immigration authorities have at least partly reversed course on a controversial decision to stop considering requests for foreign nationals to remain in the country for medical treatment or other special circumstances.  U.S. Citizenship and Immigratio… [+556 chars],2019-09-03T17:22:44Z
102,reuters,Reuters,Guinea-Bissau police say 1.8 tonnes of cocaine seized in biggest ever haul,BISSAU (Reuters) - Police in Guinea-Bissau have seized more than 1.8 tonnes of cocaine hidden in flour bags in the biggest seizure in the country’s history  authorities said on Tuesday.   Police said the drugs had arrived by sea in the country’s northwest. Af… [+1490 chars],2019-09-03T15:29:54Z
106,abc-news,ABC News,Couple arrested for burglary 3 years after $500K lottery win,A Michigan couple who won $500 000 on a state lottery scratch-off ticket in 2016 has been charged in a string of burglaries.  MLive.com reports that 29-year-old Mitchell Arnswald and 28-year-old Stephanie Harvell were arraigned Friday on home invasion and pos… [+624 chars],2019-09-03T17:46:56Z
110,the-new-york-times,The New York Times,The Designer Bringing Whimsy  and Magic Mushrooms  to Fine Jewelry,When the New York jeweler Brent Neale Winston titled her debut fine jewelry collection After the Rain  it was an emotional response to what she calls a really bad year. During months of prescribed bed rest while pregnant with her twin daughters  Winston had c… [+1547 chars],2019-09-03T11:01:54Z
114,the-new-york-times,The New York Times,Why More Dogs and Cats Are Making It Out of Shelters Alive,Many shelters have been pushed along by no-kill advocates  who oppose euthanizing any healthy or treatable animal  often using a 90 percent live release benchmark. (A live release rate is essentially the inverse of the euthanasia rate  though not every shelte… [+1032 chars],2019-09-03T09:00:18Z
118,reuters,Reuters,South African police make more arrests as riots spread,JOHANNESBURG (Reuters) - South African police arrested more than 80 people and confirmed five deaths as riots in Johannesburg and the capital Pretoria intensified on Tuesday  spreading to surrounding townships with roving groups attacking mainly foreign-owned… [+2992 chars],2019-09-03T16:02:31Z
122,the-new-york-times,The New York Times,The World’s First Ambassador to the Tech Industry - The New York Times,As Mr. Klynge was exiting the building  the executive called his mobile phone to ask him to wait. Mr. Klynge thought there had been a change of heart.   Not so.   When I got back to the conference room he gave me a goody bag with a T-shirt and cap of the part… [+1348 chars],2019-09-03T09:00:00Z
126,the-irish-times,The Irish Times,Man bought €11.2m Lotto ticket with change from chicken fillet roll,A Co Wicklow man who scooped 11.2 million in the Lotto last month has said he bought the winning ticket with the change from buying a chicken fillet roll with a 10 note he received as a tip.  The man  who wishes to remain anonymous  was in National Lottery he… [+2105 chars],2019-09-03T12:35:25Z
130,reuters,Reuters,Pound sinks to three-year low as election threat adds to Brexit jeopardy,LONDON (Reuters) - Sterling sank to a three-year low below $1.20 on Tuesday as Prime Minister Boris Johnson’s implicit threat to lawmakers to support him on Brexit or face an election sent investors rushing to dump British assets.   The pound  which has lost … [+3914 chars],2019-09-03T15:59:42Z
134,cbs-news,CBS News,British Parliament poised to consider bill to stop no-deal Brexit,London -- A showdown between British Prime Minister Boris Johnson and lawmakers who disagree with his Brexit strategy began Tuesday as the U.K.'s House of Commons reconvened after its summer recess. Johnson has committed to pulling Britain out of the European… [+3473 chars],2019-09-03T15:20:12Z
138,cnn,CNN,These are the books on the coveted Booker Prize 2019 shortlist,,2019-09-03T09:23:44Z
142,abc-news,ABC News,The Latest: Boat passengers weren't wearing life jackets,The Latest on a boat capsizing along the White River in central Indiana (all times local):  11:20 a.m.  An Indiana conservation officer says it appears none of the passengers on a boat that capsized in an Indiana river  killing two people and leaving three mi… [+1478 chars],2019-09-03T15:22:38Z
146,cbs-news,CBS News,Huawei claims U.S. threatened employees and attacked network,Huawei claims the U.S. government is  using every tool at its disposal  to disrupt the Chinese telecommunications company's business operations  including harassing its employees and using cyberattacks against its computer systems.   Huawei made the claims in… [+1922 chars],2019-09-03T13:14:47Z
150,cnn,CNN,Transgender woman granted long term residency in Japan,,2019-09-03T11:15:07Z
154,al-jazeera-english,Al Jazeera English,â€˜Genocide cardâ€™ - Myanmar Rohingya verification scheme condemned,Cox's Bazar  Bangladesh - The National Verification Card (NVC) scheme targetting Myanmar's Rohingya Muslims is part of a systematic campaign by Myanmar authorities to erase their identity  according to a new report by Fortify Rights published on Tuesday.  The… [+5166 chars],2019-09-03T03:28:51Z
158,bbc-news,BBC News,Anak Krakatau: Volcano's tsunami trigger was 'relatively small',Image copyrightReutersImage caption   A phreatomagmatic eruption: The volcano's plumbing was reorganised in the flank collapse  The scale of the tsunami hazard from volcanoes that collapse into the sea has been underestimated.  That's the conclusion of a new … [+4740 chars],2019-09-03T14:02:27Z
162,newsweek,Newsweek,Donald Trump Congratulates Poland As Nation Marks Somber Anniversary of Nazi Invasion: 'We Also Have Many Polish People in Our Country',This week  Poland is observing a dark and traumatic anniversary. On Sunday  the country marked 80 years since Nazi forces began their invasion of the nation in 1939  signaling Europe's descent into what would become the Second World War.  The occasion was mar… [+3078 chars],2019-09-03T11:01:11Z
166,reuters,Reuters,Ethiopian opposition parties threaten election boycott,ADDIS ABABA (Reuters) - A coalition of Ethiopian opposition parties on Tuesday threatened to boycott a national vote next year without changes to an electoral law they view as biased towards the ruling party.   There have been regular parliamentary elections … [+2047 chars],2019-09-03T15:55:05Z
170,newsweek,Newsweek,Kristen Stewart Reflects On Robert Pattinson Romance  Coming Out,In a tell-all interview  Kristen Stewart opened up about her relationships. In an interview with Harper's Bazaar UKpublished Tuesday  the 29 year old discussed why she and her ex-boyfriend Robert Pattinson chose to keep their romance so private.   When me and… [+2371 chars],2019-09-03T17:13:09Z
174,the-wall-street-journal,The Wall Street Journal,At Least Five Dead as Hurricane Dorian Heads Toward Southeastern U.S.,,2019-09-03T09:30:00Z
178,business-insider,Business Insider,I haven't gotten a new iPhone in 3 years. Here's why I can't wait to buy the iPhone 11. (AAPL),Last year's iPhone XR.   Anton Novoderezhkin\TASS via Getty Images    We may be getting our first look at Apple's next iPhones on September 10  and I  for one  can't wait.    The new phones are said to be fairly similar to last year's iPhone XR  iPhone XS  an… [+2196 chars],2019-09-03T13:35:14Z
182,business-insider,Business Insider,Amazon's next-day shipping plan could boost sales by up to $24 billion (AMZN),,2019-09-03T13:52:24Z
186,business-insider,Business Insider,'It: Chapter Two' manages to entertain for nearly 3 hours and will be a huge box-office hit  but can feel too familiar,The Stephen King adaptation  It  was a box-office sensation two years ago  raking in $123 million domestically in its opening weekend  a record for a horror movie. It went on to make $700 million worldwide.    The upcoming sequel   It: Chapter Two   is sure t… [+3045 chars],2019-09-03T16:00:00Z
190,business-insider,Business Insider,11 shocking things about being a teacher that you'd never thought to ask,Many teachers strive to understand the way each of their students learn best  and help them in the best way possible. Yet crafting such specialized lesson plans requires time .    An anonymous high school teacher from California said she teaches more than 200… [+1001 chars],2019-09-03T15:13:55Z
194,the-irish-times,The Irish Times,Farmers group warns of potential beef shortages,There will be shortages of beef on supermarket shelves in the coming days if a major dispute with farmers is not resolved  the Irish Cattle and Sheep Farmers Association (ICSA) has claimed.   Edmond Phelan  president of the farmers group said the big supermar… [+3284 chars],2019-09-03T17:28:04Z
198,newsweek,Newsweek,FIBA Basketball World Cup 2019 Schedule: Where to Watch Team USA vs. Turkey  Live Stream  Team News  Latest Odds,Team USA takes on Turkey this Tuesday in the second round of group games at the FIBA World Cup.  The Americans' quest for an unprecedented third consecutive world title began in confident fashion with an 88-67 win against the Czech Republic in Shanghai  China… [+3352 chars],2019-09-03T02:00:01Z
202,the-new-york-times,The New York Times,A Potential Peace Deal With the Taliban,Mujib Mashal contributed reporting.  The Daily is made by Theo Balcomb  Andy Mills  Lisa Tobin  Rachel Quester  Lynsea Garrison  Annie Brown  Clare Toeniskoetter  Paige Cowett  Michael Simon Johnson  Brad Fisher  Larissa Anderson  Wendy Dorr  Chris Wood  Jess… [+363 chars],2019-09-03T10:16:17Z
206,espn,ESPN,Taggart: Dehydration possible factor in FSU loss,After watching Florida State wear down in Saturday's season-opening loss to Boise State  coach Willie Taggart is examining whether his players were properly hydrated.  On his weekly radio show Monday  Taggart said he has spoken with FSU's medical staff about … [+1498 chars],2019-09-03T15:16:00Z
210,newsweek,Newsweek,Prince Harry Launches Eco-Friendly Travel Scheme Amid Private Jet Criticism: 'No One Is Perfect',Prince Harry announce a new sustainable travel initiative called  Travalyst  on Tuesday to  mobilize the industry as a catalyst for good.  Examining sustainable practices in local areas  tackling climate change and environmental damage  and alleviating over-t… [+2266 chars],2019-09-03T14:34:48Z
214,the-wall-street-journal,The Wall Street Journal,WSJ Wealth Adviser Briefing: ETFs Grab Trading  Retirement Account Risks  Business Trip Troubles,Sep 3  2019 6:00 am ET   Exchange-traded funds have soared in size over the past decade. But where ETFs have really excelled is in grabbing trading  with far more trading now in several of the big ETFs than in the largest members of the indexes to which they … [+76 chars],2019-09-03T10:00:07Z
218,abc-news,ABC News,The Latest: 34 presumed dead in boat fire  search suspended,The Latest on the fire aboard a diving boat near a Southern California island that killed at least 25 people (all times local):  10:16 a.m.  Thirty four people are presumed dead in the California dive boat fire and the search has been suspended.  Santa Barbar… [+3546 chars],2019-09-03T17:22:12Z
222,cbs-news,CBS News,Eye Opener: Hurricane Dorian continues to pummel the Bahamas,,2019-09-03T11:12:55Z
226,reuters,Reuters,Dems slam Pence for staying at Trump's Ireland club,Reuters  the news and media division of Thomson Reuters  is the worlds largest international multimedia news provider reaching more than one billion people every day. Reuters provides trusted business  financial  national  and international news to profession… [+169 chars],2019-09-03T16:28:50Z
230,the-irish-times,The Irish Times,Johnny Sexton confident Ireland will reach their peak for Scotland clash,Okay  we have trust issues. The public with the Irish team. The Irish team with the media. All those fans  who after the match against England had their World Cup tickets flash into view in a thought bubble above their heads with I could sell them on Done Dea… [+3534 chars],2019-09-03T16:38:13Z
234,al-jazeera-english,Al Jazeera English,Guatemala's CICIG: UN-backed anti-corruption body shuts its doors,Guatemala City - A UN-backed anti-corruption commission that has brought down a Guatemalan president and vice president  as well as other high-ranking officials  will shut its doors on Tuesday after 12 years of operations.  Last year  President Jimmy Morales … [+3097 chars],2019-09-03T16:21:05Z
238,reuters,Reuters,Walmart to stop selling short-barrel rifle ammunition,(Reuters) - Walmart Inc said on Tuesday it would discontinue sales of some ammunition in stores across the United States  in response to the mass shootings in Texas last month that killed several people.   The largest U.S. arms retailer also said it would dis… [+1500 chars],2019-09-03T17:23:39Z
242,cnn,CNN,California boat that burned was in a 'worst-case scenario ' sheriff says,(CNN)Thirty-three people had signed up to spend what promised to be a glorious Labor Day weekend aboard the Conception  a 75-foot boat that offered a scuba diver's dream: unlimited diving among giant fish and colorful underwater sea life  with gourmet meals s… [+4771 chars],2019-09-03T07:02:37Z
246,cbs-news,CBS News,West Virginia's Joe Manchin to remain in Senate,,2019-09-03T15:14:42Z
250,abc-news,ABC News,Review: David Koepp delivers a chilling first novel, Cold Storage: a Novel  (Ecco)  by David Koepp  The story line in  Cold Storage  by David Koepp  the screenwriter for films including  Jurassic Park  and Sam Raimi's  Spider-Man   invokes classic horror films such as the 1982 version of  The Thing  and  Invas… [+1435 chars],2019-09-03T14:59:56Z
254,cnn,CNN,Robert Pattinson was blanking 'furious' over Batman leak,,2019-09-03T17:07:06Z
258,the-new-york-times,The New York Times,Coming of Age as an Immigrant Child Bride,There are limits to Cruzs choice to narrate Dominicana from Anas present-tense perspective; at times the novel ventures into scenes that Ana cant possibly know about. While were sometimes told shes piecing these together from conversations shes overheard  mor… [+1603 chars],2019-09-03T09:00:08Z
262,abc-news,ABC News,FM says Germany working to end Sudan's pariah status,Germany's top diplomat said Tuesday his country has been working to readmit Sudan into the international economy after the military's overthrow of autocratic President Omar al-Bashir in April amid mass protests against his three-decade rule.  Foreign Minister… [+2785 chars],2019-09-03T16:12:13Z
266,cbs-news,CBS News,Studying the mating habits of sharks,,2019-09-03T11:59:30Z
270,abc-news,ABC News,Mexico: Main suspect absolved in 2014 student disappearances,One of the main suspects in the 2014 disappearance of 43 teachers' college students in Mexico has been acquitted  as justice remains elusive for one of the darkest moments of the country's recent history.  Santiago Aguirre is director of the human rights cent… [+575 chars],2019-09-03T17:24:44Z
274,bbc-news,BBC News,Will a woman set foot on the Moon soon?,,2019-09-03T16:48:33Z
278,business-insider,Business Insider,Plant-based fast food isn't any healthier than the originals — and that's the point,Plant-based meat is taking over fast food. But  that doesn't necessarily mean your lunch is getting healthier.    Fast-food menu items created in partnership with companies like Impossible Foods and Beyond Meat are typically pretty similar nutritionally to th… [+3551 chars],2019-09-03T14:43:33Z
282,bbc-news,BBC News,Brexit: All-Ireland food zone considered as backstop solution,Image copyrightAFPImage caption   Officials appear to have dismissed having mobile food standards checks away from the Irish border  The prime minister has suggested he is open to an all-Ireland food standards zone as part of a solution to replace the Brexit … [+2412 chars],2019-09-03T16:04:16Z
286,cnn,CNN,Hurricane Dorian now Category 3  still a threat to US coast - CNN Video,Chat with us in Facebook Messenger. Find out what's happening in the world as it unfolds.,2019-09-03T06:07:39.2534378Z
290,the-wall-street-journal,The Wall Street Journal,Feminist Capitalist Professor Under Fire...,Philadelphia   When Camille Paglia was an obnoxious adolescent of 15  she had what she describes as this huge fight with a nun in upstate New York. Ms. Paglia  72  remembers the incident with a clarity that suggests a lifetime of unresolved umbrage.   We were… [+82 chars],2019-09-03T15:28:37Z
294,the-wall-street-journal,The Wall Street Journal,Lego’s Bid to Beat the Pack Results in Sharp Drop in Profit - The Wall Street Journal,Lego A/S reported a sharp drop in half-year profit as it plowed money into opening new stores  creating new products and making digital investments in a bid to stay ahead of fast-changing consumer behavior.  The Danish toy-brick maker Tuesday reported its net… [+202 chars],2019-09-03T08:45:00Z
298,newsweek,Newsweek,Colombia's Vice President Praises Ivanka Trump As 'A Brilliant Woman ' Says She Wants to Show Her How They Are Helping Migrant Women at the Border,President Donald Trump's daughter and adviser Ivanka Trump received a warm welcome from Colombia's Vice President Marta Lucía Ramírez on Monday evening  as she arrived in the country for the first stop on a tour across Latin America to help promote women's ec… [+2601 chars],2019-09-03T10:12:18Z
