id,source_id,source_name,title,content,published_at
2601,bbc-news,BBC News,Javi Gracia: Watford confirm manager departure,Watford picked up two points from their last eight Premier League games under Javi Gracia  Watford manager Javi Gracia has left his post  the Premier League club have announced.  The Spaniard  whose coaching team have also left Vicarage Road  had been in char… [+854 chars],2019-09-07T16:40:17Z
2605,newsweek,Newsweek,College Football 2019: Where to Watch Texas A&M vs. Clemson  TV Channel  Live Stream  Odds,Clemson began its title defense on the front foot last week  thrashing Georgia Tech 52-14 to extend its winning streak to 16 straight games dating back to last season.  On Saturday  the Tigers face their first Top-25 opponent of the campaign when they host No… [+3521 chars],2019-09-07T09:00:01Z
2609,abc-news,ABC News,Pakistan hosts Afghanistan  China for wide-ranging talks,Pakistan is hosting the third round of trilateral talks with Afghanistan and China to cover trade  counterterrorism and ending Afghanistan's 18-year war.  Pakistani Foreign Minister Shah Mahmood Qureshi said Saturday that talks are happening at a key moment i… [+417 chars],2019-09-07T08:57:56Z
2613,cnn,CNN,Man who hid spy camera in toilets at James Bond studios jailed for 16 months,London (CNN)A man has been sentenced to 16 months in jail after planting a spy camera in the women's toilets at Pinewood Studios  where the upcoming James Bond movie  No Time to Die  is being filmed  according to the Press Association (PA).  Peter Hartley who… [+2395 chars],2019-09-07T09:03:45Z
2617,business-insider,Business Insider,A brief history of how Trump came up with the false claim that Hurricane Dorian could hit Alabama,On Wednesday  his Alabama argument returned with full force. The president tweeted an  ensemble  of a spaghetti plot created by the South Florida Water Management District. He tweeted that it showed  models  of where the hurricane would go  but it actually ag… [+1314 chars],2019-09-07T14:38:05Z
2621,the-irish-times,The Irish Times,Gardaí await postmortem results after Cork city house fatality,Gardaí say that their investigation into the death of a 55-year-old man in Cork will be determined by the results of a postmortem.  Investigating officers are treating the discovery of the mans body at a rented house on Bandon Road on the citys southside as s… [+1296 chars],2019-09-07T13:26:52Z
2625,bbc-news,BBC News,2019/09/07 11:00 GMT,The latest five minute news bulletin from BBC World Service.,2019-09-07T11:06:00Z
2629,abc-news,ABC News,Iran atomic energy spokesman warns Tehran has the ability to increase uranium enrichment 'even more than 20%',Iran atomic energy spokesman warns Tehran has the ability to increase uranium enrichment 'even more than 20%',2019-09-07T06:14:26Z
2633,bbc-news,BBC News,Rugby World Cup: Ireland beat Wales 19-10 in final warm-up game,Welsh defenders try to halt the progress of Josh van der Flier in Dublin  <table><tr><th>Rugby World Cup warm-up</th></tr>  <tr><td>Ireland (7) 19</td></tr><tr><td>Tries: Kearney  Furlong  Ryan Cons: Sexton 2</td></tr><tr><td>Wales (10) 10</td></tr><tr><td>Tr… [+4681 chars],2019-09-07T14:59:35Z
2637,reuters,Reuters,Zimbabweans mourn founding father Mugabe but confused about burial,HARARE (Reuters) - Zimbabweans on Saturday mourned the death of their country’s founding father Robert Mugabe but confusion swirled about when his body would be returned from abroad or when he would be buried  two years after he was toppled in a coup.   Mugab… [+2271 chars],2019-09-07T12:26:51Z
2641,reuters,Reuters,Reports: Jones  Falcons finalizing three-year  $66 million deal,The Atlanta Falcons and wide receiver Julio Jones are working out the final details on a three-year contract extension worth $66 million  according to multiple reports on Saturday.   The NFL Network’s Ian Rapoport and Tom Pelissero both tweeted details of the… [+1087 chars],2019-09-07T16:22:22Z
2645,bbc-news,BBC News,Trump probed over military spending in Scotland,Image copyrightReuters  A US Congressional committee is investigating President Donald Trump in connection with a potential conflict of interest over military spending at a Scottish airport near his golf resort.   The House Oversight and Reform Committee says… [+2341 chars],2019-09-07T17:05:34Z
2649,al-jazeera-english,Al Jazeera English,Hurricane Dorian death toll tops 40  hundreds remain missing,The death toll from the massive Hurricane Dorian has risen to at least 43 across the Bahamas  but authorities warn they expect  a  staggering  number of casualties as hundreds of people remain missing.  The most powerful hurricane on record to hit the Bahamas… [+4673 chars],2019-09-07T10:06:59Z
2653,the-irish-times,The Irish Times,US Open: Rafael Nadal has 19th major in sight after reaching final,Rafael Nadal reached his fifth US Open final and third grand slam final of the year beating the big-serving Italian Matteo Berrettini in straight sets on Friday night. He will now start as favourite on Sunday against the games latest bad boy  Daniil Medvedev … [+4255 chars],2019-09-07T10:33:30Z
2657,the-irish-times,The Irish Times,Lamb chop tray bake,Ingredients  <ul><li>10/12 lamb chops</li><li>1 fennel bulb  sliced</li><li>2 red onions  sliced</li><li>4 cloves garlic  smashed</li><li>1 sprig rosemary</li><li>100g pitted kalamata olives</li><li>Good quality olive oil</li><li>Sea salt and black pepper</li… [+664 chars],2019-09-07T05:00:00Z
2661,cnn,CNN,Bahamas resident: Everyday we hear about new bodies found,Chat with us in Facebook Messenger. Find out what's happening in the world as it unfolds.,2019-09-07T12:55:27Z
2665,abc-news,ABC News,Pain of scuba diving deaths off California felt across globe,Less than a year ago  Tia Salika was wearing an animal-print scuba suit and posing for a photograph in the depths of the iridescent blue ocean off South America with her parents and her best friend.  So it seemed only fitting that the high schooler would cele… [+4860 chars],2019-09-07T15:24:29Z
2669,cbs-news,CBS News,Hurricane Dorian leaves devastation in North Carolina,September 7  2019 / 9:54 AM   / CBS News  Hurricane Dorian leaves devastation in North Carolina  Hurricane Dorian fast facts  <ul><li>The Bahamas are recovering after Dorian decimated the islands for 48 hours  killing at least 43 people.</li><li>Nearly 70 000… [+13357 chars],2019-09-07T13:55:12Z
2673,reuters,Reuters,Mick Jagger swaps stage for set in art thriller 'The Burnt Orange Heresy',VENICE  Italy (Reuters) - Rolling Stones frontman Mick Jagger swaps the stage for a film set in “The Burnt Orange Heresy”  a thriller about a dishonest and greedy art critic desperate for success and recognition.   “The Square” actor Claes Bang plays the main… [+2083 chars],2019-09-07T16:05:42Z
2677,the-irish-times,The Irish Times,Ronan Byrne through to final in Greece,Ronan Byrne advanced to the A Final at the European Under-23 Rowing Championships in Ioannina  Greece. The Corkman  who took silver in the doubles at the senior World Championships last week  won his repechage of the single sculls. He had finished second in h… [+916 chars],2019-09-07T14:45:54Z
2681,reuters,Reuters,Three killed in renewed fighting in southern Tripoli: witness,TRIPOLI (Reuters) - At least three fighters aligned with Libya’s U.N.-backed Government of National Accord (GNA) were killed in an offensive on Saturday aimed at pushing back eastern forces led by commander Khalifa Haftar  a witness said.   The clashes betwee… [+1101 chars],2019-09-07T14:58:24Z
2685,cnn,CNN,Leonardo da Vinci may have painted another 'Mona Lisa.' Now  there's a legal battle over who owns it,artsPublished 7th September 2019  With her straight dark hair and beguiling smile  the so-called  Isleworth Mona Lisa  bears an uncanny resemblance to her namesake in the Louvre.   To some experts  these similarities suggest the painting is a mere copy  thoug… [+8705 chars],2019-09-07T00:24:51Z
2689,the-irish-times,The Irish Times,Irish farmhouse apple pie: A nurturing dessert loved by all ages,Is there anything more homely than apple pie? It must be one of the most nurturing desserts  loved by adults and children alike. The aroma of a freshly baked apple pie takes me right back to my childhood.  I would be sent out into my grandfathers garden and f… [+3446 chars],2019-09-07T05:00:00Z
2693,the-wall-street-journal,The Wall Street Journal,Iran Accelerates Nuclear Research  Threatens to Boost Uranium Stockpile,Iran said Saturday it had accelerated its nuclear research work and threatened to take fresh steps within a month that could allow it to expand its stockpile of enriched uranium  a material that can be used to fuel a nuclear weapon.  The move comes after Euro… [+278 chars],2019-09-07T10:47:00Z
2697,the-new-york-times,The New York Times,Help! There’s a Bear in My Airbnb,Shockingly no  but the parents should have gone to jail for endangering a child  and a bear. We dont want people to get hurt  but we also dont want bears to get hurt.  People dont understand. They have a city mentality; theyve grown so out of touch with the n… [+1869 chars],2019-09-07T06:11:42Z
2701,cbs-news,CBS News,Typhoon Lingling knocks out power for thousands in South Korea,Typhoon winds toppled trees  grounded planes and left thousands of South Korean homes without electricity on Saturday as a powerful storm system brushed up against the Korean Peninsula. Strong winds and rain from Typhoon Lingling caused power outages in some … [+1700 chars],2019-09-07T02:41:04Z
2705,al-jazeera-english,Al Jazeera English,African Union lifts suspension of Sudan,The African Union (AU) has lifted its suspension of Sudan's membership in the bloc  ending a three-month freeze that had been in place pending the installation of a civilian-led government after the removal of long-term President Omar al-Bashir.  The move on … [+2259 chars],2019-09-07T07:35:08Z
2709,reuters,Reuters,Serena poised for record-tying U.S. Open final,Reuters  the news and media division of Thomson Reuters  is the worlds largest international multimedia news provider reaching more than one billion people every day. Reuters provides trusted business  financial  national  and international news to profession… [+169 chars],2019-09-07T17:04:56Z
2713,cnn,CNN,Eva Longoria and other celebrities write letters of support for actress Felicity Huffman ahead of her sentencing,,2019-09-07T01:57:01Z
2717,bbc-news,BBC News,Ashes: England's Jofra Archer dismisses Australia's Marnus Labuschagne at Old Trafford,,2019-09-07T14:40:31Z
2721,cnn,CNN,Young Dorian survivor saw woman get swept away with baby,Chat with us in Facebook Messenger. Find out what's happening in the world as it unfolds.,2019-09-07T11:18:54Z
2725,the-irish-times,The Irish Times,Against Interpretation and Other Essays by Susan Sontag (1966),When I watched the 2014 documentary Regarding Susan Sontag  the ending struck me as a disturbing parable of the western intellectual condition. Sontag  a woman as erudite as anybody in the 20th century  is informed that she is dying of cancer. She refuses to … [+1858 chars],2019-09-07T05:00:00Z
2729,bbc-news,BBC News,Maidenhead United v Dagenham & Redbridge,,2019-09-07T10:29:47Z
2733,bbc-news,BBC News,Burglary suspect 'looks like Four Weddings and a Funeral actor John Hannah',Image copyrightAvon and Somerset Police/Getty ImagesImage caption   The burglar bears a striking resemblance to the Scots actor  according to some Facebook posts  A burglary suspect's image published by police has been ridiculed by Facebook users  with some l… [+505 chars],2019-09-07T10:38:09Z
2737,the-irish-times,The Irish Times,My tribute to culinary Beirut  where West meets East,Last March I went to Beirut a stunning place to be at that time of year. There are green almonds and broad beans everywhere you look  as well as a vast array of bananas for sale on the sides of the roads.  We arrived in the middle of the night and woke in the… [+3932 chars],2019-09-07T05:00:00Z
2741,reuters,Reuters,Turkey's Erdogan says will discuss Syria with Trump at U.N.,ISTANBUL (Reuters) - Turkish President Tayyip Erdogan said on Saturday he expects to meet U.S. President Donald Trump at the United Nations later this month to discuss military operations in northeast Syria  where Turkey plans to resettle one million Syrian r… [+2184 chars],2019-09-07T16:59:25Z
2745,the-new-york-times,The New York Times,What Happens When a Landlord Flouts the New Rent Laws?,When you pass laws  you expect them to be followed. It shouldnt take punitive measures to follow the law  said Linda B. Rosenthal  a New York State Assemblywoman whose district includes the Upper West Side  adding that if more than one tenant is named on the … [+711 chars],2019-09-07T14:04:35Z
2749,bbc-news,BBC News,Ukraine and Russia exchange prisoners in landmark deal,Image copyrightAFPImage caption   Volodymyr Tsemakh was seized from a separatist-held part of Ukraine earlier this year  A long-awaited exchange of prisoners being held by Russia and Ukraine appears to be under way.   Buses from a Russian jail headed towards … [+3980 chars],2019-09-07T07:37:37Z
2753,cnn,CNN,Joe Biden says it's 'totally appropriate' for voters to consider his age,,2019-09-07T16:24:57Z
2757,reuters,Reuters,Trump congratulates Russia and Ukraine on prisoner swap,(Reuters) - U.S. President Donald Trump on Saturday congratulated Russia and Ukraine on a long-awaited prisoner swap that could thaw a deep freeze in relations between the two countries since Moscow’s annexation of the Crimea region in 2014.   Trump said in a… [+129 chars],2019-09-07T14:19:00Z
2761,reuters,Reuters,British lawmakers prepare court action to enforce Brexit delay,LONDON (Reuters) - British lawmakers are preparing legal action in case Prime Minister Boris Johnson tries to defy legislation compelling him to seek a further delay to Brexit  opposition Labour Party leader Jeremy Corbyn said on Saturday.   An opposition bil… [+3856 chars],2019-09-07T13:04:55Z
2765,cnn,CNN,Great North Run organizers accidentally send 5k competitors the wrong way,(CNN)Organizers of the Great North Run  the world's largest half marathon which takes place from Newcastle to South Shields every September  have apologized after sending runners of an associated 5 kilometer race (3.1 miles) the wrong way.   The Great North 5… [+1140 chars],2019-09-07T15:10:51Z
2769,cnn,CNN,America's top ally in Syria warns ISIS is resurging,(CNN)America's top ally in the fight against ISIS  the commander of the Kurdish-led Syrian Democratic Forces  warned Friday that the terrorist group was resurging in Syria and asked for increased US support for his troops as they seek to keep ISIS from reesta… [+9454 chars],2019-09-07T16:30:16Z
2773,espn,ESPN,Team USA upset with Antetokounmpos after foul,SHENZHEN  China -- Giannis Antetokounmpo and his brother Thanasis Antetokounmpo had to be separated from members of Team USA after a controversial foul triggered emotions in the World Cup Saturday night.  With 1:43 left and the U.S. on the way to a 69-53 vict… [+1524 chars],2019-09-07T15:51:00Z
2777,the-irish-times,The Irish Times,Death toll from devastating Hurricane Dorian rises to 43,Search-and-rescue teams were still trying to reach some Bahamian communities isolated by floodwaters and debris after Hurricane Dorian  as the death toll rose to 43.  Officials said the number was likely to increase.  Prime minister Hubert Minnis said late on… [+2263 chars],2019-09-07T16:52:31Z
2781,the-irish-times,The Irish Times,Claire Byrne: ‘My parents had to stand by the bed while I got the last rites’,THE RTÉ PRESENTER GREW UP IN A FAMILY THAT HAD BIG CONVERSATIONS ABOUT WHO TO VOTE FOR. CHILDHOOD MENINGITIS PERMITTING  IT WAS THE BEGINNING OF HER PASSION FOR POLITICS  DEBATE AND LIVE BROADCASTING   Claire Byrne is in the studio hosting the News at One  on… [+16204 chars],2019-09-07T05:03:00Z
2785,abc-news,ABC News,Maduro rejects talks with opposition over envoy's remarks,Venezuelan President Nicolas Maduro says he won*t resume talks with the opposition until it rejects calls by a top opposition supporter in Britain that Venezuela give up its longstanding claims to an oil-rich part of neighboring Guyana.  Maduro's comments lat… [+580 chars],2019-09-07T00:39:12Z
2789,reuters,Reuters,Syrian army foils drone attack on military base in northwest,BEIRUT (Reuters) - The Syrian army said on Saturday its air defences foiled a drone attack by “terrorist” groups on a main military base in northwestern Syria where a Russian-brokered ceasefire has stopped months of fighting.   The three drones  which were ca… [+528 chars],2019-09-07T11:13:19Z
2793,cnn,CNN,Harris releases plan to give VA benefits to veterans with less-than-honorable discharges and reverse military transgender ban,Manchester  NH (CNN)Democratic presidential candidate Kamala Harris released a new plan Saturday that aims to expand Veteran Affairs health care and housing assistance for some veterans and reverse the Trump administration's ban on transgender recruits joinin… [+2355 chars],2019-09-07T15:19:59Z
2797,business-insider,Business Insider,Lyft's newest service: Driving yourself (LYFT),Lyft is trialling a car-rental service in California  the company confirmed to Business Insider this week.    The service  which works much like a traditional car-rental  is available in San Francisco  Oakland  and Los Angeles. It also comes with a $40 credit… [+1232 chars],2019-09-07T13:13:00Z
2801,abc-news,ABC News,'Only animals can live here': Storm victims await evacuation,Carrying their meager possessions in duffel bags and shopping carts  hundreds of desperate storm victims gathered at the port in Grand Abaco on Friday in hopes of getting off the hurricane-devastated island  amid signs of rising frustration over the pace of t… [+3569 chars],2019-09-07T04:07:58Z
2805,business-insider,Business Insider,Google Maps is still pointing people who search for abortion clinics to anti-abortion groups  a new report found (GOOG  GOOGL),In areas where there are no abortion clinics  Google Maps isn't leading people who search for abortion clinics to the nearest center that performs the procedure.    Instead  Google Maps often directs people to centers that don't offer abortions  and some of t… [+1898 chars],2019-09-07T12:30:00Z
2809,the-new-york-times,The New York Times,Two Men Kiss in a Comic Book  and a Mayor Orders a Raid,The comic book in question  published in 2010 under the title Avengers: The Childrens Crusade  shows the superheroes Hulkling and Wiccan  who are boyfriends  kissing. The book  which had sold out by the time the agents arrived  tells the story of Wiccans effo… [+1155 chars],2019-09-07T16:33:28Z
2813,newsweek,Newsweek,The 12 Best Products of IFA 2019,It is tech heaven inside the sprawling Messe Berlin exhibition hall for the next five days  as firms from around the globe converge on the German capital of Berlin to show off new products to millions of attendees  all swarming the halls hoping for a glimpse … [+10157 chars],2019-09-07T04:00:01Z
2817,cbs-news,CBS News,Three more deaths and at least 450 illnesses linked to vaping,Officials on Friday in Indiana  California and Minnesota reported deaths in their states linked to vaping. Previous deaths have been reported in Illinois and Oregon.  Indiana health officials confirmed a patient died from a severe lung injury; Minnesota healt… [+3221 chars],2019-09-07T02:41:09Z
2821,reuters,Reuters,Climate change activists storm red carpet at Venice Film Festival,VENICE  Italy (Reuters) - Several hundred demonstrators took over the red carpet at the Venice Film Festival on Saturday  demanding action to fight climate change and a ban on cruise ships entering the lagoon city.   Wearing white boiler suits over their clot… [+1588 chars],2019-09-07T11:19:51Z
2825,cbs-news,CBS News,Storm Hunter shares his experience with Hurricane Dorian,,2019-09-07T00:03:32Z
2829,cbs-news,CBS News,NOAA backs up Trump's claim that Dorian could impact Alabama,The National Oceanic and Atmospheric Administration backed up President Trump's ongoing assertions that Alabama appeared initially to be in the path of Hurricane Dorian. His claims have attracted more attention since he appeared earlier this week holding an o… [+3649 chars],2019-09-07T01:46:42Z
2833,bbc-news,BBC News,Kosovo beat Czech Republic to boost Euro 2020 dream,Kosovo are unbeaten after four qualifying games for the European Championship  having failed to win in 10 2018 World Cup qualifiers  Kosovo beat the Czech Republic to go above England at the top of Euro 2020 qualifying Group A and boost their hopes of reachin… [+743 chars],2019-09-07T15:07:58Z
2837,cnn,CNN,After nearly 17 years  'Bad Boys II' is getting a sequel. That wait is nothing compared to these movie sequels,(CNN)After nearly 17 years  we're finally getting a sequel to  Bad Boys II  called  Bad Boys for Life.  Seventeen years may be an excruciatingly long wait for a movie sequel  but it doesn't crack the top 20 for the longest gaps between movies.  Even so  getti… [+4352 chars],2019-09-07T06:56:51Z
2841,bbc-news,BBC News,Released oil tanker 'photographed off Syria',Image copyrightAFPImage caption   The Adrian Darya-1  formerly the Grace 1  was released after Iran said it would not head to Syria  The Iranian oil tanker at the centre of an international incident has been sailing just off the Syrian coast  satellite images… [+2760 chars],2019-09-07T12:27:21Z
2845,abc-news,ABC News,Police: Biker mag 'fiction' leads to arrest in 1972 killing,An Ohio prison inmate's writing published in biker magazines was cited by police in charging him with the shooting death of a motorist found along the Pennsylvania Turnpike in 1972  police said Friday.  Larry Joseph Via  75  was charged with criminal homicide… [+2792 chars],2019-09-07T00:39:41Z
2849,the-new-york-times,The New York Times,A Mountain Top Called ‘Little Man’ Falls in Norway  and Residents Weep,For me  it was quite good timing  Ms. Majala said in an interview  noting how the fall happened right before she took parental leave.  The mountain tops pending collapse had kept all her colleagues on edge  she said  forcing them to regularly cancel vacations… [+1614 chars],2019-09-07T14:19:28Z
2853,the-irish-times,The Irish Times,Ireland go to number one with win over Wales,Ireland 19 Wales 10  Ireland will depart for the World Cup in Japan with the wind in their sails and ranked as the number one team in world rugby following todays win over Wales at the Aviva Stadium. Tries from Rob Kearney  Tadhg Furlong and James Ryan secure… [+2727 chars],2019-09-07T14:52:18Z
2857,the-irish-times,The Irish Times,The unknown mother and baby home  Blackrock  Dublin,Around the corner from the house where I grew up in Blackrock  Co Dublin  set back from a road called Temple Hill on the slope leading down to Dublin Bay  stands a stately old Georgian manor.  Today  Neptune House is surrounded by a ring of freshly built hous… [+16590 chars],2019-09-07T05:00:00Z
2861,abc-news,ABC News,Staying Cool When the Sun Shines Bright at the Disneyland Resort,Right now there are so many new things to see and do at the Disneyland Resort  that its a great time to visit! As the Southern California sun shines bright  here are some ways to keep cool during your stay:   First up is Disneyland park!   Break away from the… [+2684 chars],2019-09-07T00:03:00Z
2865,bbc-news,BBC News,Ukraine and Russia exchange prisoners in landmark deal,Russia and Ukraine has exchanged prisoners today. Planes from the two countries brought the freed inmates to Moscow and Kiev with a total of 70 prisoners involved. Relations between the countries have been fraught ever since Russia annexed the Ukrainian regio… [+605 chars],2019-09-07T13:06:00Z
2869,cbs-news,CBS News,Oakland Raiders release Antonio Brown,The Dish: Chef Victoria Blamey  Born in Santiago  Chile  Victoria Blamey was a college student studying history when she changed her plans and went off to cooking school. That led to jobs in Britain  Australia  Spain  and New York  where she won acclaim for r… [+348 chars],2019-09-07T16:03:27Z
2873,the-new-york-times,The New York Times,Climate Change Takes Center Stage: This Week in the 2020 Race,He also criticized the Mexico City agreement  a federal policy that bars foreign aid to any organization that performs or actively promotes abortion as a method of family planning. Because many groups that provide birth control and other services also perform… [+1052 chars],2019-09-07T12:52:38Z
2877,reuters,Reuters,Raiders release disgruntled WR Brown,The Oakland Raiders abruptly released wide receiver Antonio Brown on Saturday  just two days before the team’s season opener against the Denver Broncos.   The move caps a tumultuous week in Oakland and comes just hours after the wide receiver posted a message… [+3386 chars],2019-09-07T16:22:32Z
2881,reuters,Reuters,Demonstrators protest against no-deal Brexit in central Berlin,BERLIN (Reuters) - Dozens of demonstrators belonging to a group called “Stop the Coup” gathered in central Berlin on Saturday to protest against a no-deal Brexit.   The protesters  who collected signatures for a petition  said they wanted to defend British de… [+986 chars],2019-09-07T11:51:25Z
2885,abc-news,ABC News,NOAA issues statement supporting Trump's claim Hurricane Dorian threatened Alabama,Five days after Donald Trump said Hurricane Dorian threatened Alabama  the National Oceanic and Atmospheric Association issued a statement late Friday supporting the president's claim and chastising a local branch of the National Weather Service.  Interested … [+3215 chars],2019-09-07T00:13:00Z
2889,bbc-news,BBC News,2019/09/07 10:00 GMT,The latest five minute news bulletin from BBC World Service.,2019-09-07T10:06:00Z
