id,source_id,source_name,title,content,published_at
7541,bbc-news,BBC News,Chirac's death: French head to palace to remember leader,Image copyrightGetty ImagesImage caption   Mourners sign a book of condolence at the Élysée Palace beside a picture of the late president  France is paying its respects to ex-President Jacques Chirac  ahead of a public ceremony in Paris on Sunday and a day of… [+3842 chars],2019-09-27T13:44:07Z
7545,cbs-news,CBS News,9/26/19: CBSN Evening News,,2019-09-27T01:47:46Z
7549,the-new-york-times,The New York Times,Oleg Sentsov: Russian by Blood and Language  Ukrainian in Spirit,When Russia in March 2014 sent troops in uniforms stripped of insignia to seize the government building in the Crimean capital  Simferopol  his hometown  Mr. Sentsov left Kiev and went home to try to rally resistance to the takeover. Many residents  including… [+1694 chars],2019-09-27T15:33:02Z
7553,bbc-news,BBC News,MP Jess Phillips' Birmingham office disturbance: Man charged,Image copyrightHouse of CommonsImage caption   Police were called to a disturbance outside Jess Phillips' constituency office on Thursday  A 36-year-old man has been charged with a public order offence after a disturbance outside an MP's office.  Police were … [+567 chars],2019-09-27T15:14:06Z
7557,abc-news,ABC News,Documents: Ex-GOP chair for North Carolina to plead guilty,A former North Carolina GOP chairman will admit in court that he lied to federal agents conducting a bribery probe of a major political donor.  The federal court docket shows that Robin Hayes is scheduled to enter a guilty plea on Oct. 2. A factual basis docu… [+526 chars],2019-09-27T15:34:26Z
7561,cbs-news,CBS News,Trump suggests  spies and treason  to blame for whistleblower probe,Washington — President Trump has criticized both Democrats and the whistleblower who raised concerns he may have used his office for political gain. At a private event in New York on Thursday  the president compared the intelligence officer and any White Hous… [+4781 chars],2019-09-27T10:57:40Z
7565,business-insider,Business Insider,Suicide rate for active-duty US troops hits 5-year high  Pentagon reveals,The suicide rate among active-duty US military personnel spiked to a five-year high in 2018  a new Pentagon report revealed Thursday. Indeed  the toll of 325 troops who died by their own hand is the highest toll since the Pentagon began tracking this in 2001.… [+2042 chars],2019-09-27T17:11:23Z
7569,business-insider,Business Insider,7 bad habits that will keep you from getting rich  according to a man who studied over 200 millionaires,Habits are daily  often unconscious  behaviors that either contribute to or inhibit our success.   Thomas C. Corley  a certified public accountant and certified financial planner  spent five years studying millionaires and gathered his insights in multiple bo… [+939 chars],2019-09-27T16:10:18Z
7573,the-new-york-times,The New York Times,Finn Wittrock of ‘Judy’ Visits His Old Juilliard Haunts,So Acts 2 and 3 were set  but what to do for a curtain raiser? Mr. Wittrock deliberated.  That place  Empire Szechuan  was like the Chinese place  he said  and pointed across the road at a maroon awning. His expression did not exude confidence.  Pizza-less  M… [+921 chars],2019-09-27T17:00:04Z
7577,the-new-york-times,The New York Times,South of Sydney  the Australian Coast Becomes Its Own Destination,Australias Eurobodalla  Shoalhaven and Sapphire coasts run about 250 miles from the dairy town of Berry two hours south of Sydney via the Grand Pacific Drive  which is bordered by rolling farmland on one side and gleaming ocean on the other down to a historic… [+1743 chars],2019-09-27T09:00:22Z
7581,cbs-news,CBS News,What we know about the whistleblower complaint over Trump's Ukraine call,,2019-09-27T00:05:30Z
7585,cbs-news,CBS News,Preview: Singer  actress and author Olivia Newton-John talks about breast cancer  beating the odds and not asking  Why me? ,Actress  author and singer Olivia Newton-John opens up to  CBS This Morning  co-host Gayle King about her ongoing battle with breast cancer  her plans to beat the odds for her diagnosis  and finding a purpose in her illness  in an emotional interview to be br… [+3165 chars],2019-09-27T18:21:41+00:00
7589,cnn,CNN,King: If you haven't read complaint by now  get another job,Chat with us in Facebook Messenger. Find out what's happening in the world as it unfolds.,2019-09-27T18:18:56Z
7593,business-insider,Business Insider,Wells Fargo bumped their new CEO's salary 40% — to $23 million — to convince him to join (WFC),Robert Galbraith/Reuters  <ul><li>Wells Fargo announced Friday that Charles Scharf of BNY Mellon will be its new CEO.</li><li>A filing revealed that Scharf was offered a 40% salary bump — to $23 million — for the top position at the bank  Bloomberg reported. … [+1726 chars],2019-09-27T18:21:43Z
7597,abc-news,ABC News,1 person shot  wounded by police at Portland airport,Officials say that a person has been shot and wounded at Portland International Airport and is expected to survive.  KATU-TV reports the person was shot at Friday morning and that the incident was initially reported at 5:20 a.m. as a disturbance at a baggage … [+404 chars],2019-09-27T14:44:26Z
7601,bbc-news,BBC News,2019/09/27 17:00 GMT,The latest five minute news bulletin from BBC World Service.,2019-09-27T17:06:00Z
7605,al-jazeera-english,Al Jazeera English,UK-flagged tanker Stena Impero seized in July leaves Iranian port,The British-flagged Stena Impero tanker detained by Iran is finally leaving the Bandar Abbas port two months after it was seized  according an Iranian shipping organisation.  The Stena Impero was detained by Iran's Revolutionary Guards in the Strait of Hormuz… [+2522 chars],2019-09-27T07:30:04Z
7609,the-irish-times,The Irish Times,School in which murdered teacher Clodagh Hawe worked names hall in her honour,A school in Meath has unveiled a new hall in memory of their former teacher Clodagh Hawe  who was murdered with her three children by her husband and their father.  The 39-year-old teacher was getting ready to teach 3rd class at Scoil Catriona Naomha in Orist… [+2373 chars],2019-09-27T14:40:00Z
7613,cnn,CNN,'He's one of our family now': Everton fans show solidarity with racism victim Moise Kean,(CNN)With his arms outstretched and defiance in his eyes  Moise Kean's celebration in front of the Cagliari fans that had been racially abusing him became one of the defining images of European football last season.  After the incident  one of a growing numbe… [+6459 chars],2019-09-27T17:16:24Z
7617,abc-news,ABC News,Protesters in Haiti burn businesses in push to oust leader,Protesters seeking to oust Haitian President Jovenel Moise have attacked businesses and a police station  and opposition leaders are pledging that there will be no peace until he resigns.  Leaders of opposition parties have sent groups of young men onto the s… [+564 chars],2019-09-27T14:57:41Z
7621,cnn,CNN,Elon Musk is fighting multiple really ugly court fights at once,,2019-09-27T16:28:01Z
7625,reuters,Reuters,Fiat Chrysler to pay $40 million over inflated sales figures: SEC,WASHINGTON (Reuters) - Fiat Chrysler Automobiles NV will pay $40 million for misleading investors about its monthly sales figures and will resolve a lengthy probe by the U.S. Securities and Exchange Commission (SEC).   The SEC said between 2012 and 2016  the … [+450 chars],2019-09-27T16:36:44Z
7629,bbc-news,BBC News,Greenock stabbing victim was 'targeted' by killer,Image copyrightGoogleImage caption   Police said the incident on Maple Road  Greenock  was reported as a disturbance on Thursday night.  A murder investigation has begun after a man was stabbed to death in Greenock in a  targeted attack .  The 27-year-old  wh… [+777 chars],2019-09-27T14:51:47Z
7633,cbs-news,CBS News,Emotional town halls become centerpiece of Bernie Sanders' campaign,In many ways  September has been a rough month for Bernie Sanders and his campaign. They have dealt with staff shakeups in New Hampshire and Iowa  and multiple polls in recent weeks have shown the senator's support in early states slipping.   But on the trail… [+5056 chars],2019-09-27T17:12:34Z
7637,business-insider,Business Insider,I just drove a $44 000 Nissan Leaf Plus and I don't understand why everybody isn't buying this car,,2019-09-27T18:42:02Z
7641,reuters,Reuters,Disney  Sony strike deal to keep Spider-Man in Marvel universe,(Reuters) - Marvel Studios will continue to produce the Spider-Man Homecoming series  Sony Pictures Entertainment and Walt Disney Studios said on Friday  heading off fans’ fears that the popular superhero would disappear from the Marvel Cinematic Universe (MC… [+1073 chars],2019-09-27T15:55:34Z
7645,business-insider,Business Insider,These $600 bookshelf speakers have excellent sound quality for the price — they are a mainstay in my home theater setup,A great pair of speakers can transform your living room experience. Problem is  if you're an audiophile then most consumer-grade speakers simply won't live up to what you're looking for. That's where products like the Q-Acoustics 3020i speakers come in for th… [+7819 chars],2019-09-27T17:19:09Z
7649,the-wall-street-journal,The Wall Street Journal,DirecTV Rethinks NFL Sunday Ticket Deal Amid Cord-Cutting,The National Football Leagues Sunday Ticket package  which allows football fans to view almost any game  has long been a cornerstone of satellite broadcaster DirecTV  which holds exclusive rights to the offering.The companys chief operating officer    John St… [+3644 chars],2019-09-27T16:52:00Z
7653,the-irish-times,The Irish Times,Ireland under-21 meeting with Italy in Tallaght sells out,Irelands under-21 game against Italy next month has sold out with the FAI announcing on Friday morning that all seats at the roughly 8 000 seat venue have now been allocated.  The associations season ticket holders are entitled to attend under-21 internationa… [+1476 chars],2019-09-27T15:58:28Z
7657,business-insider,Business Insider,Latam Airlines spikes 33% after Delta investment (LTM  DAL),LATAM  <ul><li>Delta Airlines announced a plan to purchase a 20% stake in Latam Airlines for $1.9 billion on Thursday.</li><li>The company will also invest $350 million to  support the establishment of the strategic partnership   bringing the total deal size … [+2187 chars],2019-09-27T15:31:21Z
7661,business-insider,Business Insider,'Lawyer up': DOJ veterans have one piece of advice for Trump and Giuliani amid the Ukraine whistleblower scandal,Justice Department veterans have one piece of advice for President Donald Trump and those around him in the wake of an explosive whistleblower scandal this week: Lawyer up.  The House Intelligence Committee released on Thursday a whistleblower complaint that … [+10771 chars],2019-09-27T18:08:17Z
7665,the-new-york-times,The New York Times,Cobie Smulders Is a Pacifist. But for ‘Stumptown ’ She’s Willing to Kick Butt.,Im literally strapped into stunt gear  like pads and a backpack  in a really weird seated position on my couch. We are doing a pretty intense fight thats taking place in a kitchen. Its always a fascinating thing when youre on a series and every week you have … [+2021 chars],2019-09-27T14:00:06Z
7669,the-wall-street-journal,The Wall Street Journal,Aborted IPO Leaves Endeavor Casting For Next Move - The Wall Street Journal,LOS ANGELESWhen   Ari Emanuel  left an established talent agency and founded Endeavor Group Holdings Inc. with three others in 1995  it was a good time to be a Hollywood agent.Movie stars like Jim Carrey and Julia Roberts were signing record film deals  telev… [+5882 chars],2019-09-27T15:03:00Z
7673,al-jazeera-english,Al Jazeera English,Thousands in New Zealand kickstart new wave of climate protests,Ten of thousands of people took to the streets of New Zealand on Friday to kick off a second wave of worldwide protests demanding immediate action on climate change.  Scores of rallies were held in towns and cities across the country with children in school u… [+2704 chars],2019-09-27T04:30:08Z
7677,cnn,CNN,First on CNN: White House says lawyers directed moving Ukraine transcript to highly secure system,,2019-09-27T14:50:30Z
7681,reuters,Reuters,U.S. eyeing possibility of delisting Chinese firms from U.S. exchanges: source,WASHINGTON (Reuters) - The U.S. government is considering the possibility of delisting Chinese companies from U.S. exchanges  a source briefed on the matter said  in what would be an escalation of trade tensions between the U.S. and China.   The move would be… [+205 chars],2019-09-27T16:38:27Z
7685,cnn,CNN,Look and feel good: How tech could save the fashion industry,,2019-09-27T12:29:37Z
7689,the-irish-times,The Irish Times,Trump denies offering to remove sanctions on Iran for talks,US president Donald Trump has denied he offered to remove all sanctions on Iran in exchange for talks  contradicting comments made by the Iranian president earlier on Friday.  Hassan Rouhani said the US had made the approach to facilitate a meeting but Tehran… [+1682 chars],2019-09-27T15:32:27Z
7693,al-jazeera-english,Al Jazeera English,N Korea pins hopes on Trump  but casts doubt on future talks,North Korea on Friday praised US President Donald Trump as  different from his predecessors  as well as  wise  and  bold   even as it cast doubt on prospects for a future summit.  Kim Kye Gwan  an adviser to North Korea's foreign ministry  described the idea … [+1745 chars],2019-09-27T02:06:11Z
7697,bbc-news,BBC News,2019/09/27 14:00 GMT,The latest five minute news bulletin from BBC World Service.,2019-09-27T14:06:00Z
7701,abc-news,ABC News,Feds crack Medicare gene test fraud that peddled cheek swabs,Federal agents took down an alleged Medicare fraud scheme Friday that exploited seniors' curiosity about genetic medicine by enticing them to get their cheeks swabbed for unneeded DNA tests. Medicare was billed about $2 billion.  Dubbed  Operation Double Heli… [+4646 chars],2019-09-27T15:04:57Z
7705,reuters,Reuters,Brazil ships corn to the U.S. for the first time in 2019 - data,SAO PAULO  Sept 27 (Reuters) - Brazil this week shipped about 60 000 tonnes of corn to the United States  according to Refinitiv data  an unusual export destination given the fact that the country is the largest producer and exporter of the cereal.   The ship… [+160 chars],2019-09-27T17:54:04Z
7709,bbc-news,BBC News,Jay Sewell death: Daniel Grogan guilty of murdering love rival,Image copyrightMet PoliceImage caption   Jay Sewell was stabbed three times in the attack  the court heard  Several members of a family have been convicted of killing a teenager who was stabbed in a car in south east London.  Daniel Grogan  21  harboured  int… [+1708 chars],2019-09-27T17:11:48Z
7713,abc-news,ABC News,Mylan agrees to pay $30M in SEC EpiPen settlement,Mylan has agreed to pay $30 million in a settlement tied to its failure to tell investors about a Justice Department investigation into whether the company overcharged Medicaid for the EpiPen.  The Securities and Exchange Commission said Friday that Mylan NV … [+422 chars],2019-09-27T15:01:26Z
7717,cbs-news,CBS News,Uber CEO says scathing report about passenger safety  based on hearsay ,,2019-09-27T11:36:38Z
7721,cnn,CNN,Manchester United faces long road back as record revenues overshadowed by failure on the field,(CNN)If success in soccer was measured solely by results in the boardroom rather than on the field of play  then Manchester United would be the team to beat.  On Tuesday  the club announced record revenues of £627.1 million ($772 million) for the year ending … [+9862 chars],2019-09-27T13:37:41Z
7725,cbs-news,CBS News,Iran accused of new breach of nuclear deal; releases tanker,The International Atomic Energy Agency (IAEA) reported Thursday that Iran is further enriching uranium with advanced centrifuges  the latest and most serious violation to date of the 2015 nuclear deal. Though President Trump pulled the U.S. out of the nuclear… [+4155 chars],2019-09-27T16:01:05Z
7729,the-irish-times,The Irish Times,The Irish Times view on Dublin and San Francisco: cities by the bay,Dublin is not San Francisco in terms of wealth  climate or its tech industries. But that other city by the bay shows what can happen if a social housing shortage is aggravated by an influx of highly paid workers.   The average asking price for a home in San F… [+1806 chars],2019-09-27T18:00:00Z
7733,reuters,Reuters,Cyclical shares key to determining endurance of U.S. stock rally,NEW YORK (Reuters) - Improved economic sentiment in recent weeks has lifted shares of U.S. financial  energy  industrial and materials companies  but analysts are sharply divided on whether that optimism is warranted.   The performance of these cyclical secto… [+4828 chars],2019-09-27T16:34:44Z
7737,cbs-news,CBS News,Landmark Theatres bans costumes at  Joker  screenings,Landmark Theatres said it's banning costumes  masks and face paint at screenings of  Joker.  The decision comes amid concerns from family members of victims in the mass shooting during a  Batman  movie in Colorado in 2012.   Joker   which will be released on … [+1246 chars],2019-09-27T12:52:00Z
7741,reuters,Reuters,No medals but Dabo wins admiration for sportsmanship,DOHA (Reuters) - Guinea-Bissau’s Braima Dabo will not win any medals at the world championships but he won the admiration of the crowd on Friday by helping exhausted Aruban Johnathan Busby across the 5 000 meters finish line in an astonishing display of sport… [+1756 chars],2019-09-27T18:46:04Z
7745,business-insider,Business Insider,DOJ vets: Ukraine whistleblower puts Trump  Giuliani in legal jeopardy,Justice Department veterans have one piece of advice for President Donald Trump and those around him in the wake of an explosive whistleblower scandal this week: Lawyer up.  The House Intelligence Committee released on Thursday a whistleblower complaint that … [+10771 chars],2019-09-27T18:08:17Z
7749,abc-news,ABC News,Quebec officials confirm first illness related to vaping,Canadian health officials are confirming another case of severe pulmonary illness linked to vaping.  Details about the age and condition of victim in Quebec were not included in Friday's release announcing the case.  Canada's chief public health officer said … [+542 chars],2019-09-27T18:02:56Z
7753,abc-news,ABC News,Wally Lamb barred from prison to resume writing program,Author Wally Lamb says he was barred from entering a Connecticut women's prison to resume a writing program that had been reinstated after an investigation that cleared him of wrongdoing.  The  She's Come Undone  author wrote Thursday on Facebook that an offi… [+591 chars],2019-09-27T19:00:18Z
7757,the-new-york-times,The New York Times,Tekashi 6ix9ine Courted Gang Life. Then Reality Became Too Real.,[Read about 6ix9ines first  second and third days of testimony.]  His membership was a privileged one: 6ix9ine said he was never formally initiated. Instead  his earning power was his entry card. He was their ATM.  While he was providing material support to t… [+1920 chars],2019-09-27T10:44:26Z
7761,business-insider,Business Insider,Costco will sell a new plant-based burger from a company that has a complicated history with Beyond Meat (COST),Costco might have a hefty supply of meat and poultry.  But even the warehouse store is cashing in on the plant-based  meat  craze sweeping the nation.  Costco has partnered with Don Lee Farms to sell the Better Than Beef Burger in its stores in the next three… [+2318 chars],2019-09-27T17:17:09Z
7765,bbc-news,BBC News,Giant planet around tiny star 'should not exist',Image copyrightUniversity of BernImage caption   Artwork: The gaseous world and its star are about 30 light-years from us  Astronomers have discovered a giant planet that  they say  should not exist  according to current theories.  The Jupiter-like world is u… [+5494 chars],2019-09-27T12:39:10Z
7769,the-irish-times,The Irish Times,Richard Keogh told he will play again but not for a year,Republic of Ireland international Richard Keogh has been assured he will make a full recovery from the serious knee injury he suffered in Tuesday nights car accident that led to two of his Derby teammates being charged with drink-driving.  The club captain wa… [+1411 chars],2019-09-27T19:01:59Z
7773,cnn,CNN,Nestle tightens controls on coffee beans after weedkiller scare,,2019-09-27T14:46:30Z
7777,the-irish-times,The Irish Times,Woman only discovered she had won €5.3 million after broadband restored,A woman has described how she only discovered she had won the Lotto 24 hours after the draw took place when her broadband service resumed after an all-day outage in her area.  Speaking at National Lottery headquarters on Friday where she picked up a cheque fo… [+1112 chars],2019-09-27T18:32:00Z
7781,abc-news,ABC News,Fiat Chrysler to pay $40M fine for overstating sales numbers,Fiat Chrysler has agreed to pay $40 million to settle a complaint by securities regulators that it misled investors by overstating monthly sales numbers.  The U.S. Securities and Exchange Commission says the company inflated sales by paying dealers to report … [+533 chars],2019-09-27T16:38:41Z
7785,business-insider,Business Insider,Lyft just nabbed another glowing Wall Street recommendation — here's why the analysts aren't worried about the stock's terrible performance so far (LYFT),Lyft hasn't been riding high since it went public back in March.  The stock is down more than 46% in trading  as the company continues to lose money while investing heavily in order to keep growing. Still  Wall Street has remained overwhelmingly positive on t… [+1887 chars],2019-09-27T14:26:16Z
7789,abc-news,ABC News,City to pay Stormy Daniels $450 000 over strip club arrest,Ohio's capital city has reached a $450 000 settlement with Stormy Daniels over the porn actress' arrest at a strip club last year.  Her federal defamation lawsuit against several Columbus officers alleged officers conspired to retaliate against her over her c… [+590 chars],2019-09-27T18:43:41Z
7793,bbc-news,BBC News,Hillary Clinton condemns Trump's 'cheap extortion racket',,2019-09-27T17:37:02Z
7797,cnn,CNN,Trump said China is stealing from this company. But the trade war is hurting it too,New York (CNN Business)President Donald Trump name-dropped American chipmaker Micron Technology this week  when delivering a speech to the United Nations about the longstanding US claim that China steals intellectual property.   Micron was banned from selling… [+3355 chars],2019-09-27T15:00:02Z
7801,cbs-news,CBS News, When I saw this story  my heart literally fell : Oncologist reacts to lost stem cells,,2019-09-27T12:41:25Z
7805,the-irish-times,The Irish Times,Ian McEwan on Brexit: ‘My solution is simple: a united Ireland’,Watching events at Westminster this week when the UK supreme court found that Boris Johnson had acted unlawfully in suspending parliament and MPs accused the prime minister of putting their lives at risk with his incendiary rhetoric many in Britain wondered w… [+7771 chars],2019-09-27T13:15:00Z
7809,espn,ESPN,No timetable on Oladipo's return to Pacers,INDIANAPOLIS -- The return of Indiana Pacers All-Star guard Victor Oladipo from his gruesome knee injury in January is still up in the air. The only thing Pacers coach Nate McMillan knows at this point is that Oladipo will not be ready for the start of the re… [+2808 chars],2019-09-27T17:06:00Z
7813,business-insider,Business Insider,After the US kicked Turkey out of the F-35 program  Turkey is talking to Russia about buying Su-35 fighter jets,MOSCOW (Reuters) - Russia and Turkey are holding talks about the possible sale of Russian-made Sukhoi Su-35 fighter jets to Turkey  but it is too early to talk about a concrete deal  RIA news agency cited a senior Russian official as saying on Friday.  Turkey… [+1978 chars],2019-09-27T14:58:00Z
7817,the-new-york-times,The New York Times,Your Friday Briefing,Cook: These Kitchen sink cookies conveniently use up any extra baking chocolate  pretzels or candy.  Watch: The return of Bobs Burgers  on Fox  is one of our weekend TV suggestions.  Go: Vija Celmins is best known for photo-realistic paintings and drawings of… [+1139 chars],2019-09-27T09:32:04Z
7821,the-new-york-times,The New York Times,The Week in Tech: Why Californians Have Better Privacy Protections - The New York Times,But on Tuesday  as my colleague Adam Satariano reported from London  the European Court of Justice ruled that the right to be forgotten does not apply outside the European Union. The court also said the right to delete certain personal data must be balanced a… [+1273 chars],2019-09-27T12:00:05Z
7825,cbs-news,CBS News,Amazon Alexa devices to soon feature Samuel L. Jackson's voice,,2019-09-27T01:10:38Z
7829,cnn,CNN,For the first time in its 147-year history  Yellowstone National Park has a female chief ranger,(CNN) For 147 years  Yellowstone National Park in Wyoming has been overseen by a parade of chief rangers  all of them men. Until now.   Sarah Davis  a 20-year National Park Service veteran  will become the park's 18th chief ranger -- and the first female to o… [+1137 chars],2019-09-27T18:59:37Z
7833,the-wall-street-journal,The Wall Street Journal,NOONAN: Dems Set a Bear Trap...,Every time I imagine   Elizabeth Warren  debating   Donald Trump    I picture him rumbling onto the stage like a big white bearroaring Grrr grrrr  towering over her  paws flailing  claws extended. Shell stand there looking up at him in the lights  and youll w… [+7323 chars],2019-09-27T00:40:37Z
