id,source_id,source_name,title,content,published_at
7448,reuters,Reuters,Moment of truth coming for Brexit with time running out  EU and Britain say,BRUSSELS/LONDON (Reuters) - Irish Foreign Minister Simon Coveney warned on Friday that time was running out for Britain and the European Union to hammer out a divorce deal with the British Brexit minister also saying the moment of truth was approaching.   Pri… [+5507 chars],2019-09-27T18:48:59Z
7452,abc-news,ABC News,New trial date set for man accused of killing woman  2 kids,A new trial date has been scheduled for a Guatemala man accused of killing an Iowa woman and her two children.  Polk County District Court records say 31-year-old Marvin Escobar-Orellana is charged with three counts of first-degree murder under what authoriti… [+615 chars],2019-09-27T16:39:41Z
7456,business-insider,Business Insider,Frank Warren wants his 'silent but deadly' 22-year-old heavyweight Daniel Dubois to fight Anthony Joshua and Deontay Wilder in the next 12 months,The development of Daniel Dubois  a 22-year-old heavyweight  will be fast-tracked by the experienced British promoter Frank Warren so he can challenge elite fighters like Anthony Joshua in the near future.  Warren told Business Insider he sees Dubois  his mos… [+10560 chars],2019-09-27T16:12:30Z
7460,abc-news,ABC News,Jury selection begins in killing of pregnant woman  officer,Jury selection has begun for a man accused of killing his pregnant ex-girlfriend and a Florida police officer.  The Orlando Sentinel reports that Circuit Judge Leticia Marques told potential jurors Friday that if selected for the 12-member panel  they would b… [+618 chars],2019-09-27T18:03:41Z
7464,reuters,Reuters,Climate change activists return to D.C. streets,Reuters  the news and media division of Thomson Reuters  is the worlds largest international multimedia news provider reaching more than one billion people every day. Reuters provides trusted business  financial  national  and international news to profession… [+169 chars],2019-09-27T17:03:00Z
7468,abc-news,ABC News,Review: Michaela Anne delivers spirited yet gentle new set,Michaela Anne   Desert Dove  (Yep Roc)  The new album by Michaela Anne is a spirited collection by a singer with big-time talent  though it suffers a little from too much radio-play calculation.  At its best   Desert Dove  has a vitality that outshines much o… [+1310 chars],2019-09-27T16:53:47Z
7472,al-jazeera-english,Al Jazeera English,Pakistan: Brother sentenced to life for Qandeel Baloch's killing,The brother of Pakistani social media star Qandeel Baloch was on Friday sentenced to life in prison for her murder - the country's highest-profile  honour killing .  Baloch  whose real name was Fauzia Azeem  rose to fame for her provocative social media posts… [+2783 chars],2019-09-27T09:10:37Z
7476,abc-news,ABC News,AP-NORC poll: Energy-saving habits vary in popularity,Americans are only willing to go so far in terms of habits that conserve energy and reduce emissions that are warming the planet. That's according to a new poll by The Associated Press-NORC Center for Public Affairs Research.  The poll adds to research showin… [+488 chars],2019-09-27T17:06:51Z
7480,reuters,Reuters,Delay in aid to Ukraine did not affect national security: Esper,WASHINGTON (Reuters) - U.S. Defense Secretary Mark Esper said on Friday that a temporary delay in sending military aid to Ukraine did not impact U.S. national security.   “At this point most of the money is out the door. And at no time or at any time has any … [+683 chars],2019-09-27T18:30:15Z
7484,reuters,Reuters,Former diplomatic  security officials endorse U.S. impeachment inquiry of Trump,WASHINGTON (Reuters) - More than 300 former officials from U.S. security and foreign policy agencies  including a former director of the National Counterterrorism Center and a one-time deputy secretary of state  on Friday endorsed the congressional impeachmen… [+2171 chars],2019-09-27T16:06:25Z
7488,business-insider,Business Insider,The gap between the rich and the poor in the US has widened to a record high  and it mirrors the growth of 'dynastic wealth',The gap between the rich and the poor continues to widen.  Income inequality reached a record high in 2018 since the US Census began tracking it 50 years ago  reported Taylor Telford for The Washington Post  citing the US Census 2018 American Community Survey… [+2192 chars],2019-09-27T15:41:00Z
7492,cnn,CNN,'Spider-Man' swings on as Marvel and Sony mend split,,2019-09-27T16:29:17Z
7496,cbs-news,CBS News,Health officials urge getting flu shot by end of October,,2019-09-27T01:01:03Z
7500,business-insider,Business Insider,'What is Lyft Express Drive?': How to qualify for Lyft's rental car program  and drive for Lyft without owning a car,If you want to drive for a ride-hailing service like Lyft or Uber  it might seem like you need to own a car — which can be a tall order  especially since that car usually has to meet certain requirements to be qualified as a vehicle  depending on the company.… [+1374 chars],2019-09-27T15:03:00Z
7504,the-new-york-times,The New York Times,Want to Avoid Babies on Flights? Japan Airlines Offers a Seating Map,Mr. Ahmed said he traveled often for work and valued sleep on flights. Looking at how many hours Ive spent in the last six months alone flying  its been 183 hours inside a plane  he said.   Japan Airlines seating feature wont be visible to all travelers. The … [+1575 chars],2019-09-27T16:42:31Z
7508,business-insider,Business Insider,7 steps to take when scrubbing your social media presence  according to branding and PR experts,,2019-09-27T15:52:00Z
7512,the-new-york-times,The New York Times,‘We Need Each Other’: Seniors Are Drawn to New Housing Arrangements,And despite attempts to keep costs reasonable  these alternatives can get expensive. Village memberships can climb toward $1 000 in some locations  with discounts for lower-income residents.  In Boulder  market-rate cohousing units at Silver Sage cost $800 00… [+1127 chars],2019-09-27T17:40:07Z
7516,the-new-york-times,The New York Times,Saudi Arabia Invites Tourists: What You Need to Know,Last year  Saudi Arabia lifted the ban on women drivers  and earlier this year  it eased strict guardianship laws  but many of the womens rights activists who had fought for the right to drive were imprisoned and at least one remains so.  While the tourism co… [+1381 chars],2019-09-27T15:28:44Z
7520,cbs-news,CBS News,House Dems to press need for impeachment during recess,House Democrats are being sent home for a two-week recess with guidance on how to talk up recent accomplishments and the impending impeachment fight.  President Trump  has reached a grave new level of lawlessness that demands an impeachment inquiry   accordin… [+2685 chars],2019-09-27T15:01:16Z
7524,cnn,CNN,Donald Trump made a HUGE mistake releasing the Ukraine transcript,THE POINT -- NOW ON YOUTUBE!   In each episode of his weekly YouTube show  Chris Cillizza will delve a little deeper into the surreal world of politics. Click to subscribe!,2019-09-27T18:41:49Z
7528,the-new-york-times,The New York Times,Hundreds of Chained Men and Boys Are Rescued in Nigeria,Those responsible for abuse  if found guilty  should be held accountable  he said. But these schools should continue because shutting them down would deprive so many students of an education.   Professor Akintola added that Islamic schools needed additional f… [+1394 chars],2019-09-27T15:13:53Z
7532,the-irish-times,The Irish Times,Residents object to Google’s plan for roof terrace sports facility,A group of Dublin city residents have expressed concerns that an open roof terrace sports facility planned by Google at its Bolands Mill development will create a nuisance for them.  Work is continuing on Googles 300 million development at Bolands Mill  where… [+1054 chars],2019-09-27T17:20:27Z
7536,cbs-news,CBS News,9/27: CBSN AM,,2019-09-27T16:12:22Z
7540,reuters,Reuters,Leader of Colombia's Los Pelusos crime gang killed  president says,BOGOTA (Reuters) - The top leader and founder of Colombia’s Los Pelusos crime gang has been killed in an operation led by the national police  President Ivan Duque said on Friday.   The gang is one of the most well-known criminal organizations in the Andean c… [+1066 chars],2019-09-27T15:36:17Z
7544,the-new-york-times,The New York Times,There’s Other News. Here You Go.,The State Department announced that the American refugee program would be cut by almost half. The country will accept 18 000 refugees during the next 12 months  down from the current limit of 30 000. (For comparisons sake  President Obama said 110 000 refugee… [+1270 chars],2019-09-27T17:13:13Z
7548,bbc-news,BBC News,2019/09/27 12:00 GMT,The latest five minute news bulletin from BBC World Service.,2019-09-27T12:06:00Z
7552,the-irish-times,The Irish Times,Varadkar describes online racial abuse of Meath couple in Lidl advert as ‘disgusting’,Taoiseach Leo Varadkar has described reports of online racial abuse directed at a Co Meath couple as disgusting. He said that while there is work ongoing on hate crime legislation  it was a difficult issue to get right.  I think any online abuse  particularly… [+4265 chars],2019-09-27T17:43:43Z
7556,reuters,Reuters,Billionaire Slim's telco bullish on coveted Mexico TV license,MEXICO CITY (Reuters) - America Movil  the telecoms giant controlled by the family of billionaire Carlos Slim  is growing increasingly bullish that it will receive a license to offer television in Mexico  a prize that has eluded it for nearly three decades.   … [+3103 chars],2019-09-27T17:42:59Z
7560,business-insider,Business Insider,Trump-Ukraine call was 'abuse of power' say former NatSec officials,Around 300 former national security officials  ambassadors  and ex-White House staff have signed a letter that says President Donald Trump appears to have committed  an unconscionable abuse of power  in a call with the leader of Ukraine  and applauds the laun… [+5373 chars],2019-09-27T12:30:55Z
7564,the-irish-times,The Irish Times,Thousands of young people worldwide take to streets in climate protest,Tens of thousands of mostly young people have marched to New Zealands parliament  kicking off a second wave of worldwide protests demanding swift action on climate change.  The protests were inspired by Swedish teenager Greta Thunberg  who spoke to world lead… [+2753 chars],2019-09-27T12:03:14Z
7568,cnn,CNN,Skydiver died after crashing into trailer,Chat with us in Facebook Messenger. Find out what's happening in the world as it unfolds.,2019-09-27T12:12:57Z
7572,bbc-news,BBC News,Ayub Hassan murder: Boy jailed for Kensington county lines stabbing,Image copyrightPA MediaImage caption   Ayub Hassan was described as  very kind and handsome  by a family friend  A boy who stabbed another teenager in the heart amid a drugs row in an alley behind a Waitrose has been jailed.  Ayub Hassan  known as A1  was att… [+2143 chars],2019-09-27T12:29:17Z
7576,the-wall-street-journal,The Wall Street Journal,The Wall Street Journal: China fails to break into key bond market index,Containers are seen at the Yangshan Deep Water Port  part of the Shanghai Free Trade Zone  FTSE Russell held off on adding Chinese government bonds to its key benchmarks  saying international investors still had important reservations about investing in the c… [+792 chars],2019-09-27T09:32:10Z
7580,abc-news,ABC News,US ambassador pressed Ukraine corruption fight before ouster,Months before the call that set off an impeachment inquiry  many in the diplomatic community were alarmed by the Trump administration's abrupt removal of a career diplomat from her post as ambassador to Ukraine.  The ambassador's ouster  and the campaign agai… [+6437 chars],2019-09-27T19:06:11Z
7584,business-insider,Business Insider,Some simple math can help you decide whether to rent or buy your next home,Homeownership is a great feeling  but sometimes the numbers just don't make sense. Buying and selling real estate is an expensive endeavor  so if you plan to move frequently or want to pick a home for the short-term  buying probably isn't the best choice.  Wh… [+3995 chars],2019-09-27T17:53:27Z
7588,abc-news,ABC News,BBC faces backlash after censuring anchor for Trump remarks,The BBC faced a backlash Friday after finding one of its presenters in breach of its editorial guidelines on impartiality for comments that were critical of U.S. President Donald Trump.  Journalists and celebrities were demanding that the BBC overturn its dec… [+2150 chars],2019-09-27T16:46:53Z
7592,espn,ESPN,Nets' Irving: 'I failed' my Celtics teammates,NEW YORK -- Kyrie Irving arrived at the Brooklyn Nets' media day ready to accept accountability.  Irving  who signed with the Nets over the summer  has quickly assumed the role as face of the franchise. Yes  Kevin Durant also signed with the team  but his Ach… [+3144 chars],2019-09-27T18:09:00Z
7596,al-jazeera-english,Al Jazeera English,Hundreds of 'abused' captives freed from Nigeria school,At least 300 captives  most of them children and many in chains  have been rescued from a building in the northern Nigerian city of Kaduna  a spokesman for the police said.   Yakubu Sano told reporters on Friday that police raided the building  which housed a… [+2572 chars],2019-09-27T12:54:53Z
7600,reuters,Reuters,Trump officials weigh limits on U.S. portfolio flows into China: Bloomberg,(Reuters) - White House officials are discussing ways to limit U.S. portfolio flows into China  Bloomberg reported here on Friday  citing people familiar with the internal deliberations.   Trump Officials are also considering delisting Chinese companies from … [+276 chars],2019-09-27T15:59:43Z
7604,cnn,CNN,Man dies saving granddaughter after a house explosion,Chat with us in Facebook Messenger. Find out what's happening in the world as it unfolds.,2019-09-27T12:42:15Z
7608,al-jazeera-english,Al Jazeera English,Is adoption tricking Ugandan parents from their children?,,2019-09-27T17:17:42Z
7612,business-insider,Business Insider,WeWork's junk bonds slashed again by S&P amid company turmoil  failed IPO,Reuters  <ul><li>S&amp;P Global downgraded WeWork's bonds further into junk territory late Thursday evening amid concerns the company might struggle to raise new capital to fund growth. </li><li>The rating agency lowered WeWork's credit status to  B-  from  B… [+2123 chars],2019-09-27T15:56:35Z
7616,al-jazeera-english,Al Jazeera English,Afghanistan boosts security for presidential election,A massive security operation is under way all across Afghanistan for the country's presidential election on Saturday.  About 100 000 security personnel are to guard polling stations in the wake of Taliban threats.  The fear of reprisals means many voters - pa… [+163 chars],2019-09-27T13:03:05Z
7620,bbc-news,BBC News,Britain's Chris Froome set for return to cycling four months on from Dauphine crash,Chris Froome had been aiming to win a record-equalling fifth Tour de France title in 2019  Four-time Tour de France winner Chris Froome is set for a return to cycling four months after suffering serious injuries in a crash while riding.  Ineos rider Froome wi… [+847 chars],2019-09-27T13:42:40Z
7624,cnn,CNN,Pelosi says Barr has 'gone rogue',Washington (CNN)House Speaker Nancy Pelosi said Friday that Attorney General William Barr has  gone rogue   citing the Justice Department's handling of the Ukraine scandal  adding that House Democrats will not rush their impeachment inquiry into President Don… [+3053 chars],2019-09-27T14:34:27Z
7628,cnn,CNN,Oil prices slide on easing Middle East tensions,,2019-09-27T13:02:38Z
7632,the-irish-times,The Irish Times,Irishman (30s) drowns while on walking trip in Spain,An Irishman has died in what is being seen as a tragic accident in Spain.  The man who was in his 30s was walking the Santiago de Compostela pilgrim route in northern Spain at the time.  The Department of Foreign Affairs said it was aware of the case and prov… [+391 chars],2019-09-27T15:48:10Z
7636,reuters,Reuters,Barclays pays $6.3 million to settle U.S. SEC's Asia-Pacific hiring probe,(Reuters) - Barclays (BARC.L) has agreed to pay about $6.3 million to settle U.S. charges it violated a federal anti-bribery law by hiring family and friends of foreign officials in the Asia-Pacific region to help win or retain investment banking business.   … [+1630 chars],2019-09-27T17:31:00Z
7640,the-new-york-times,The New York Times,In ‘Abominable ’ Asian Actors Play Asian Characters. What a Novelty.,On American stages today  important feeders for Hollywood  Asians are still underrepresented. Only 7.3 percent of acting roles on Broadway and at New Yorks largest nonprofit theaters went to people of Asian heritage in the 2016-17 season  according to the Asi… [+1513 chars],2019-09-27T15:09:29Z
7644,business-insider,Business Insider,McDonald's might launch its first veggie burger in America within a year  according to UBS analysts (MCD),As McDonald's tests a plant-based burger with Beyond Meat in Canada  analysts are on the lookout for more veggie burgers.    We expect further conversation and testing around plant-based meat (no update on other day parts / proteins currently)  and anticipate… [+1647 chars],2019-09-27T15:17:30Z
7648,newsweek,Newsweek,ShutDownDC: Climate Protesters Block Streets for Another Day of Disruption in Washington,A coalition of climate activist groups are set to cause morning rush hour chaos as they stage another #ShutDownDC protest in Washington.  The organizers promised to  hit the streets again  after more than 2 000 people protested across 22 intersections in the … [+2871 chars],2019-09-27T12:11:56Z
7652,espn,ESPN,Lonzo on LaVar: 'It's always love at the end',New Orleans Pelicans point guard Lonzo Ball watched  as seemingly everyone else did  as a clip of his father  LaVar  calling him  damaged goods  made the rounds last week.  The clip  from the  Ball in the Family  show on Facebook  was fodder for social media … [+4110 chars],2019-09-27T10:26:39Z
7656,cbs-news,CBS News,Hospital freezer failure destroys cancer patients' stem cells,A freezer at Children's Hospital Los Angeles failed earlier this month  leading to more than four dozen cancer patients losing their stored stem cells. The hospital said the blood stem cells were collected from patients and held in long-term storage for futur… [+1435 chars],2019-09-27T01:41:03Z
7660,the-irish-times,The Irish Times,More than two-fifths of Europe’s native trees at risk of extinction – assessment,Horse chestnut trees  whose conkers have been collected and treasured by generations of children  are among scores of European trees at risk of extinction.  The latest assessment from the International Union for Conservation of Nature (IUCN) Red List also rev… [+109 chars],2019-09-27T11:08:00Z
7664,cbs-news,CBS News,Stem cells destroyed after freezer fails at Children's Hospital Los Angeles,,2019-09-27T01:06:15Z
7668,business-insider,Business Insider,Here's who will be onstage for the October 15 Democratic debate hosted by CNN and The New York Times  what time it'll start  and how to watch,Twelve 2020 Democratic presidential candidates have qualified for the fourth Democratic primary debate  which CNN and The New York Times will co-host on October 15  2019.   Twenty candidates qualified for both the June round of debates hosted by NBC and the J… [+2152 chars],2019-09-27T18:34:51Z
7672,bbc-news,BBC News,Ealing stab death: Three held on suspicion of murder,Image copyrightMetropolitan PoliceImage caption   A post-mortem examination found Osvaldo Carvalho died from shock and haemorrhage following a stab wound  Three men have been arrested on suspicion of murdering a man who was stabbed to death in a fight.  Osval… [+897 chars],2019-09-27T12:57:07Z
7676,the-new-york-times,The New York Times,An Artist Who Appropriates With a Wink,Recently  old pictures of Prime Minister Justin Trudeau of Canada wearing a turban at an Arabian Nights-themed party  with darkened face  neck and hands  have surfaced  amid charges of cultural insensitivity.   And as far back as 1978  Edward Said  the Columb… [+1135 chars],2019-09-27T17:07:42Z
7680,abc-news,ABC News,Judge: No immunity for Georgia officer who shot fleeing man,A judge has denied a former Georgia police officer's request for immunity from prosecution for the fatal shooting of a fleeing  unarmed man.  Zechariah Presley's trial on a manslaughter charge is scheduled to start Monday in Camden County. Superior Court Judg… [+537 chars],2019-09-27T16:33:11Z
7684,the-irish-times,The Irish Times,Thomas Barr cool and clear over first hurdle in Doha,Cool as the stadium air conditioning  Thomas Barr safely cleared his first set of hurdles at the World Athletics Championships in Doha with room and time to spare.  Running in the first of five heats of the 400m hurdles  Barr looked perfectly comfortable too … [+196 chars],2019-09-27T18:40:00Z
7688,the-irish-times,The Irish Times,Retail sales up nearly 6% despite Brexit uncertainty,Retail sales rose by nearly 6 per cent in August despite concern that a Brexit-related slide in consumer confidence would dampen business.  Figures from the Central Statistics Office (CSO) show the volume of sales increased 5.7 per cent last month when compar… [+927 chars],2019-09-27T11:12:12Z
7692,the-irish-times,The Irish Times,Accounting software giant Sage snaps up Irish company,Irish technology company Ocrex  which trades as AutoEntry  has been snapped up by accounting software giant Sage for an undisclosed sum.  Founded by Brendan Woods in 2011  the company uses artificial intelligence (AI) and Optical Character Recognition (OCR) t… [+1806 chars],2019-09-27T14:12:03Z
7696,cnn,CNN,Nigeria police rescue more than 300 boys and men held in 'dehumanizing conditions',Lagos  Nigeria (CNN)Nigerian police rescued more than 300 people - mostly children -- held in  dehumanizing conditions  during a raid on a school on Thursday  City of Kaduna police spokesman Yakubu Sabo told CNN.  The school owner told police he was running a… [+1346 chars],2019-09-27T13:39:09Z
7700,abc-news,ABC News,Review: Jacky Terrasson keeps it concise on piano trio album,Jacky Terrasson   53  (Blue Note)  Jazz tunes are like baseball games few fans complain about them being too short. But on Jacky Terrasson's album  53  (yes  the one-time twentysomething sensation is now 53)  he wisely leaves listeners wanting more.  Not that… [+1196 chars],2019-09-27T16:44:52Z
7704,bbc-news,BBC News,Why a museum wants to find out how Rembrandt painted,,2019-09-27T15:23:40Z
7708,cnn,CNN,This adorable controller pairs perfectly with the Nintendo Switch Lite,The Nintendo Switch Lite is small  portable  and oh-so colorful. But unlike its bigger sibling  the Switch Lite's controllers aren't removable  meaning they can't be used for multiplayer gaming or for those times when you just want to prop up the sit back and… [+1080 chars],2019-09-27T17:25:57Z
7712,the-new-york-times,The New York Times,Review: Plácido Domingo Is Gone  but He Still Haunted ‘Macbeth’,You have to admire the Mets intrepid cast  chorus and orchestra for rallying on Wednesday. Mr. Lucic  a major baritone  sang Macbeth when the Met introduced Adrian Nobles gripping production in 2007. He returned for a revival in 2014  in which Anna Netrebko s… [+2376 chars],2019-09-27T10:44:26Z
7716,the-new-york-times,The New York Times,The Pantry Pasta You Need,,2019-09-27T16:35:00Z
7720,reuters,Reuters,U.S. House defeats Republican measure disapproving of impeachment inquiry,WASHINGTON (Reuters) - The Democratic-led U.S. House of Representatives killed a Republican resolution on Friday disapproving of the formal impeachment inquiry into President Donald Trump that House Speaker Nancy Pelosi announced this week.   The vote was 222… [+368 chars],2019-09-27T15:46:21Z
7724,reuters,Reuters,After WeWork debacle  IPO market slams brakes on unprofitable companies,BOSTON (Reuters) - Companies making their debut on the U.S. stock market are getting a rough welcome  especially if they are losing money  casting a shadow over the calendar for initial public offerings for the rest of the year.   The surprise postponement of… [+2968 chars],2019-09-27T16:19:10Z
7728,the-new-york-times,The New York Times,Why The Times Editorial Board Supports an Impeachment Inquiry,Because the role of the editorial board can be confusing  particularly to readers who dont know The Times well  the board  in consultation with the current publisher  A.G. Sulzberger  has developed a statement of its guiding values. It can be found here.  The… [+1880 chars],2019-09-27T09:20:32Z
7732,al-jazeera-english,Al Jazeera English,El-Sisi plays down protest call as Egypt tightens security,Egypt's President Abdel Fattah el-Sisi has played down a call for protests against his rule  saying there were  no reasons for concern  even as the army and the police tightened security in the capital  Cairo  and other major cities.  The dismissal on Friday … [+3419 chars],2019-09-27T10:18:24Z
7736,reuters,Reuters,Trump considers delisting Chinese firms from U.S. markets: source,WASHINGTON (Reuters) - President Donald Trump’s administration is considering the possibility of delisting Chinese companies from U.S. stock exchanges  a source briefed on the matter said on Friday  in what would be a radical escalation of trade tensions betw… [+3359 chars],2019-09-27T17:23:20Z
7740,al-jazeera-english,Al Jazeera English,Russia detains more than 260 North Korean fishermen,Russian border guards have seized three North Korean fishing vessels and 262 crew members  for poaching in waters that Moscow considers its exclusive economic zone.   The crew and vessels  as well as several motorboats  were taken to Russia's Far East port of… [+1042 chars],2019-09-27T11:42:41Z
