id,source_id,source_name,title,content,published_at
7786,business-insider,Business Insider,Adam Neumann’s fall shows how going public can crush a startup CEO,WeWork founder Adam Neumann's loss of control of the company shows what happens when a leader lacks self-awareness and few around him are willing to speak the truth. Instead of leading his company into one of the most anticipated initial public offerings (IPO… [+5139 chars],2019-09-27T17:15:49Z
7790,the-new-york-times,The New York Times,Wells Fargo Names Charles Scharf as Chief Executive,Wells Fargo  the scandal-plagued bank that has spent months searching for a new chief executive  announced on Friday that a longtime banking veteran  Charles W. Scharf  has agreed to take the post.  Mr. Scharf  who currently runs BNY Mellon and previously had… [+191 chars],2019-09-27T11:16:14Z
7794,cnn,CNN,Chipotle CEO says breakfast is off the table... for now,At CNN Business' new live event series  The Table  we speak with transformative voices across industries about the ways in which technological disruption is changing their organization and the economy at large.   Los Angeles (CNN Business)Chipotle wants to ke… [+4574 chars],2019-09-27T14:05:28Z
7798,abc-news,ABC News,Indiana trooper saves boy  5  choking in family minivan,An Indiana state trooper is being credited with saving a 5-year-old boy who began choking as his family was returning from vacation.  State police say Trooper Ben Reason was on duty but heading home Thursday when he heard a dispatch call about an unconscious … [+498 chars],2019-09-27T17:22:41Z
7802,espn,ESPN,Eagles CB has movement after hit by teammate,GREEN BAY  Wis. -- Philadelphia Eagles cornerback Avonte Maddox was taken off the field on a stretcher late in the fourth quarter Thursday against the Green Bay Packers.  Maddox has movement in all extremities  the team announced. For precautionary reasons  h… [+452 chars],2019-09-27T04:46:00Z
7806,bbc-news,BBC News,Man Utd: I'm not worried about what the press write Ole Gunnar Solskjaer,Manchester United manager Ole Gunnar Solskjaer accepts media scrutiny is part of being at a big club but says he is not worried about what is being written about him after winning two of their opening six Premier League games.  READ MORE: United are improving… [+11 chars],2019-09-27T14:53:45Z
7810,the-new-york-times,The New York Times,A Whimsical SoHo Loft With a Hidden Party Room Comes on the Market,Mr. de Betak  whose design firm Bureau Betak has offices in New York  Paris and Shanghai  customized just about everything. He installed weathered floorboards reclaimed from an upstate New York barn  and created and outfitted a 17-foot-by-6-foot stainless-ste… [+1198 chars],2019-09-27T13:06:46Z
7814,bbc-news,BBC News,Ireland rest Sexton as Carty starts at 10 against Japan,Josh van der Flier will be in action again against Japan on Saturday  <table><tr><th>2019 Rugby World Cup Pool A: Japan v Ireland</th></tr>  <tr><td>Venue: Shizuoka Stadium  Shizuoka Date: Saturday  28 September Kick-off: 08:15 BST</td></tr><tr><td>Coverage: … [+4680 chars],2019-09-27T15:55:29Z
7818,cbs-news,CBS News,Judge blocks effort to indefinitely detain migrant families,A federal judge Friday rejected a sweeping Trump administration effort to detain migrant families and children for longer periods of time than currently allowed  saying it violates the very court settlement the government sought to scrap with its plan.  The F… [+2302 chars],2019-09-27T17:26:39Z
7822,the-irish-times,The Irish Times,Woman arrested after €107 000 cannabis seizure,A woman in her 30s has been arrested following the seizure of more than 107 000 worth of cannabis and cocaine at a house in Co Roscommon.  The haul was discovered on Thursday as part of an ongoing investigation into the sale and supply of drugs. The Roscommon… [+469 chars],2019-09-27T13:21:18Z
7826,abc-news,ABC News,Hope of coming back to shuttered GM plant fades for workers,In the months since General Motors signaled the closing of its huge car plant in Lordstown  Ohio  Tammy Hurst put off setting a wedding date and watched her fiance  two sisters  a brother and a nephew leave their hometowns for new jobs.  All five transferred … [+4854 chars],2019-09-27T16:36:30Z
7830,al-jazeera-english,Al Jazeera English,More than a dozen dead as flash floods hit Western India,At least 21 people have been killed and nine were missing after the Western Indian city of Pune and neighbouring areas were hit by heavy rain and flash floods  according to officials.   Authorities in Pune said on Thursday that 14 people were killed in the ci… [+1667 chars],2019-09-27T12:35:58Z
7834,cbs-news,CBS News,How to prepare for the upcoming flu season,,2019-09-27T16:15:03Z
7838,cnn,CNN,Settle in with these weekend reads,,2019-09-27T18:26:44Z
7842,the-new-york-times,The New York Times,For Louisiana’s Vanishing Coast  Deal With Mining Company Is a ‘Starting Point’,In a statement  Ms. Landry said oil and gas companies had been operating within the scope of the law for decades and that the complex and multifaceted problem of protecting and restoring Louisianas coast will not be resolved in a courtroom.  Gov. John Bel Edw… [+1734 chars],2019-09-27T10:05:32Z
7846,cnn,CNN,Let Kashmir speak,Shah Mahmood Qureshi is the foreign minister of Pakistan. View more opinion on CNN.   (CNN)Nearly two decades ago  US President Bill Clinton called Kashmir  the most dangerous place in the world.  On his mind undoubtedly were India and Pakistan's nuclear capa… [+4644 chars],2019-09-27T16:15:33Z
7850,business-insider,Business Insider,Federal prosecutors say a 'Satanist' soldier was plotting to overthrow the government,TOPEKA  Kansas (AP) — A prosecutor alleged in federal court Thursday that an Army infantry soldier charged with distributing information about building bombs is a Satanist who plotted to overthrow the US government  while his attorney said he's only an intern… [+4878 chars],2019-09-27T17:57:35Z
7854,cnn,CNN,First on CNN: White House says lawyers directed moving Ukraine transcript to highly secure system,,2019-09-27T14:50:30Z
7858,reuters,Reuters,Trump administration considering delisting U.S.-listed Chinese firms: report,(Reuters) - White House officials are discussing ways to limit U.S. portfolio flows into China  Bloomberg reported here on Friday  citing people familiar with the internal deliberations.   Trump Officials are also considering delisting Chinese companies from … [+276 chars],2019-09-27T16:28:35Z
7862,business-insider,Business Insider,A new homeowner talks about what it's really like to buy your first place,From figuring out your price range to filing paperwork  here are all the steps you should be aware of when buying a house for the first time.  Buying a home sound like a daunting task? Prosper &amp; Thrive can help you understand the process and give you the … [+101 chars],2019-09-27T15:06:00Z
7866,the-irish-times,The Irish Times,Eoghan Murphy criticised as rents surge by 7 per cent in one year,Minister for Housing Eoghan Murphy has said rent pressure zones are starting to work despite a 7 per cent year-on-year increase in rents nationwide.  Rents in Dublin increased in the second quarter to 1 713 a month  up from 1 599 for the same period last year… [+4087 chars],2019-09-27T13:18:20Z
7870,bbc-news,BBC News,Busted 'swore at Blackpool Illuminations switch-on',Image caption   Busted were among the headliners at the concert on 30 August   Foul language  used by the band Busted during a performance at the Blackpool Illuminations switch-on ceremony was  not acceptable   a councillor said.  The group was among the head… [+1309 chars],2019-09-27T13:42:00Z
7874,the-irish-times,The Irish Times,Rugby World Cup Jargon Buster: Know your Piano Shifters from your Pine Riders,Rugby  as we know  has a language and a set of phrases and terminology with which most of us are unfamiliar.  Its hardly alone  though  in the world of sport  cricket has googlies  doosras  jaffas and dibbly-dobblies  for heavens sake.  But during this World … [+3453 chars],2019-09-27T15:15:00Z
7878,the-new-york-times,The New York Times,92nd Street Y Names New Chief Executive,Mr. Pinsky said he has been a patron of the 92nd Street Y for several years.   Its an institution that plays a critical role in New York City  Mr. Pinsky said in an interview. There are so many challenges that we face as a city and a nation that require the k… [+1235 chars],2019-09-27T17:00:06Z
7882,the-new-york-times,The New York Times,A Guided Tour Through the Ruins of America's Democracy,Humans can hardly survive anywhere. It is both terrifying and comical  how vulnerable we are. We live comfortably  sort of  under exactly one condition: in the temperate patches of a very thin crust on a relatively small planet in a tiny corner of the known u… [+4781 chars],2019-09-27T16:01:40.679Z
7886,cnn,CNN,Become a Facebook marketing wizard with this master class bundle,Facebook has a massive user base with so many ways for users to interact. The Facebook Marketing Master Class Bundle aims to help you utilize these features and market your brand on the social media site.  This set of courses costs $35 and contains over 50 ho… [+1604 chars],2019-09-27T14:40:09Z
7890,the-irish-times,The Irish Times,Speed camera van operators to strike from Saturday,A 24-hour strike by staff operating speed camera vans on behalf of the State is to go ahead from 6am on Saturday  the trade union Siptu has said.  Siptu organiser Brendan Carr said if the concerns of staff continued to be ignored the dispute would escalate fu… [+1172 chars],2019-09-27T11:13:58Z
7894,bbc-news,BBC News,Thousands of Canadians join worldwide climate strikes,Image copyrightAFPImage caption   Swedish climate activist Greta Thunberg spoke in Montreal ahead of planned demonstrations  Canadians in the thousands have joined climate strike marches across the country  with almost 100 events planned in cities and towns f… [+3322 chars],2019-09-27T16:44:08Z
7898,cbs-news,CBS News,Former acting CIA director says whistleblower is  well-trained analyst ,,2019-09-27T11:44:00Z
7902,the-new-york-times,The New York Times,‘Show Us You Are Not Racist’: Students Demand Answers After Dean’s Resignation,Since Mr. Rileys resignation  students have staged a sit-in at the presidents office  marched on campus and passed a resolution in the Student Senate reaffirming the universitys commitment to protecting the freedom of speech and academic freedom. The outrage … [+1632 chars],2019-09-27T10:03:17Z
7906,business-insider,Business Insider,How to connect a Zagg keyboard to your iPad using Bluetooth  for improved typing and support,Zagg's line of Bluetooth keyboards is a great innovation for tablet productivity.   From the go-anywhere Rugged model to the inexpensive Messenger model  Zagg keyboards help you type quickly and easily on your iPad.   Given Zagg's history as a manufacturer of… [+1795 chars],2019-09-27T17:09:00Z
7910,business-insider,Business Insider,17 cool gift ideas for the music lover in your life,Most of us listen to music in some capacity and can say we like it.  But there are the people who just listen casually to whatever happens to be on the radio  and then there are the people who spend hours carefully curating playlists  filling their calendars … [+390 chars],2019-09-27T14:30:00Z
7914,bbc-news,BBC News,Bournemouth v West Ham United - BBC Sport,West Ham goalkeeper Lukasz Fabianski has not conceded a Premier League goal in 343 minutes  TEAM NEWS  Bournemouth trio Simon Francis  Lloyd Kelly and Arnaut Danjuma all made their comebacks from injury in the EFL Cup in midweek and could feature.  David Broo… [+3892 chars],2019-09-27T11:49:56Z
7918,cbs-news,CBS News,KFC surprises single mom with a new car,Crystal Lachance is a single mom from Salem  Oregon  who is not only a dedicated mother  she's a dedicated employee. Lachance works at KFC and for a full year she had to walk to and from work — an hour each way. Her coworkers wanted to recognize Lachance's co… [+1956 chars],2019-09-27T17:13:12Z
7922,reuters,Reuters,Trump considers delisting Chinese firms from U.S. stock markets: source,WASHINGTON (Reuters) - President Donald Trump’s administration is considering the possibility of delisting Chinese companies from U.S. stock exchanges  a source briefed on the matter said on Friday  in what would be a radical escalation of trade tensions betw… [+3080 chars],2019-09-27T17:03:18Z
7926,cnn,CNN,Ari Emanuel's talent agency is the latest IPO failure,,2019-09-27T16:14:29Z
7930,business-insider,Business Insider,A fast-fashion brand selling fake  nonfunctional 'ear pieces' reveals AirPods' transformation into a millennial style symbol,AirPods' transformation into a millennial style icon is now complete  as a fast-fashion brand crafts a nonfunctional knockoff.   ASOS is now selling a nonfunctional  faux headphone ear piece in silver tone   a bizarre product that Retail Dive identified as a … [+1188 chars],2019-09-27T17:30:30Z
7934,the-irish-times,The Irish Times,Leinster  Munster and Connacht name their Pro14 teams,Ross Molony will captain Leinster against Benetton in their Pro14 opener on Saturday  and hell be partnered by Devin Toner in the secondrow (Kick-off: 5.15pm Irish time - live on eir Sport).  The frontrow of Peter Dooley  Rónan Kelleher and Michael Bent that … [+3306 chars],2019-09-27T12:57:06Z
7938,the-new-york-times,The New York Times,Review: ‘Transparent’ and Its Unsettling Technicolor Dream Theater,For that very reason  Tambors ouster didnt have to mean the end of the series. The Pfefferverse is a mutable thing  and Transparent had not been solely or even mostly Mauras story since Season 1. Indeed  watching the finale  I kept imagining how certain arcs … [+1530 chars],2019-09-27T17:07:42Z
7942,reuters,Reuters,Workplaces could be good setting for diabetes prevention,People in certain occupations have a three-times-higher risk of type 2 diabetes compared to those in other jobs  probably because of lifestyle factors  a nationwide study in Sweden suggests.   Getting these workers to ramp up physical activity could be the fi… [+3095 chars],2019-09-27T17:57:12Z
7946,the-wall-street-journal,The Wall Street Journal,European Leaders Push U.S.  Iran to Forge New Nuclear Deal,,2019-09-27T16:17:35Z
7950,business-insider,Business Insider,'What comes with a Nintendo Switch?': A guide to what's included with a Nintendo Switch or Nintendo Switch Lite,The Nintendo Switch comes with everything you need to start enjoying your favorite Nintendo games  except for the games themselves. But seeing as you can buy Switch games at any game store  or download them in minutes from the Nintendo eShop  that's not a big… [+2693 chars],2019-09-27T17:36:00Z
7954,abc-news,ABC News,Pakistan PM accuses Indian counterpart of cruelty and stupidity in Kashmir  predicts  bloodbath  when curfew lifted,Pakistan PM accuses Indian counterpart of cruelty and stupidity in Kashmir  predicts  bloodbath  when curfew lifted.,2019-09-27T15:33:54Z
7958,reuters,Reuters,U.S. House defeats Republican measure disapproving of impeachment inquiry,WASHINGTON (Reuters) - The Democratic-led U.S. House of Representatives killed a Republican resolution on Friday disapproving of the formal impeachment inquiry into President Donald Trump that House Speaker Nancy Pelosi announced this week.   The vote was 222… [+368 chars],2019-09-27T18:41:10Z
7962,abc-news,ABC News,Washington issues flavored vaping ban  joining other states,Washington on Friday joined several other states in banning the sale of flavored vaping products amid concern over the mysterious lung illness that has sickened hundreds of people and killed about a dozen across the country.  Gov. Jay Inslee issued an executi… [+1902 chars],2019-09-27T18:48:41Z
7966,the-new-york-times,The New York Times,Watch an Awkward and Funny Moment From ‘Downton Abbey’,The Downton servants beg to differ. They devise a plan to take back their rightful places by sidelining the royal staff. In this scene  one Downton servant  Molesley (Kevin Doyle)  speaks up to let the king know that the evening's meal is indeed the work of M… [+316 chars],2019-09-27T11:03:03Z
7970,abc-news,ABC News,Former University of Delaware baseball player convicted of raping woman whom he met online,Former University of Delaware baseball player convicted of raping woman whom he met online.,2019-09-27T18:07:26Z
7974,bbc-news,BBC News,Thomas Cook:  I put my uniform on and started to cry ,Media captionFormer Thomas Cook cabin crew manager Steve Kearney says the situation seems  desperate .  Former Thomas Cook employee Steve Kearney says he may struggle to make ends meet given that staff of the failed tour operator have not been paid.  Mr Kearn… [+3149 chars],2019-09-27T14:55:44Z
7978,abc-news,ABC News,US investigation of vaping-related illnesses focuses on THC,Health officials say their investigation into a recent outbreak of severe vaping-related illnesses is increasingly focused on products that contain THC.  The Centers for Disease Control and Prevention said Friday most people who got sick vaped THC  the ingred… [+412 chars],2019-09-27T17:17:15Z
7982,cbs-news,CBS News,New  Abbey Road  remix reveals insight into the Beatles' swan song,A remix of the Beatles' legendary album   Abbey Road   is out Friday morning  marking 50 years since its original release. It includes studio sessions the public has never heard.   The opening track   Come Together   sets the tone for what would become the Be… [+2230 chars],2019-09-27T12:57:11Z
7986,business-insider,Business Insider,Inside the 'monstrosity ' a gritty  mostly-abandoned bus station in Tel Aviv that’s become an oasis for artists and urban explorers,,2019-09-27T16:34:00Z
7990,cbs-news,CBS News,Wells Fargo names Bank of New York Mellon chief as new CEO,Wells Fargo  still struggling to overcome a series of scandals that has tarnished its reputation  on Friday named Bank of New York Mellon chief Charles Scharf as its new CEO.  Scharf  who also previously served as CEO of Visa  spent much of his early career a… [+1224 chars],2019-09-27T12:35:01Z
7994,the-new-york-times,The New York Times,The White-Collar Job Apocalypse That Didn’t Happen,I can share my screen with them  but I cant  in real time  sit with them while theyre making the mistakes and show them where theyre making the mistakes  he said.  Mr. Kincaids current employer  Nexient  develops software for companies on a contract basis wor… [+1631 chars],2019-09-27T09:03:35Z
7998,newsweek,Newsweek,#CancelNYT Trends as Americans Slam the New York Times for Outing Trump Whistleblower as CIA Officer - Newsweek,The hashtag #CancelNYT began trending on Twitter on Thursday afternoon as tens of thousands of Americansoutraged over the New York Times' decision to identify the Trump whistleblower as a CIA officercalled on people to cancel their subscriptions with the news… [+6652 chars],2019-09-27T00:53:51Z
8002,business-insider,Business Insider,'Does Roku have Spotify?': How to download and stream Spotify on your Roku device,After disappearing for nearly all of 2018  a new and improved version of the Spotify app has returned to most Roku devices  which means you should be able to add the Spotify channel and stream music through your television.  Spotify is a streaming music servi… [+1737 chars],2019-09-27T17:53:00Z
8006,reuters,Reuters,U.S. drillers cut oil rigs for record 10 straight months -Baker Hughes,Sept 27 (Reuters) - U.S. energy firms reduced the number of oil rigs this week and for a record 10th month in a row as producers follow through on plans to cut spending on new drilling this year.   Drillers cut six oil rigs in the week to Sept. 27  bringing t… [+2685 chars],2019-09-27T17:11:29Z
8010,the-irish-times,The Irish Times,Rugby World Cup: an easy-to-do Japanese-inspired breakfast-brunch,When the Irish rugby team were preparing to travel to Japan for the World Cup  they called on Irishwoman Fiona Uyema  an expert that countrys culture and cuisine  for help.  I work with corporates and private groups who want to immerse themselves into Japanes… [+6799 chars],2019-09-27T13:00:00Z
8014,the-new-york-times,The New York Times,Dank Vapes  TKO and Other THC Vaping Brands Linked to Illnesses  C.D.C. Says,Both the C.D.C. and the Food and Drug Administration have been investigating the outbreaks of vaping illnesses  in an effort to not only identify the products used but also some of the substances that were inhaled.   The F.D.A. commissioner  Dr. Ned Sharpless… [+1287 chars],2019-09-27T17:00:31Z
8018,cnn,CNN,More than half of tree species found only in Europe could become extinct  study shows,(CNN)More than half of Europe's endemic trees -- species that are only found in the region -- are at risk of extinction because of diseases  pests and human activities  a conservation organization based in Geneva has said.  The International Union for Conserv… [+2011 chars],2019-09-27T15:45:37Z
8022,the-new-york-times,The New York Times,We Found the Very Worst Commuter Train in America,After New Jersey Transit started canceling trains with frustrating frequency last year  Mr. Giovine persuaded his boss to let him skip the commute one day a week and quit giving $317 to the railroad 12 times a year.  Ive stopped buying a monthly pass because … [+1221 chars],2019-09-27T16:35:33Z
8026,newsweek,Newsweek,Coral Reefs Threatened by Mysterious Disease Compared to Ebola - Newsweek,From Martin County out past Key West  a mysterious disease is attacking the stony coral reefs of Florida  liquifying them from the inside out and leaving nothing visible but patches of skeleton.  Known as Stony Coral Tissue Loss Disease (SCTLD)  National Mari… [+2464 chars],2019-09-27T02:56:38Z
8030,business-insider,Business Insider,Costco jobs aren't always easy  thanks to annoying shopper habits,Costco jobs aren't always a cakewalk.  Sometimes  that's due to the behavior of Costco members.  A 2018 study from the University of British Columbia found that the promise of deals can  lead consumers away from fully recognizing the human qualities of employ… [+1009 chars],2019-09-27T18:06:00Z
8034,the-wall-street-journal,The Wall Street Journal,WeWork  Juul Show Downsides of Silicon Valley Success Formula,We Co. is a New York company that subleases office space  and Juul Labs Inc. is a San Francisco based-seller of vaping products. But the resignations this week of the CEOs running two of the most valuable U.S. startups share common roots: a Silicon Valley eth… [+9794 chars],2019-09-27T09:30:00Z
8038,reuters,Reuters,Nestle  P&G say they will miss 2020 deforestation goals,CHICAGO (Reuters) - The world’s two largest consumer goods companies  Nestle (NESN.S) and Procter &amp; Gamble (PG.N)  told Reuters this week that they will fall short of their goals to only source key ingredients that do not contribute to deforestation by 20… [+2531 chars],2019-09-27T16:12:25Z
8042,reuters,Reuters,U.S. charges 35 people in massive healthcare fraud take-down involving genetic tests,WASHINGTON (Reuters) - U.S. authorities unveiled criminal charges against 35 individuals on Friday  as part of a sweeping crackdown into genetic testing fraud schemes that they said caused federal health insurance programs to lose more than $2.1 billion.   Th… [+404 chars],2019-09-27T17:05:32Z
8046,abc-news,ABC News,Report: No criminal action in Georgia jail dehydration death,A special investigative grand jury found that no one intentionally or criminally caused the death of a man who died in a Georgia jail from complications of dehydration.  Shali Tilson was arrested in March 2018 on misdemeanor charges of obstruction of justice … [+549 chars],2019-09-27T16:46:43Z
8050,abc-news,ABC News,Propane leak confirmed in explosion that killed firefighter,Investigators have confirmed that a leak in a propane line caused a deadly explosion in Maine.  The Maine Fire Marshal's Office said Friday that the leak was discovered in a propane line buried under the paved parking lot. It entered the building in the basem… [+538 chars],2019-09-27T16:54:58Z
8054,cnn,CNN,Fact-checking Trump's claims about the Bidens in China,Washington (CNN)In attacking the Bidens  President Donald Trump has spent the majority of his time focusing on Ukraine  but he's also at times made vague allegations about the Bidens' ties to China. On several occasions  he has intimated that the Bidens have … [+3676 chars],2019-09-27T18:01:55Z
8058,business-insider,Business Insider,The company behind the world's first subscription-based electric vehicle says it's so good  it will lead to a 'post-SUV era',Canoo  a Los Angeles-based company  has unveiled its eponymous flagship vehicle: the world's first subscription-only electric vehicle.  The carmaker decided to make their vehicles a one-month payment subscription service in order to  free its customers from t… [+1165 chars],2019-09-27T14:48:43Z
8062,abc-news,ABC News,15-year-old is latest killed in St. Louis-area gun violence,St. Louis County police are searching for the person who fatally shot a 15-year-old boy who's the latest of more than a dozen child victims killed in area gun violence this year.  Officers were called just after 5:30 a.m. Friday to a home in north St. Louis C… [+473 chars],2019-09-27T14:48:56Z
8066,the-new-york-times,The New York Times,Why Construction Noise Is Keeping You Up at 3 A.M.,She said that some of the projects her office received complaints about had been incorrectly categorized as minimal-noise projects. She also noted the potential health implications of being subjected to excessive noise.   Long-term exposure to noise can lead … [+1947 chars],2019-09-27T10:05:42Z
