id,source_id,source_name,title,content,published_at
0,reuters,Reuters,NTSB says Autopilot engaged in 2018 California Tesla crash,WASHINGTON (Reuters) - The National Transportation Safety Board said Tuesday a Tesla Model S was in Autopilot mode when it struck a fire truck in Culver City  California one of a series of crashes the board is investigating involving Tesla’s driver assistance… [+478 chars],2019-09-03T16:22:20Z
4,bbc-news,BBC News,UK government lawyer says proroguing parliament 'political not legal',,2019-09-03T14:39:21Z
8,bbc-news,BBC News,How are emotional support animals allowed on flights?,Image copyrightGetty Images  You might have seen pictures in the past of some pretty strange animals who've boarded flights.  From a kangaroo to a turkey... and now a miniature horse called Flirty. Small for a horse maybe  but still pretty big to be sat next … [+2380 chars],2019-09-03T16:21:52Z
12,cnn,CNN,'Saved by the Bell' just may have a reunion coming up,,2019-09-03T12:45:52Z
16,the-new-york-times,The New York Times,Attack at School in China Leaves at Least 8 Children Dead,It said the wounded children had been taken to hospitals for treatment. There was no immediate word on their conditions.  Calls to the Enshi public security bureau Tuesday night went unanswered.  A report published online on Monday by the Guangzhou-based news… [+781 chars],2019-09-03T14:21:44Z
20,al-jazeera-english,Al Jazeera English,Brexit: All the latest updates,British Prime Minister Boris Johnson faces a parliamentary showdown over his bid to guide the United Kingdom out of the European Union by an October 31 deadline  with or without a divorce deal.  On their first day back after summer holidays  rebel and opposit… [+4500 chars],2019-09-03T14:55:44Z
24,reuters,Reuters,Trial of actor Cuba Gooding Jr in groping case gets October date,NEW YORK (Reuters) - Judge Herbert Moses of the Manhattan Supreme Court set an Oct. 10 trial date on Tuesday for the actor Cuba Gooding Jr.  who was charged with groping a woman at a Manhattan bar in June.   Gooding  dressed in a gray suit and tie  appeared c… [+1400 chars],2019-09-03T15:36:28Z
28,cbs-news,CBS News,Philadelphia district attorney exonerates 9 people in 19 months,Chester Hollman spent 27 years and 11 months in prison; Terrance Lewis spent 21 years  five months  five days; and Johnny Berry spent approximately 24 years in prison. They have always maintained their innocence.  Together they spent nearly 74 years in prison… [+4849 chars],2019-09-03T13:29:40Z
32,reuters,Reuters,Illinois joins lawsuit to ask court to stop merger of T-Mobile  Sprint,WASHINGTON  Sept 3 (Reuters) - Illinois has joined a multistate lawsuit aimed at stopping the merger of U.S. wireless carriers T-Mobile US Inc and Sprint Corp  the New York attorney general’s office  which is leading the effort along with California  said Tue… [+200 chars],2019-09-03T17:04:14Z
36,abc-news,ABC News,Israel sends firefighters to help Brazil battle Amazon fires,Israel says it will be dispatching a team of firefighters to assist Brazil with combatting the fires that have consumed large swaths of the country's Amazon rainforest.  The Foreign Ministry said Tuesday that after Prime Minister Benjamin Netanyahu had discus… [+589 chars],2019-09-03T14:48:11Z
40,cbs-news,CBS News,Pence defends decision to stay at Trump Doonbeg property,Vice President Mike Pence's staff is defending his decision to stay at one of President Donald Trump's properties while in Ireland amid criticism by Democrats that he's enriching Trump at taxpayers' expense  Pence's chief of staff  Marc Short  said Tuesday th… [+1554 chars],2019-09-03T11:10:54Z
44,the-new-york-times,The New York Times,Justin Bieber Says Childhood Fame Opened Door to ‘Heavy’ Drug Use,Bieber has credited his marriage last year to the model Hailey Baldwin (now Hailey Bieber)  22  with helping him gain perspective  and he did so again on Monday  calling their union an amazing  crazy  new responsibility. (Bieber dated the actress and singer S… [+1152 chars],2019-09-03T16:34:27Z
48,reuters,Reuters,U.S. judge says opioid litigation can proceed toward trial,(Reuters) - A U.S. judge on Tuesday rejected efforts by drugmakers  distributors and pharmacies to dismiss claims that they caused the nation’s opioid crisis  clearing the way for a scheduled landmark trial even as he pushes for a nationwide settlement.   U.S… [+2454 chars],2019-09-03T17:44:30Z
52,cbs-news,CBS News,62 000 people in the Bahamas don't have access to fresh water after Dorian  Red Cross says,,2019-09-03T12:47:32Z
56,cnn,CNN,Biden campaign signals it's preparing for a long primary fight,,2019-09-03T17:56:34Z
60,newsweek,Newsweek,No Food  No Jobs  No Future: Turned Away From the U.S. Border  Young Hondurans Say They Are Struggling to Survive,Walking through the gym of a local community outreach center in Choloma  Honduras  25-year-old Josue Betancourt is reminded of brighter days  when he used to be able to come here to work out with friends.   You know  I used to be more buff than him   Betancou… [+6352 chars],2019-09-03T06:00:01Z
64,business-insider,Business Insider,Pottery Barn Teen's Fantastic Beasts Collection features decor and bedding that 'Harry Potter' fans of any age will love,One of the aspects that I find irresistible about the  Harry Potter  franchise is the whimsical and  of course  magical art direction of the films. This Wizarding World that the filmmakers created  and as seen on the big screen  possesses a charm that is deli… [+1302 chars],2019-09-03T16:30:00Z
68,newsweek,Newsweek,Oklahoma Man Hurls Cupcake From Car and Hits Driver in the Face  Gets Charged With Assault,An Oklahoma man has been hit with a misdemeanor assault charge after allegedly hurling a cupcake from a car and striking another driver in the face  police say.  Trevor Pearson  31  of Lexington  was set to appear in Garvin County District Court this week aft… [+2368 chars],2019-09-03T10:23:17Z
72,cnn,CNN,Walmart ends all handgun ammunition sales and asks customers not to carry guns into stores,New York (CNN Business)Walmart on Tuesday announced it will reduce its gun and ammunition sales  one month after more than 20 people were killed in a mass shooting at a Walmart in El Paso  Texas. Walmart also pressured Congress to enact gun safety measures.  … [+3861 chars],2019-09-03T17:00:05Z
76,business-insider,Business Insider,Paying with a debit card is leaving money on the table  and 4 more reasons I only ever pay with credit,Nothing makes me cringe more than going to to stores and restaurants with my friends and watching them pay with cash or a debit card. Or worse  when the occasional person still pulls out a checkbook and writes a personal check  carefully noting their purchase… [+3749 chars],2019-09-03T17:44:43Z
80,the-new-york-times,The New York Times,Your Tuesday Briefing,There  the Greek-influenced calendar had only 10 months. A few were named for gods: March for Mars  April for Aphrodite  May for Maia and June for Juno. But the rest were numbered  and some are still with us. October was the eighth month  November the ninth a… [+1049 chars],2019-09-03T09:48:29Z
84,abc-news,ABC News,Justice Sotomayor encourages kids to 'Just Ask' in new book,Supreme Court Justice Sonia Sotomayor has said that the seed for what has become her latest children's book was planted the day a woman called her a drug addict.  Sotomayor   who was diagnosed with diabetes at age 7  had gone to the bathroom of an upscale New… [+3619 chars],2019-09-03T14:42:43Z
88,newsweek,Newsweek,Nintendo Direct Predictions: Next 'Smash Ultimate' DLC  'Pokémon Sword and Shield' Starter Evolutions and More,Nintendo is springing a new Direct on fans this week with a lot of information expected from the 40-minute presentation.  The company has already announced that Pokémon Sword and Shield and Luigi's Mansion 3 will get the spotlight during the next Nintendo Dir… [+2605 chars],2019-09-03T17:02:59Z
92,bbc-news,BBC News,Euro 2020 qualifiers: Aaron Wan-Bissaka out of England squad with back injury,Aaron Wan-Bissaka joined Manchester United from Crystal Palace in a £50m deal this summer  Manchester United full-back Aaron Wan-Bissaka has withdrawn from the England squad because of a back injury.  Wan-Bissaka was named in Gareth Southgate's senior side fo… [+426 chars],2019-09-03T15:43:49Z
96,newsweek,Newsweek,Hurricane Dorian Path Map Update: Category 3 Storm's Slow Movement Will Make It More Destructive Say Experts,Hurricane Dorian is wreaking more havoc on the Bahamas because the calm atmosphere above it is keeping it stationary  meteorologists have warned.  In a counterintuitive analysis of the most powerful Atlantic hurricanes on record  where winds have reached up t… [+2947 chars],2019-09-03T10:27:36Z
100,bbc-news,BBC News,'I'm all for the battle' with Steve Smith- Jofra Archer,England pace bowler Jofra Archer says he is  all for battle  against Australia's Steve Smith but he's  not trying to scare him either .  Smith missed the third Test with concussion after he was hit on the neck by a 92mph delivery from Archer and they are set … [+196 chars],2019-09-03T17:49:48Z
104,reuters,Reuters,Netflix applies for license under new Turkish broadcasting rules,ISTANBUL/NEW YORK (Reuters) - U.S. online streaming service Netflix (NFLX.O) has applied for a license to continue operating in Turkey under new online broadcasting rules that have raised fears over possible censorship in the future.   Turkey last month grant… [+3878 chars],2019-09-03T15:33:26Z
108,cbs-news,CBS News,Some Florida coastal residents refuse to leave homes ahead of Hurricane Dorian,,2019-09-03T11:35:31Z
112,the-new-york-times,The New York Times,Jeffrey Epstein’s New York Hunting Ground: Dance Studios,Two of the lawsuits say that Mr. Epstein used his time on work release to have sex with at least two of the young women he had recruited in New York.   One  identified in court papers as Priscilla Doe  said Mr. Epstein flew her to Florida during his imprisonm… [+1530 chars],2019-09-03T09:59:30Z
116,bbc-news,BBC News,T20 World Cup Qualifier: Thailand claim two-run win over Ireland women,Ireland's women will face Bangladesh or Scotland in Thursday's semi-final  <table><tr><td>ICC T20 World Cup Qualifier: Dundee  Scotland</td></tr><tr><td>Ireland 90-9: Richardson 21  Waldron 14; Sutthiruang 3-14  Laomi 3-17</td></tr><tr><td>Thailand 92-7: Chal… [+995 chars],2019-09-03T14:08:14Z
120,bbc-news,BBC News,2019/09/03 14:00 GMT,The latest five minute news bulletin from BBC World Service.,2019-09-03T14:06:00Z
124,reuters,Reuters,Israel says Hezbollah plans advanced missile plant in Lebanon's Bekaa,JERUSALEM (Reuters) - Israel accused Hezbollah on Tuesday of setting up a factory for precision-guided missiles in Lebanon’s Bekaa valley  in a veiled warning of further possible Israeli counter-strikes after a drone attack near Beirut set off brief cross-bor… [+1634 chars],2019-09-03T16:13:37Z
128,abc-news,ABC News,Convicted hacker called to testify to grand jury in Virginia,A convicted hacker who's serving 10 years in prison for breaking into computer systems of security firms and law-enforcement agencies has been called to testify to a federal grand jury in Virginia.  Supporters of Jeremy Hammond  part of the Anonymous hacking … [+587 chars],2019-09-03T15:24:41Z
132,abc-news,ABC News,Atlanta comfort Hurricane Dorian evacuees with free services,Atlanta is welcoming Hurricane Dorian evacuees with open arms  camping spaces and America's favorite pastime.  Interested in Hurricane Dorian?  Add Hurricane Dorian as an interest to stay up to date on the latest Hurricane Dorian news  video  and analysis fro… [+753 chars],2019-09-03T10:54:38Z
136,business-insider,Business Insider,Thieves broke into an Australian Apple store with a sledgehammer and stole $300 000 worth of Apple products — but they may already be worth nothing (AAPL),Thieves smashed the window of an Apple store in Perth  Australia  with a sledgehammer on Tuesday morning and stole $300 000 in iPhones and other products  according to Perth Now and other Perth news outlets  which we first saw on 9to5Mac.    However  Apple re… [+1693 chars],2019-09-03T16:18:37Z
140,abc-news,ABC News,WATCH: Floodwaters in Bahamas still too dangerous for responders,<li>Now Playing: Trump criticized for golfing as Hurricane Dorian approaches US   </li><li>Now Playing: Inside FEMA headquarters as US feels Hurricane Dorian's effects   </li><li>Now Playing: Floodwaters in Bahamas still too dangerous for responders  </li><li… [+1334 chars],2019-09-03T17:17:50Z
144,abc-news,ABC News,Suspect fatally shot by police in Kaukauna,Wisconsin police say an officer fatally shot a suspect after a pursuit ended with a crash in Kaukauna.  Fox Valley Metro Police say the chase ended early Tuesday when the suspect crashed near county Highway OO and state Highway 55. Authorities say the suspect… [+216 chars],2019-09-03T17:46:39Z
148,cnn,CNN,A 14-year-old confessed to killing all five of his family members in an Alabama home  authorities say,,2019-09-03T08:38:03Z
152,bbc-news,BBC News,Her Story Made History: Michelle Bachelet,Michelle Bachelet's father died after being detained and tortured during the first year of General Pinochet's dictatorial rule in Chile. More than 40 years later  Michelle became Chile's first female president. Lyse Doucet hears the story of her remarkable li… [+2 chars],2019-09-03T13:15:00Z
156,the-irish-times,The Irish Times,Arsenal defence makes balance hard to come by,It is not the sort of admission with which a member of the goalkeepers union ought to be comfortable. In the throes of a discussion about Arsenals identity  Bernd Leno was asked whether his team were the sort who backed themselves to outscore all comers. Yes … [+5106 chars],2019-09-03T10:37:37Z
160,the-irish-times,The Irish Times,Mary Robinson reminds global investors of their climate duty,Former president of IrelandMary Robinson told a group of international investors managing over 5 trillion of assets that they have a duty to put climate action at the heart of their investment strategies to limit global warming.   We all have a responsibility… [+1553 chars],2019-09-03T16:45:39Z
164,the-new-york-times,The New York Times,Life Is Imitating Stephen King’s Art  and That Scares Him,They had happy endings. They had optimistic viewpoints about humanity  both individual people and groups of people  even when there were jerks in the mix  Vincent says. Is he mellowing with his viewpoint of the world  or in the earlier books might that have a… [+1866 chars],2019-09-03T09:00:13Z
168,business-insider,Business Insider,Boeing shares slide as the latest 737 Max delay threatens holiday-season travel (BA),Boeing stock fell as much as 4% on Monday trading after United Airlines and American Airlines announced an extended cancellation of 737 Max flights until December.    United said Friday it would delay of 737 Max flights until December 19 as it waits for the m… [+2397 chars],2019-09-03T14:35:29Z
172,cnn,CNN,Your boss hates you. What do you do?,,2019-09-03T16:15:09Z
176,the-irish-times,The Irish Times,Terry Gilliam: I disagree with John Cleese on Brexit,Terry Gilliam has said he disagrees with the way his friend and fellow Monty Python member John Cleese sees the world  following comments from the latter endorsing Brexit and criticising the diversity of London.  The animator and Hollywood director despairs o… [+1651 chars],2019-09-03T09:29:41Z
180,cnn,CNN,Dorian won't make landfall in Florida  but the east coast is still under threat,(CNN)Hurricane Dorian will move  dangerously close  to Florida overnight Tuesday  but the Category 3 storm is not currently expected to make landfall in the US over the next few days.  Still  a wobble here or a strong outer band there could bring its path of … [+4363 chars],2019-09-03T14:43:24Z
184,the-irish-times,The Irish Times,Johnson approved prorogation in August  Edinburgh court told,Boris Johnson  the UK prime minister  signed off on a plan to suspend the UK parliament two weeks before it was announced  dismissing the September gathering of the House of Commons as a rigmarole  a Scottish court heard on Tuesday.  The details of when the U… [+3331 chars],2019-09-03T18:11:58Z
188,cbs-news,CBS News,California boat fire death toll jumps and several still missing,Santa Barbara  Calif. -- A middle-of-the-night fire swept a boat carrying recreational scuba divers anchored near an island off the Southern California coast early Monday  leaving at least 25 dead and nine others missing.  Five of six crew members on the Conc… [+7145 chars],2019-09-03T06:00:05Z
192,business-insider,Business Insider,How to turn a PS4 on or off  or put it into Rest Mode  using the controller or system,There are multiple ways to turn a PlayStation 4 console on or off  and there are even different power settings you can use  depending on how long you think you'll be away from your games.    Using Rest Mode keeps the system ready to quickly come back online  … [+1704 chars],2019-09-03T14:42:00Z
196,abc-news,ABC News,Celebrity birthdays for the week of Sept. 8-14,Celebrity birthdays for the week of Sept. 8-14:  Sept. 8: Ventriloquist Willie Tyler (with Lester) is 79. Actor Alan Feinstein is 78. Singer Sal Valentino of The Beau Brummels is 77. Actress Heather Thomas ( The Fall Guy ) is 62. Singer Aimee Mann is 59. Bass… [+7426 chars],2019-09-03T13:34:45Z
200,abc-news,ABC News,Sheryl Crow feels 'liberated' by saying goodbye to the album,Sheryl Crow has a lifetime of stories of hanging out with rock stars  pop stars  athletes  icons and music royalty  some even featured on her new collaborative record  but don't expect her to start revealing any secrets in an autobiography.   I mean  there ar… [+4022 chars],2019-09-03T15:27:46Z
204,the-wall-street-journal,The Wall Street Journal,In a School District Where Technology Rules  Grades Fall. Parents Ask Why.,When Baltimore County  Md.  public schools began going digital five years ago  textbooks disappeared from classrooms and paper and pencils were no longer encouraged. All students from kindergarten to 12th grade would eventually get a laptop  helping the distr… [+271 chars],2019-09-03T15:15:00Z
208,cnn,CNN,Fashion weeks are about to start: Here's what we expect to see during a month of shows,fashionPublished 3rd September 2019  There's a specter hovering over London Fashion Week: When the first show opens next Friday  the UK will be less than seven weeks away from its scheduled departure from the European Union. It's difficult to imagine Brexit n… [+8143 chars],2019-09-03T12:39:29Z
212,cnn,CNN,South African president calls for arrest of those involved in xenophobic attacks,,2019-09-03T15:41:27Z
216,the-irish-times,The Irish Times,Podcast: The Tory rebels take on Boris Johnson,World View is a weekly foreign affairs podcast from The Irish Times. Listen on Apple Podcasts  on Spotify  on Stitcher or on Soundcloud.  The House of Commons is set for a showdown as rebel Conservative Party MPs seek to introduce legislation on Tuesday  bloc… [+732 chars],2019-09-03T15:17:56Z
220,the-irish-times,The Irish Times,US teenager kills five family members in Alabama shooting,A 14-year-old American boy shot and killed five family members at their home in Alabama  before throwing away the pistol and calling police  officials said on Tuesday  in the latest high-profile gun crime.  The shooting occurred on Monday night in the town of… [+983 chars],2019-09-03T12:17:47Z
224,reuters,Reuters,Pantomime villain Medvedev fueled by New York hate,NEW YORK (Reuters) - Daniil Medvedev never sought to be the pantomime villain at this year’s U.S. Open but after being lustily booed by the New York crowd for his on-court antics during his last two wins  he is learning to use the energy to his advantage.    … [+3135 chars],2019-09-03T17:32:12Z
228,cbs-news,CBS News,Dierks Bentley: Ticketed for fishing in Colorado without a license,,2019-09-03T01:53:44Z
232,the-new-york-times,The New York Times,You Haven’t Heard From These Chefs for a While. But You Will.,It has been only three months since the Four Seasons restaurant closed  but Bill Yosses  67  who was its high-profile pastry chef (and held that position at the White House when the Obamas lived there)  will open Palais by Perfect Pie with John Wu and other p… [+863 chars],2019-09-03T16:29:09Z
236,al-jazeera-english,Al Jazeera English,Palestinian Harvard student denied entry to US finally arrives,,2019-09-03T16:09:54Z
240,al-jazeera-english,Al Jazeera English,Palestinian PM vows to release probe result over woman's death,Palestinian Prime Minister Mohammad Shtayyeh says a number of people have been called in for questioning over the death of a 21-year-old woman under suspicious circumstances  in a case that sparked widespread anger in the occupied West Bank.  Though the exact… [+3448 chars],2019-09-03T11:20:46Z
244,newsweek,Newsweek,Bayley Turns Heel on Becky Lynch at Monday Night RAW,In one of the most surprising WWE moments of the year  SmackDown Women's Champion Bayley turned heel in the main event of Monday Night RAW.  Bayley was teaming up with RAW Women's Champion Becky Lynch to take on the Women's Tag Team Champions  Nikki Cross and… [+2233 chars],2019-09-03T03:33:22Z
248,the-irish-times,The Irish Times,Tory rebels vow to defy Johnson’s ‘threats’ on Brexit vote,Former British education secretary and pro-second referendum Conservative MP Justine Greening has confirmed that she will stand down at the next election.  The Putney MP told the Radio 4 BBC Today programme: It has been on my mind for some time  this is not a… [+1982 chars],2019-09-03T08:12:37Z
252,the-irish-times,The Irish Times,Louise Kennedy AW2019: Long coats  sparkling tweed dresses and emerald knits,Louise Kennedy is showing off her autumn-winter collection in Dublin tonight and the show will start with her glittering new take on Black Watch tartan.  Sixteen models will present more than 60 ensembles to over 200 guests  including the designers close frie… [+145 chars],2019-09-03T14:40:00Z
256,business-insider,Business Insider,How to buy a house with bad credit,Buying a house with bad credit is possible  but it will likely end up costing you extra money in the long run.    Unlike traditional mortgages  which require a good credit score to qualify  loans that are available to those with lower credit scores typically … [+4407 chars],2019-09-03T17:18:00Z
260,al-jazeera-english,Al Jazeera English,All eyes on parliament as UK faces pivotal day on Brexit,The United Kingdom's Parliament is set for a heated showdown  with Prime Minister Boris Johnson facing a rebellion by members of his own party and the chance of a snap election to resolve a three-year deadlock over Brexit appearing to increase.  As MPs return… [+3956 chars],2019-09-03T10:47:13Z
264,al-jazeera-english,Al Jazeera English,Discontent swells in Zimbabwe amid crackdown  economic woes,Harare  Zimbabwe -Emmerson Mnangagwa wanted a clean break from his predecessor's past.  Whereas Robert Mugabe  who ruled Zimbabwe for 37 years  would contravene the West diplomatically  President Mnangagwa wanted to engage. And contrary to Mugabe's strategy o… [+5773 chars],2019-09-03T09:46:24Z
268,cbs-news,CBS News,Joe Manchin to announce his political future on Tuesday morning,Senator Joe Manchin III  Democrat of West Virginia  one of the few bipartisan power brokers left in the sharply divided U.S. Senate  is set to announce Tuesday morning whether or not he plans to run again for his old job of West Virginia governor.  CBS News h… [+2319 chars],2019-09-03T03:13:47Z
272,the-new-york-times,The New York Times,What We Know About the Catastrophic California Boat Fire,Heres his dispatch from the front lines of the fight:  As soon as you let me know  said Tyler Sandness  a driver and organizer with the group Rideshare Drivers United  Ill get you on the yes list.  It was late Wednesday morning  and Mr. Sandness was urging fe… [+1390 chars],2019-09-03T13:04:04Z
276,newsweek,Newsweek,Donald Trump 'Injected a Poison' Into Politics  MSNBC Guest Says: 'How Long Will It Take to Undo the Damage?',The commentator Mike Barnicle said President Donald Trump has  injected a poison  into America's political system by using the White House to attack the free media and the concept of objective truth.  Barnicle  a veteran columnist  was taking part in a panel … [+2868 chars],2019-09-03T14:21:18Z
280,business-insider,Business Insider,I spent 5 years analyzing how rich people get rich  and found there are generally 4 paths to wealth,The top 5% of households in America reported $197 651 or more in income in 2016  according to the Tax Foundation. This same top 5% controlled 60% of the nation's wealth  according to the Federal Reserve Survey of Consumer Finance.    This 5% run big companies… [+4420 chars],2019-09-03T15:44:03Z
284,al-jazeera-english,Al Jazeera English,Hong Kong's Carrie Lam denies trying to resign,Hong Kong's embattled leader Carrie Lam has dismissed a leaked audio recording of her saying she would resign if she had a choice.  Her comments were recorded during a private lunch last week and come after three months of anti-government protests.  Al Jazeer… [+21 chars],2019-09-03T10:31:38Z
288,the-wall-street-journal,The Wall Street Journal,Phones Buzz in Class—With Texts From Mom and Dad,Cellphone usage in class is getting so out of control that some schools are locking up students phones during the day. Heres a notification for you parents: Youre partly to blame.  Students  teachers and administrators say parents light up their kids phones t… [+146 chars],2019-09-03T09:30:00Z
