id,source_id,source_name,title,content,published_at
2610,the-irish-times,The Irish Times,Make a Move to... Ringsend,Whats so good about it?  Has any Dublin neighbourhood undergone such a dramatic shift in the last couple of decades? Ringsends history is fantastically rich it was famously the point where Cromwell arrived in 1649. Several centuries later  it was the turn of … [+5760 chars],2019-09-07T05:00:00Z
2614,abc-news,ABC News,Stranded North Carolinians take stock of Dorian's damage,As the sky cleared and floodwaters receded Saturday  residents of North Carolina's Outer Banks began to assess the damage wrought by Hurricane Dorian.  Steve Harris has lived on Ocracoke Island for most of the last 19 years. He's ridden out eight hurricanes  … [+4731 chars],2019-09-07T13:07:32Z
2618,business-insider,Business Insider,A 150-foot  champagne-colored superyacht reportedly once owned — and apparently abandoned — by Nicole Kidman just hit the market. Take a look inside.,A superyacht reportedly once owned by actress Nicole Kidman is up for sale  according to yacht management firm Imperial.    The superyacht's price is being kept under wraps  however. Potential buyers will only see the price tag after submitting an application… [+1221 chars],2019-09-07T13:02:00Z
2622,cbs-news,CBS News,New exhibit honors LIFE magazine's female photography pioneers,,2019-09-07T12:15:35Z
2626,the-irish-times,The Irish Times,Church services,CATHEDRALS  Armagh -St Patricks Church of Ireland --Sunday services at 10am (Holy Communion)  11am (Sung Eucharist) and 3:15pm (Choral Evensong). Mon to Sat at 9:30am (Said Matins) and 12:30pm (1st Wednesday of every month). Opening times for visitors are 9am… [+24013 chars],2019-09-07T04:00:00Z
2630,cbs-news,CBS News,Saturday Sessions: J.S. Ondara performs  Lebanon ,,2019-09-07T12:57:04Z
2634,abc-news,ABC News,Duke: No evidence of improper benefits to Zion Williamson,Duke says an investigation has found no evidence that former basketball star Zion Williamson received improper benefits.  School spokesman Michael Schoenfeld said in a statement Saturday that a  thorough and objective  probe led by investigators outside the a… [+871 chars],2019-09-07T17:30:26Z
2638,reuters,Reuters,Taliban kidnap six Afghan journalists,KABUL (Reuters) - Taliban kidnapped six Afghan journalists working for private and government media organisations in eastern Paktia province  government officials and Taliban said on Saturday.   The reporters  working for radio and TV news companies that broa… [+1824 chars],2019-09-07T12:29:02Z
2642,abc-news,ABC News,The Latest: Rare hurricane likely to be felt in Canada,The Latest on Hurricane Dorian (all times local):  8:45 a.m.  Weather forecasters expect a weakening Hurricane Dorian to arrive off the southeastern Canada coast with hurricane-force winds  heavy rain  and dangerous storm surge.  The National Hurricane Center… [+2678 chars],2019-09-07T12:45:13Z
2646,newsweek,Newsweek,Ronan Farrow: M.I.T. Media Lab Knew About Jeffrey Epstein's Abuse  But Accepted Money Anyway,Friday evening  The New Yorkerpublished an exposé by Ronan Farrow alleging that the Massachusetts Institute of Technology (M.I.T.) Media Lab continued to accept donations from convicted sex offender Jeffrey Epstein  despite knowing about his past  and even wo… [+3562 chars],2019-09-07T03:52:49Z
2650,the-irish-times,The Irish Times,Hairy shoe (plus crab) washed up in Clare from Carolina cargo spill,This shoe plus crab obviously originated from the cargo spill at North Carolina in 2018. Many of these shoes arrived on the Clare coast in spring this year but not as hairy as this one. The crab was the gulfweed crab which lives in the Sargasso Sea.Sabine Spr… [+1526 chars],2019-09-07T05:00:00Z
2654,cbs-news,CBS News,Iran using advanced centrifuges  violating nuclear deal,Tehran  Iran — Iran has begun using arrays of advanced centrifuges to enrich uranium in violation of its 2015 nuclear deal  a spokesman said Saturday  warning that Europe has little time left to offer new terms to save the accord.  The comments by Behrouz Kam… [+6582 chars],2019-09-07T12:27:55Z
2658,business-insider,Business Insider,Jeffrey Epstein reportedly brought 'Eastern European' models with him to MIT  where employees planned how they could help them if they weren't 'there by choice',Jeffrey Epstein  the 66-year-old disgraced hedge fund manager who died in an apparent suicide inside a federal prison in August  brought two  Eastern European  models to MIT's Media Lab  where staffers discussed how they could help them if they were brought a… [+3648 chars],2019-09-07T06:57:39Z
2662,cnn,CNN,The Bahamas' hurricane death toll is rising fast as survivors try to get out,Great Abaco  the Bahamas (CNN)Nearly a week after Hurricane Dorian turned parts of the northern Bahamas into piles of debris  the nation has only started unraveling the damage.   The death toll rose to 43 and officials say that number will go up drastically a… [+3425 chars],2019-09-07T08:21:45Z
2666,al-jazeera-english,Al Jazeera English,India's space hopes dashed for now with loss of lunar lander,The moment India had waited years for - when the  15 minutes of terror  transformed into fist-pumping exhilaration - arrived as a time of silence and bitter disappointment.  India's hopes for its Vikram lunar lander to make a soft landing on the moon were all… [+4593 chars],2019-09-07T04:54:55Z
2670,business-insider,Business Insider,Brex  the buzzy credit card startup valued at $2.6 billion  is opening a restaurant in the heart of San Francisco's VC district,South Park Cafe isn't your typical coffee-and-a-pastry-type of establishment. Espresso drinks are on offer in the morning hours  featuring locally roasted Four Barrel beans. But by lunchtime  the space transforms into a chic  sit-down  California bistro featu… [+10114 chars],2019-09-07T12:01:00Z
2674,the-irish-times,The Irish Times,Free public transport scheme: ‘If they tried to take it away  we’d fight it’,Just shy of 50 million journeys were taken under Irelands free travel scheme in 2018  a 30 per cent increase in eight years. The scheme  which allows the over-66s  their spouses  and people on disability allowance or carers allowance  to travel free of charge… [+11541 chars],2019-09-07T05:00:00Z
2678,the-irish-times,The Irish Times,Brexit brinkmanship: Will Boris Johnson’s bad week get even worse?,The police cadets were a model of discipline  in their black uniforms and peaked caps  as they stood in formation on a platform outside their training centre in Wakefield  in the northern English county of Yorkshire. They had been standing for more than an ho… [+11752 chars],2019-09-07T05:15:00Z
2682,bbc-news,BBC News,Robert Mugabe granted national hero status and official mourning,Image copyrightReutersImage caption   Robert Mugabe was known for his fiery speeches  even in his 90s  Three days of national mourning have begun in Zimbabwe following the death of former president Robert Mugabe.  Mr Mugabe  Zimbabwe's first post-independence… [+5385 chars],2019-09-07T07:00:12Z
2686,reuters,Reuters,Taliban kidnap six Afghan journalists,KABUL (Reuters) - Taliban kidnapped six Afghan journalists working for private and government media organisations in eastern Paktia province  government officials and Taliban said on Saturday.   The reporters  working for radio and TV news companies that broa… [+1824 chars],2019-09-07T12:01:16Z
2690,reuters,Reuters,U.S. House panel poised to spell out Trump impeachment probe - source,WASHINGTON (Reuters) - The Democratic-led U.S. House of Representatives Judiciary Committee  criticized for an unorthodox impeachment probe of President Donald Trump  is poised to vote next week on a resolution to formalise the investigation  a person familia… [+2393 chars],2019-09-07T17:04:16Z
2694,cnn,CNN,Evacuees arrive in Florida after leaving ravaged Bahamas,Chat with us in Facebook Messenger. Find out what's happening in the world as it unfolds.,2019-09-07T16:36:45Z
2698,bbc-news,BBC News,Tottenham stabbing: Man charged with killing 15-year-old,Image copyrightPA MediaImage caption   Perry Jordan Brammer was attacked on Willan Road in the Broadwater Farm estate in Tottenham  A man has been charged with the murder of a 15-year-old boy who was repeatedly stabbed in a north London street.  Perry Jordan … [+426 chars],2019-09-07T08:31:33Z
2702,the-irish-times,The Irish Times,Revenue seizes 118 000 cigarettes after boarding vessel,Officials from the Revenue Commissioners have seized more than 118 000 cigarettes after boarding an Italian-registered merchant vessel off the coast of Dublin.  The search of the vessel  which took place on Friday  was carried out following a surveillance ope… [+701 chars],2019-09-07T12:05:43Z
2706,cnn,CNN,Jet skiers saved 100 people trapped in flooded homes in the Bahamas,,2019-09-07T06:57:57Z
2710,business-insider,Business Insider,Antonio Brown posts wild video with a recorded call from Jon Gruden asking ‘Do you want to be a raider or not?’,The drama surrounding Antonio Brown's start with the Oakland Raiders took another bizarre turn on Friday night after the star wide receiver posted a video that included a call with head coach Jon Gruden to YouTube.    After exchanging greetings  Gruden can be… [+2453 chars],2019-09-07T02:29:08Z
2714,the-irish-times,The Irish Times,Roy Keane remains entertaining  unrepentant and his own worst enemy,The next Martin Scorcese film due to be released is called The Irishman. If the great  bushy-eyed director should ever stumble on Roy Keanes live interview with the Off the Ball crew during the week  then he will go to his grave wishing he could have cast Cor… [+6918 chars],2019-09-07T08:00:00Z
2718,reuters,Reuters,Turkey's Erdogan says will discuss Syria with Trump at U.N.,ISTANBUL (Reuters) - Turkish President Tayyip Erdogan said on Saturday he expects to meet U.S. President Donald Trump at the United Nations later this month to discuss military operations in northeast Syria  where Turkey plans to resettle one million Syrian r… [+2184 chars],2019-09-07T16:59:25Z
2722,cnn,CNN,Lemon: Come on  man. Lead the country.,Chat with us in Facebook Messenger. Find out what's happening in the world as it unfolds.,2019-09-07T05:47:17Z
2726,abc-news,ABC News,3 SEAL Team 7 leaders fired for team's alleged misconduct,In a rare move  the three senior leaders of the U.S. Navy's elite SEAL Team 7 have been removed from their positions due to a  loss of confidence  after allegations of misconduct among one of the platoons under their command that was sent home from Iraq.  The… [+4085 chars],2019-09-07T01:12:31Z
2730,bbc-news,BBC News,2019/09/07 14:00 GMT,The latest five minute news bulletin from BBC World Service.,2019-09-07T14:04:00Z
2734,the-irish-times,The Irish Times,Scotland’s injury worries mount ahead of Ireland opener,Gregor Townsend was left counting the cost of his sides six-try victory over Georgia after confirming he has five World Cup injury concerns.  The most serious worries centre around flanker Jamie Ritchie who was taken to hospital after the Dark Blues send-off … [+2577 chars],2019-09-07T10:40:06Z
2738,abc-news,ABC News,Hundreds march against Bosnia's first LGBT pride parade,Several hundred people have marched in Bosnia's capital to show disapproval of the Balkan country's first LGBT pride parade this weekend.  Participants in Saturday's protest said they wanted to promote what conservatives call  traditional family values.   A p… [+594 chars],2019-09-07T16:41:03Z
2742,newsweek,Newsweek,RuPaul Announces First-Ever 'Drag Race' Las Vegas Residency,Sin City is about to get a lot more fierce. RuPaul announced Saturday at DragCon in New York that the first-ever RuPaul's Drag Race Live! Las Vegas residency at the Flamingo Hotel would start in January 2020.   The RuPaul's Drag Race Live! Las Vegas residency… [+2123 chars],2019-09-07T13:16:44Z
2746,reuters,Reuters,F2 racer Correa in induced coma after crash,American driver Juan Manuel Correa was placed in a medically induced coma in a setback in his recovery from a fatal Formula Two crash last week in Belgium.   Correa  20  was injured in the crash that killed Anthoine Hubert last Saturday when the French driver… [+974 chars],2019-09-07T16:22:26Z
2750,the-irish-times,The Irish Times,Ireland 19 Wales 10: Ireland player ratings,Reads this game better than anyone else. Out sprinted George North to deny the Welsh winger a certain try on four minutes. Textbook high fielding and slipped past Jonathan Davies for 14th international try. Rating: 8.  Turnover on 43 minutes was roundly appre… [+3664 chars],2019-09-07T15:44:18Z
2754,bbc-news,BBC News,Modi consoles scientists after moon-lander loses contact,VideoIndian Prime Minister Narendra Modi told his country's space scientists he was proud of a programme that had come so near to putting a probe on the Moon.,2019-09-07T08:57:08Z
2758,reuters,Reuters,Russian airplane lands in Moscow as part of prisoner swap with Kiev,MOSCOW (Reuters) - A Russian aircraft has landed in Moscow as part of a prisoner swap operation between Russia and Ukraine  Flightradar data showed on Saturday.   Reporting by Anton Zverev; writing by Polina Devitt; editing by Mark Heinrich,2019-09-07T10:43:43Z
2762,reuters,Reuters,Greek PM set to outline tax cuts  structural reforms,ATHENS (Reuters) - Greece’s prime minister is expected on Saturday to detail tax cuts for companies strained by years of austerity  while also promising pro-business reforms aimed at convincing lenders to ease the nation’s fiscal target from 2021.   Conservat… [+2346 chars],2019-09-07T10:21:36Z
2766,reuters,Reuters,Rugby-Ireland  Wales satisfied with preparations as World Cup beckons,DUBLIN  Sept 7 (Reuters) - Ireland and Wales are both satisfied with their World Cup preparations despite a mixed month of warm-up games  their coaches said on Saturday after Ireland got the better of the Six Nations champions for the second successive week. … [+2648 chars],2019-09-07T16:54:45Z
2770,the-new-york-times,The New York Times,Russia and Ukraine Exchange Dozens of Prisoners  Aiming to Defuse Tensions,MOSCOW Russia and Ukraine began a long-anticipated swap of dozens of prisoners on Saturday  with government planes taking off from both countries capitals around the same time  as the two nations moved to defuse tensions.  A plane carrying 24 Ukrainian sailor… [+622 chars],2019-09-07T10:28:31Z
2774,the-irish-times,The Irish Times,Man in his 50s found dead in Cork city house,Gardaí in Cork are treating as suspicious the discovery of the body of a middle- aged man in a house in the city on Saturday afternoon.  Officers were called to a house on the Bandon Road on the citys southside around noon where they discovered the body of a … [+627 chars],2019-09-07T13:26:52Z
2778,cnn,CNN,Pizza Hut is making a comeback. Its NFL deal is one reason why,,2019-09-07T13:24:40Z
2782,the-new-york-times,The New York Times,When Climate Change Is Stranger Than Fiction,Ghosh came up with the idea for Gun Island in the early 2000s when he was researching another novel  The Hungry Tide  that explores the rivers of the Sundarbans  whose ecosystem supports the endangered Bengal tiger and thousands of other species. But Ghosh co… [+2009 chars],2019-09-07T09:00:11Z
2786,abc-news,ABC News,The Latest: US warns of maritime threat in Red Sea off Yemen,The Latest on tensions in the Persian Gulf region (all times local):  8:10 a.m.  U.S. officials are warning that a  maritime threat  has been reported in the Red Sea off of Yemen.  The alert that went out early Saturday did not specify what the threat was. Ho… [+1490 chars],2019-09-07T04:14:26Z
2790,bbc-news,BBC News,2019/09/07 09:00 GMT,The latest five minute news bulletin from BBC World Service.,2019-09-07T09:06:00Z
2794,reuters,Reuters,Banco do Brasil confirms talks for investment banking JV- filing,SAO PAULO  Sept 7 (Reuters) - State-controlled lender Banco do Brasil SA confirmed in a securities filing late on Friday the bank is in talks with potential partners for its investment banking unit.   Reuters reported earlier on Friday Banco do Brasil and Swi… [+431 chars],2019-09-07T14:37:37Z
2798,cnn,CNN,Hurricane Dorian makes one final stop in the US before racing to Canada,,2019-09-07T06:31:56Z
2802,business-insider,Business Insider,FREE SLIDE DECK: The Future of Fintech,Digital disruption is affecting every aspect of the fintech industry. Over the past five years  fintech has established itself as a fundamental part of the global financial services ecosystem.  Fintech startups have raised  and continue to raise  billions of … [+486 chars],2019-09-07T14:02:00Z
2806,the-irish-times,The Irish Times,All-Ireland final replay a whole new ball game,It was shortly before 4pm on the first Saturday of October in 2016. The Mayo team were out on the grass in Croke Park  sauntering around like teams saunter around  looking up into the stands and seeing very little only the stands looking back. The biggest gam… [+13001 chars],2019-09-07T05:00:52Z
2810,reuters,Reuters,In Mugabe's village  relatives say he was very bitter before death,KUTAMA  Zimbabwe (Reuters) - In the dusty village where Zimbabwe’s founding father Robert Mugabe grew up  family members speak of the deep bitterness Mugabe felt from his ousting as head of state two years ago until his death in Singapore on Friday.   Mugabe … [+3495 chars],2019-09-07T16:41:01Z
2814,the-new-york-times,The New York Times,Presidential Candidates Flock to New Hampshire Democratic Party Convention,That same indecision was on display outside the arena on Saturday morning  as activists and other voters rattled off lists of top three choices  but repeatedly stressed that their rankings could change. For at least one voter  they changed in a matter of mome… [+863 chars],2019-09-07T16:08:45Z
2818,the-irish-times,The Irish Times,Jim Savage obituary: A generous and passionate artist and educator,Jim SavageBorn: October 29th  1950Died: August 14th  2019  The artist and publisher Jim (James) Savage  who died suddenly on August 14th  was born in Manchester to an English mother (Hilda née Wright) and an Irish father (Frank Savage  from Dún Laoghaire). He… [+4202 chars],2019-09-07T05:00:52Z
2822,abc-news,ABC News,PHOTO GALLERY: A selection of pictures from the past week,Here's your look at highlights from the weekly AP photo report  a gallery featuring a mix of front-page photography  the odd image you might have missed and lasting moments our editors think you should see.  This week's gallery includes Hurricane Dorian slams… [+692 chars],2019-09-07T08:07:22Z
2826,newsweek,Newsweek,'NBA 2K20' Badge Glitch - How to Get Hall of Fame Upgrades Fast on PS4 & Xbox,NBA 2K20 is finally here  and that means the Badge grind has begun. Thankfully  the community has already found a working Badge glitch that still functions in the 1.01 version of the game. For those who've used Badge glitches in NBA 2K19 before  this process … [+3395 chars],2019-09-07T12:33:30Z
2830,the-new-york-times,The New York Times,Raiders Release Antonio Brown  Ending Weeks of Conflict,Antonio Browns long strange trip in Oakland is now over.  The Raiders released Brown on Saturday  ending the latest chapter in a truly bizarre tenure with the team that signed him to a $64 million contract in the off-season.  Brown was released just two days … [+902 chars],2019-09-07T17:32:04Z
2834,reuters,Reuters,Greek PM set to outline tax cuts  structural reforms,ATHENS (Reuters) - Greece’s prime minister is expected on Saturday to detail tax cuts for companies strained by years of austerity  while also promising pro-business reforms aimed at convincing lenders to ease the nation’s fiscal target from 2021.   Conservat… [+2356 chars],2019-09-07T10:53:29Z
2838,abc-news,ABC News,Poland's ruling party opens campaign pledging new benefits,The leader of Poland's nationalist ruling party has promised higher earnings  adherence to Catholic values and more judicial system changes as he started campaigning for next month's parliamentary election.  Jaroslaw Kaczynski went to the city of Lublin in on… [+555 chars],2019-09-07T14:17:24Z
2842,bbc-news,BBC News,Oxfam opens 'superstore' charity shop in Oxford,Image caption   The superstore is 12 times the size of an average Oxfam shop  An Oxfam  superstore  has opened it doors in Oxford - the city where the charity opened its first shop.  Oxfam said it worked with a Swedish charity ahead of the launch of store  wh… [+1242 chars],2019-09-07T10:20:05Z
2846,the-irish-times,The Irish Times,Late Late Show: Ryan Tubridy returns with another dose of national panic,To initiate its 57th series  the Late Late Show began not with that familiar drum roll but a wailing siren.  When it did strike up  the theme tune had a new sense of urgency as we watched countless emergency teams spring into action and sweep en masse through… [+4359 chars],2019-09-07T10:45:00Z
2850,reuters,Reuters,Greek PM set to outline tax cuts  structural reforms,ATHENS (Reuters) - Greece’s prime minister is expected on Saturday to detail tax cuts for companies strained by years of austerity  while also promising pro-business reforms aimed at convincing lenders to ease the nation’s fiscal target from 2021.   Conservat… [+2356 chars],2019-09-07T10:53:29Z
2854,the-irish-times,The Irish Times,Why is Greta Thunberg so triggering for certain men?,Why is Greta Thunberg so triggering? How can a 16-year-old girl in plaits  who has dedicated herself to the not-exactly sinister  authoritarian plot of trying to save the planet from extinction  inspire such incandescent rage?  Last week  she tweeted that she… [+5279 chars],2019-09-07T05:02:00Z
2858,the-new-york-times,The New York Times,Brittany Howard Cuts Loose From Alabama Shakes,The situation is a bittersweet thing  said Zac Cockrell  Alabama Shakess bassist. But there are no hard feelings anywhere. Shes always done her thing. I feel like with this  she just took it one step further.  Howard had already started making music outside A… [+2139 chars],2019-09-07T09:57:35Z
2862,the-irish-times,The Irish Times,Ireland go to number one with win over Wales,Ireland 19 Wales 10  Ireland will depart for the World Cup in Japan with the wind in their sails and ranked as the number one team in world rugby following todays win over Wales at the Aviva Stadium. Tries from Rob Kearney  Tadhg Furlong  James Ryan secured t… [+2724 chars],2019-09-07T14:52:18Z
2866,the-new-york-times,The New York Times,Fall River Mayor  No Stranger to Scandal  Is Charged With Taking Bribes From Marijuana Vendors,As a result of one of the deals  the mayor  in his official city vehicle  drove to the middlemans home four or five times and collected $10 000 to $20 000 in cash each time  the indictment said.   The indictment also charged the mayors former chief of staff  … [+1463 chars],2019-09-07T09:57:26Z
2870,al-jazeera-english,Al Jazeera English,Russia-Ukraine prisoner exchange under way,A widely anticipated exchange of prisoners between Russia and Ukraine is under way  according to several sources.  Planes arrived at the Russian and Ukrainian capitals to collect inmates on Saturday  according to Russian Interfax news agency and flightradar d… [+1573 chars],2019-09-07T09:55:23Z
2874,bbc-news,BBC News,Ashes: Australia's Mitchell Starc bowls England's Jonny Bairstow at Old Trafford,,2019-09-07T11:00:17Z
2878,the-new-york-times,The New York Times,Checking In at Trump Hotels  for Kinship (and Maybe Some Sway),We have the best property in Washington D.C.  he said on Saturday. People like the brand.  Ethics lawyers said that even if the White House and the president were not overtly pressuring individuals seeking help from the federal government to visit a Trump bra… [+1734 chars],2019-09-07T16:12:39Z
2882,reuters,Reuters,'Staggering' death toll feared in Bahamas after Dorian's destruction,NASSAU  Bahamas (Reuters) - Charities  government agencies and even cruise ships loaded with supplies and volunteers rushed emergency aid to the storm-ravaged Bahamas on Saturday amid fears of a “staggering” death toll left in the wake of Hurricane Dorian.   … [+4676 chars],2019-09-07T15:57:04Z
2886,the-irish-times,The Irish Times,Crime fiction round-up: A rape allegation blows apart a college reunion,Claire McGowan established a very strong reputation with her Northern Ireland-set series featuring the forensic psychologist Paula Maguire  but What You Did (Thomas &amp; Mercer  12.99) is a standalone domestic noir which opens with six friends convening for … [+5545 chars],2019-09-07T05:00:00Z
2890,cnn,CNN,Impeachment fight looms over freshmen Democrats at home in California,Irvine  California (CNN)It didn't take long for freshman Rep. Katie Porter to get the question that's been roiling House Democrats this summer: Should Congress impeach President Donald Trump?  When a constituent told her that  impeachment was a mistake  -- be… [+10524 chars],2019-09-07T12:14:30Z
2894,abc-news,ABC News,Trump challenges California power to control auto pollution,The Trump administration on Friday launched an all-out assault on California over automotive mileage rules  telling state officials that only the federal government has the power to regulate greenhouse gas emissions and fuel economy.  The assault began with t… [+6318 chars],2019-09-07T01:10:59Z
2898,business-insider,Business Insider,WeWork reportedly hired the parents of a high-ranking exec as real estate brokers  among other potential conflicts of interest,WeWork's recently filed public offering paperwork raised eyebrows with its list of numerous deals the company has been a party to that involve the family members of CEO Adam Neumann and his wife  Rebekah.    As bad as those related-party transactions looked t… [+3602 chars],2019-09-07T00:21:01Z
