id,source_id,source_name,title,content,published_at
5209,business-insider,Business Insider,'How much is the iPhone 11?': Everything you need to know about Apple's latest phone  including its standard price  trade-in prices  and new features,The iPhone 11 will retail for $699 (about $29 per month using Apple's financing plan). Compared to the iPhone XR  which debuted last year for $749  and the iPhone XS  which cost $999  this is surprising — but welcome — news.    The price is even lower if you … [+2124 chars],2019-09-12T16:26:00Z
5213,newsweek,Newsweek,Alexandria Ocasio-Cortez Apologizes to Migrants Suffering From Medical Conditions Facing 'Dehumanizing' Deportation Policies 'On Behalf Of The United States Of America',New York Rep. Alexandria Ocasio-Cortez offered an apology  on behalf of the United States of America  to immigrants affected by the Trump administration's decision to revoke  medical deferred action  for seriously ill patients.  On Wednesday  members of the H… [+2873 chars],2019-09-12T09:26:04Z
5217,the-new-york-times,The New York Times,‘S.N.L.’ Has Long Lacked Asian Players. One Just Joined the Cast.,For all the comedians and actors who have come and gone from Saturday Night Live in its four decades  there has been a near-complete absence of Asian performers onscreen.  The NBC show is taking a step toward rectifying that. Bowen Yang the son of Chinese imm… [+733 chars],2019-09-12T19:03:20Z
5221,newsweek,Newsweek,'The Office' Stars Jenna Fischer and Angela Kinsey Announce 'Office Ladies' Podcast,If endlessly binge-watching old episodes of The Office isn't enough for you  you're about to be in luck. Jenna Fischer and Angela Kinsey (or  better put  Pam Beesly and Angela Martin) announced Wednesday they're launching the Office Ladies podcast  a behind-t… [+2603 chars],2019-09-12T18:29:32Z
5225,the-new-york-times,The New York Times,The Rebirth of New York Fashion,And it also reflects an awareness that things are different now. Not just because the path of the city and the country was altered in 2001 and the world order shifted  but because suddenly the fashion order is shifting  too.  Once upon a time once upon that n… [+861 chars],2019-09-12T16:58:40Z
5229,the-irish-times,The Irish Times,Vulture fund will repossess most of PTSB loan portfolio – activist,A vulture fund that is buying almost 2 000 mortgages from Permanent TSB will repossess most of the homes involved  one activist warns.  Majority State-owned Permanent TSB is selling 1 932 home loans that have fallen into arrears to Start Mortgages  part of US… [+1883 chars],2019-09-12T19:14:00Z
5233,bbc-news,BBC News,Idlib's hidden hospitals,,2019-09-12T05:01:38Z
5237,business-insider,Business Insider,Obama administration officials called Elizabeth Warren ‘sanctimonious’ and a ‘condescending narcissist’,While she speaks positively of him on the campaign trail now  Sen. Elizabeth Warren and former President Barack Obama maintained a tumultuous and often testy relationship over the administration's handling of the last financial crisis  according to a lengthy … [+3536 chars],2019-09-12T18:01:33Z
5241,cbs-news,CBS News,Eye Opener at 8: Biden and Warren face off in third debate,,2019-09-12T12:23:38Z
5245,newsweek,Newsweek,More Kids Died in ICE Custody Than From Vaping  Ex-GOP Chairman Says As Trump Plans E-Cigarettes Ban,As the Trump administration prepares a ban on flavored e-cigarettes following at least six deaths from lung diseases linked to vaping  critics are hitting back by pointing out that more people have died in the custody of U.S. Immigration and Customs Enforceme… [+3798 chars],2019-09-12T19:15:39Z
5249,cnn,CNN,Old Navy plans to open 800 new stores,New York (CNN Business)Old Navy outlined plans Thursday to open 800 new stores  its first major announcement since the Gap  its parent company  announced it would spin off the lower-priced brand.   We'll almost double our fleet to 2 000 stores in North Americ… [+1432 chars],2019-09-12T18:30:24Z
5253,bbc-news,BBC News,Hinkley Point: World's largest crane begins work in Somerset,,2019-09-12T14:59:15Z
5257,cbs-news,CBS News,House approves bill to bar oil drilling off U.S. coasts,The House approved legislation Wednesday that would permanently bar drilling off the Atlantic and Pacific coasts and extend a moratorium on drilling off Florida's west coast.  Coastal lawmakers from both parties said the bills would protect U.S. coasts from d… [+4214 chars],2019-09-12T11:12:14Z
5261,abc-news,ABC News,Get in the Holiday Spirit With This Super Cute Digital Wallpaper from Disney Cruise Line,Its never too early to get into the holiday spirit! Disney Cruise Line just released a super cute digital wallpaper that depicts the tropical celebration you can have when you set sail on one of our Very Merrytime Cruises this winter.  Not only do these cruis… [+845 chars],2019-09-12T18:00:59Z
5265,the-new-york-times,The New York Times,Big Fashion Books of Fall,Every September  the glitterati descend upon New York  London  Milan and Paris for fashion month in a swarm of stilettos. Like death and taxes  the circus of Fashion Week is inevitable  and often inaccessible unless youre watching Instagram.   Luckily  so is … [+738 chars],2019-09-12T17:15:30Z
5269,abc-news,ABC News,'Let Me Die' to premiere at Opera Philadelphia's annual fest,There's a lot of dying in Joseph Keckler's performance piece premiering at Opera Philadelphia's third annual festival. In fact there's little else.  Keckler has put together a compilation of his favorite operatic death scenes from  Aida  to  Madame Butterfly … [+453 chars],2019-09-12T16:33:16Z
5273,reuters,Reuters,Texas grand jury indicts man accused of killing 22 people at Texas Walmart: local media,(Reuters) - A Texas grand jury on Thursday indicted a man accused of killing 22 people in an August shooting at Walmart in El Paso  Texas  who had told authorities he was targeting Mexicans  local media reported.   Patrick Crusius  21  was indicted on capital… [+1071 chars],2019-09-12T17:34:26Z
5277,newsweek,Newsweek,Police Officers in California Want Advance Notice When Their Conduct Records Are Requested by Public,Police in Long Beach  California are in the midst of contract negotiations with the city. The latest version of the contract includes a provision that would require officers to be notified when a member of the public requests their conduct record.  The new co… [+2676 chars],2019-09-12T02:45:33Z
5281,cnn,CNN,Omarosa Manigault Newman files motion to dismiss lawsuit over financial disclosure report,,2019-09-12T18:06:11Z
5285,cbs-news,CBS News,The legacy of the 9/11 terror attacks,,2019-09-12T03:17:36Z
5289,abc-news,ABC News,Banderas drew on his heart attack for emotions in new film,Antonio Banderas says his emotional state from having a heart attack a few years ago influenced his award-winning performance in the Pedro Almodóvar film   Pain and Glory.   Banderas won the best actor trophy earlier this year at the Cannes Film Festival.  In… [+2257 chars],2019-09-12T15:59:47Z
5293,cbs-news,CBS News,Why  Bob ♥ Abishola  star goes home  very proud every day ,CBS' newest sitcom  Bob ♥ Abishola  explores immigrant life in America through a unique lens:  the relationship between Bob  a Detroit compression sock salesman  and Abishola  his Nigerian nurse. The pair first meet in the hospital  after Bob suffers a heart … [+2094 chars],2019-09-12T15:43:17Z
5297,bbc-news,BBC News,Ryan Jack: Scotland 'careless' with midfielder's knee problem  says Steven Gerrard,Jack departed for Scotland duty after playing in Rangers' 2-0 loss to Celtic  Rangers manager Steven Gerrard says Scotland have been  careless  with Ryan Jack after the midfielder aggravated a knee problem on international duty.  Jack missed Friday's 2-1 loss… [+1932 chars],2019-09-12T16:00:30Z
5301,cnn,CNN,Dorm mattresses are notoriously uncomfortable. His startup aims to change that,,2019-09-12T15:56:33Z
5305,newsweek,Newsweek,Florida Man With 'Death' Tattooed on His Face Breaks Out of Psychiatric Hospital,Police in Florida have apprehended a mentally-ill prisoner with  death  tattooed on his face and a history of violence who had escaped from a psychiatric hospital.  Pembroke Pines Police Department said its officers detained 33-year-old John Ireland in Oaklan… [+2266 chars],2019-09-12T12:55:28Z
5309,abc-news,ABC News,Supreme Court action on asylum rule denounced as inhumane,The U.S. Supreme Court's clearing of the way for the Trump administration to deny nearly all asylum claims from Central Americans was denounced by immigration advocates as a  death sentence  for the many migrants trying to escape poverty and violence in their… [+4127 chars],2019-09-12T16:25:12Z
5313,cbs-news,CBS News,Biden and Warren to take center stage at third debate,Houston — Former Vice President Joe Biden and Senator Elizabeth Warren will go head-to-head Thursday for the first time on the debate stage in this presidential primary. The match-up will provide the clearest example yet of competing directions for the party.… [+5925 chars],2019-09-12T02:44:29Z
5317,the-new-york-times,The New York Times,‘Freaks’ Review: An Indie Take on a Superhero Setup,Bringing a small budget and a big heart to a dystopian story so familiar it could nestle comfortably inside the X-Men franchise  Adam Stein and Zach Lipovskys Freaks wears its derivativeness with pride. Appealing  partly because its so unembarrassed by its ge… [+1113 chars],2019-09-12T15:53:57Z
5321,the-irish-times,The Irish Times,Laura Brennan’s story is ‘secret ingredient’ in HPV campaign,HPV-related cancers can be eliminated within a generation if we all work together to reduce misinformation around the vaccine  the brother of a patient advocate has said.  Fergal Brennan  the brother of the late Laura Brennan  the 26-year-old campaigner who d… [+2344 chars],2019-09-12T19:33:25Z
5325,the-new-york-times,The New York Times,‘Monos’ Review: Teenage Fighters Tussle Over Discipline and a Cow,High on a mountaintop in Colombia  a raggedy pack of teenagers who answer to names including Rambo  Smurf  Wolf  Dog and Bigfoot receive supervision  intermittently  from a little person on horseback. These boys and girls have guns  an adult hostage from the … [+815 chars],2019-09-12T11:00:07Z
5329,the-new-york-times,The New York Times,El Paso Shooting Suspect Indicted on Capital Murder Charge,The suspect in the mass shooting at an El Paso Walmart that left 22 dead was indicted by a grand jury on Thursday on a charge of capital murder  according to the district attorneys office. Prosecutors said they would be seeking the death penalty.  When he was… [+490 chars],2019-09-12T19:18:06Z
5333,bbc-news,BBC News,Huawei chief offers to share 5G know-how for a fee,Image copyrightGetty ImagesImage caption   Ren Zhengfei says a Western buyer could modify his firm's products to meet the US's security concerns  Huawei's chief executive has proposed selling its current 5G know-how to a Western firm as a way to address secur… [+4697 chars],2019-09-12T13:38:31Z
5337,espn,ESPN,Source: Pistons agree to deal with Joe Johnson,The Detroit Pistons and veteran swingman Joe Johnson have agreed to terms on a deal  according to ESPN and multiple reports.  The deal is worth $2.6 million and has $220K in guaranteed money  a source told ESPN's Bobby Marks. The balance of the contract will … [+843 chars],2019-09-12T17:38:00Z
5341,reuters,Reuters,Leader of Canada's opposition party distances self from anti-abortion comment,OTTAWA (Reuters) - The leader of Canada’s main opposition Conservative Party on Thursday distanced himself from comments by a candidate opposing abortion  remarks that could hurt his chances with women voters in an Oct. 21 election.   Andrew Scheer  trying to… [+2634 chars],2019-09-12T17:52:12Z
5345,newsweek,Newsweek,Facebook's Libra Cryptocurrency Could Be Blocked in Europe  Politician Says,Facebook's plan to roll out a new global currency hit a fresh hurdle today after it was criticized as a potential risk to  monetary sovereignty.   French Finance Minister Bruno Le Maire spoke out against the digital money  known as Libra  in a keynote address… [+4171 chars],2019-09-12T14:07:00Z
5349,the-wall-street-journal,The Wall Street Journal,Need Cash? Companies Are Considering Magazine Subscriptions and Phone Bills When Making Loans,The way lenders decide who can borrow money is undergoing its biggest shift in a generation.For decades  banks and other financiers have relied primarily on consumers borrowing history to make lending decisions. Now revenue-hungry companies are considering me… [+6706 chars],2019-09-12T09:30:00Z
5353,reuters,Reuters,Redmond still out for Saints but making progress,(Reuters) - Southampton are still counting the cost of last month’s League Cup win over Fulham  with manager Ralph Hasenhuettl confirming that influential midfielder Nathan Redmond would miss Saturday’s Premier League trip to promoted Sheffield United.   Redm… [+1262 chars],2019-09-12T18:57:53Z
5357,the-wall-street-journal,The Wall Street Journal,Five Cities: Living on $50K a Year...,How far does a $50K salary go when youre starting out? It depends a lot on where you live.Recent graduates in entry-level jobs will make an average of $51 347 annually in 2019  according to recruiting firm   Korn Ferry.  The Wall Street Journal interviewed fi… [+8562 chars],2019-09-12T14:34:38Z
5361,cnn,CNN,FDA takes major step toward approving first peanut allergy treatment,,2019-09-14T01:55:43Z
5365,abc-news,ABC News,'Ghostbuster' sequel to focus on a family of original film,The upcoming  Ghostbuster  sequel will focus on the descendants of the original ghost-catchers who rushed around New York City in proton packs and jumpsuits.  Ivan Reitman and Dan Aykroyd revealed details of the new film  saying it is expected out next year a… [+1271 chars],2019-09-14T16:48:49Z
5369,the-irish-times,The Irish Times,Steve Hansen: “I can’t be telling you Irish too much”,The long and winding Steve Hansen media tour is scheduled to end November 2nd. That last gig in Yokohama is sold out but may yet be cancelled.  All Blacks loom over every World Cup but this crop pale in comparison to what has come before. The Light Blacks per… [+67 chars],2019-09-14T11:23:42Z
5373,cbs-news,CBS News, Grotesue disregard for life : Former high school cheerleader sentenced to probation after burying newborn,,2019-09-14T13:30:58Z
5377,reuters,Reuters,Police face protesters in Nantes as 'yellow vest' marches resume,NANTES  France (Reuters) - Hundreds of demonstrators faced police in a tense stand-off in the French city of Nantes on Saturday as revived “yellow vest” protests against the government of President Emmanuel Macron took place across the country.   Police respo… [+1083 chars],2019-09-14T14:36:10Z
5381,espn,ESPN,Terry Bradshaw says he 'can't stand' guys like AB,Pittsburgh Steelers great Terry Bradshaw said he's happy Antonio Brown is no longer with the Steelers and that he'd have never thrown to the wide receiver had they been teammates.   I'm glad they got rid of him and I'm upset now that I know how he got away ..… [+2549 chars],2019-09-14T13:20:21Z
5385,newsweek,Newsweek,College Football 2019: Where to Watch Ohio State vs Indiana  TV Channel  Live Stream and Odds,From Clemson to Alabama and Georgia  college football heavyweights have started the season on the front foot courtesy of free-scoring offenses.  Not to be outdone by its rivals  Ohio State has followed the trend so far  putting up a combined 87 points in the … [+2879 chars],2019-09-14T04:01:01Z
5389,the-wall-street-journal,The Wall Street Journal,The Startup That Manipulated Data to Get a Miracle Drug to Market,The startup had something incredible: a cure for babies with a deadly neurological disease. Last year  the company was snapped up by pharmaceutical giant   Novartis AG   NVS -2.79%    and by this past May  its drug was the most expensive on the market. In jus… [+10426 chars],2019-09-14T04:00:00Z
5393,reuters,Reuters,Hong Kong police move in to break up shopping mall protest clashes,HONG KONG (Reuters) - Baton-wielding Hong Kong police moved in to break up scuffles on Saturday between pro-China protesters and those denouncing perceived Chinese meddling at the start of rallies planned for across the city after months of often violent unre… [+2915 chars],2019-09-14T07:52:13Z
5397,abc-news,ABC News,Teen Egyptian girl's case puts legal system under spotlight,The prosecution of a 15-year-old girl who killed a bus driver after he allegedly tried to rape her has reignited debate over the treatment of women in Egypt's legal system  including the practice of virginity tests and blaming victims of sexual violence.  In … [+5544 chars],2019-09-14T06:57:25Z
5401,reuters,Reuters,Yemen's Houthis claim drone attacks on Saudi Aramco plants - Masirah TV,DUBAI (Reuters) - Yemen’s Houthi group claimed responsibility for drone attacks on two Saudi Aramco plants in the kingdom’s Eastern Province on Saturday  the group’s military spokesman said on Al Masirah TV.   The broadcaster said the Houthis had deployed 10 … [+218 chars],2019-09-14T08:46:07Z
5405,bbc-news,BBC News,2019/09/14 15:01 GMT,The latest five minute news bulletin from BBC World Service.,2019-09-14T15:04:00Z
5409,the-new-york-times,The New York Times,In First  California Would Require Public Universities to Provide Abortion Pills,Most campus health centers now provide gynecological exams and contraception  but refer students seeking abortions to outside clinics. Advocates for the bill argued that sending students off-campus for a process that typically involves medical visits before a… [+1174 chars],2019-09-14T12:46:13Z
5413,reuters,Reuters,Spanish floods claim sixth victim,ORIHUELA  Spain (Reuters) - A 41-year-old man was found dead in southeastern Spain on Saturday  the local government said  bringing to at least six the death toll inflicted over the past two days by record-breaking rain.   More than 1 100 military personnel h… [+924 chars],2019-09-14T12:32:43Z
5417,bbc-news,BBC News,Drone strikes hit Saudi oil production,Media playback is unsupported on your device  Media captionAbqaiq is the site of Aramco's largest oil processing plant  Saudi Arabia's oil production has been severely disrupted by drone attacks on two major oil facilities run by state-owned company Aramco  r… [+5398 chars],2019-09-14T16:06:20Z
5421,cnn,CNN,How a Hong Kong protest song became an unofficial 'anthem',designPublished 14th September 2019  In glitzy malls across Hong Kong  people are spontaneously breaking into a song. It's not just any tune -- it's a rousing ballad that some are calling the city's new  if unofficial  national anthem.   For over three months… [+6073 chars],2019-09-14T00:16:17Z
5425,the-irish-times,The Irish Times,All-Ireland women’s final preview: Dublin hold all the cards in three-in-a-row bid,When Mick Bohan and Tim Rabbitt named their panels for Sundays TG4 All Ireland final  the contrast in the experience and senior success enjoyed by the respective line-ups couldnt have been more striking. Between them  the Dublin panel has 42 winners medals  G… [+4273 chars],2019-09-14T09:00:00Z
5429,bbc-news,BBC News,Hamilton v Celtic: Try the Scottish Premiership player rater,,2019-09-14T11:08:05Z
5433,cnn,CNN,Alyssa Milano: I met with Ted Cruz. This is why,Alyssa Milano is an actor  activist  producer and host of the podcast   Alyssa Milano: Sorry Not Sorry.  She is also a co-chair of Health Care Voter  the founder of #NoRA and Patriot NOT Partisan  and a board member of the ERA Coalition. The views expressed i… [+6067 chars],2019-09-14T00:32:06Z
5437,the-irish-times,The Irish Times,Europe maintain one-point lead at Solheim Cup after share of Saturday foursomes,Europe maintained their one-point lead over the United States on a windswept second day of the Solheim Cup despite an extraordinary collapse from Anna Nordqvist and Anne Van Dam at Gleneagles.  Nordqvist and Van Dam  the only new foursomes pairing selected by… [+1642 chars],2019-09-14T12:59:54Z
5441,bbc-news,BBC News,Liverpool 3-1 Newcastle: Dubravka will be disappointed with Liverpool's second goal - Bruce,Newcastle head coach Steve Bruce says goalkeeper Martin Dubravka will be disappointed in his part in Liverpool's second goal  but believes his side  acquitted themselves well  in their 3-1 defeat to Liverpool.  MATCH REPORT: Liverpool 3-1 Newcastle  Watch hig… [+112 chars],2019-09-14T14:16:59Z
5445,the-irish-times,The Irish Times,Silent protest held in Oughterard amid direct provision centre concerns,A silent protest has been held in Oughterard  Co Galway in response to the potential development of a direct provision centre for asylum seekers at a disused hotel in the town.  Around 1 500 people attended the protest with a number holding placards stating N… [+3289 chars],2019-09-14T15:38:12Z
5449,cnn,CNN,How NFL developed policy to judge cases like that of Antonio Brown,Joe Lockhart was White House press secretary from 1998-2000 in President Bill Clinton's administration  and the NFL's executive vice president for communications from 2016-2018. He co-hosts the podcast  Words Matter.  The opinions expressed in this commentary… [+4506 chars],2019-09-14T15:27:33Z
5453,newsweek,Newsweek,World's Largest Oil Facility Set Ablaze in Drone Attacks Claimed by Tehran-Backed Rebels,Yemen's Tehran-backed Houthi rebels claimed responsibility for drone attacks and reports of gunfire at the world's largest oil processing facility in Saudi Arabia  military and government spokespersons said Saturday.  Videos emerged online Saturday morning sh… [+2376 chars],2019-09-14T13:53:21Z
5457,bbc-news,BBC News,Kilmarnock 2-0 Hibernian: Hibs without a win since opening day,Mohamed El Makrini's goal added some gloss to the scoreline for Angelo Alessio's side  Pressure continues to mount on Hibernian head coach Paul Heckingbottom as his side slipped to a 2-0 Scottish Premiership defeat at Kilmarnock.  Hibs had by far the better o… [+564 chars],2019-09-14T15:59:40Z
5461,the-irish-times,The Irish Times,Cameron ‘truly sorry’ for division that followed Brexit,Former UK prime minister David Cameron has admitted that he failed in his bid to keep Britain in a reformed European Union and is truly sorry for the uncertainty and division that followed the Brexit referendum.  The Conservative (52) said he thinks about the… [+4338 chars],2019-09-14T06:23:55Z
5465,reuters,Reuters,MLB roundup: Goldschmidt's slam powers Cards past Brewers,Paul Goldschmidt hit two homers  including a grand slam  and drove in a career-high seven runs as the St. Louis Cardinals rolled past the visiting Milwaukee Brewers 10-0 Friday night.   The victory kept the National League Central-leading Cardinals four games… [+7633 chars],2019-09-14T09:41:28Z
5469,reuters,Reuters,Five confirmed cholera deaths in Sudan since August 28,KHARTOUM (Reuters) - There have been five confirmed deaths from cholera in Sudan’s Blue Nile state since Aug. 28  the health ministry said in a statement.   The ministry reported 67 cases of cholera since that date  with 18 of them still receiving treatment i… [+612 chars],2019-09-14T07:44:22Z
5473,business-insider,Business Insider,McDonald's disappointing new menu item proves how badly the chain needs to invest in a new chicken sandwich after Popeyes' runaway success (MCD),This week  McDonald's entered the chicken sandwich battle arena. But  its fighter was unfortunately a flop.    On Wednesday  the fast-food giant introduced a new spicy BBQ chicken sandwich and tenders. The sandwich takes the buttermilk chicken — which is alre… [+2152 chars],2019-09-14T13:38:00Z
5477,bbc-news,BBC News,Premier League results: Liverpool  Spurs  Chelsea  Man Utd & Southampton win,Son Heung-min scored for the first time in the Premier League since 3 April  Tottenham and Chelsea both secured big wins while Liverpool maintained their 100% start as the Premier League returned after the international break.  Spurs scored all their goals in… [+2029 chars],2019-09-14T16:46:49Z
5481,the-new-york-times,The New York Times,Justice Dept. to Honor Team That Worked on Kavanaugh Confirmation Process,Lawyers in the departments office of legal policy in Washington had helped with previous Supreme Court nominations.  Justice Kavanaughs nomination was imperiled after a California university professor  Christine Blasey Ford  testified before Congress that he … [+1117 chars],2019-09-14T00:48:57Z
5485,the-new-york-times,The New York Times,Restoring Black Cowboys to the Range,They were cowboys.   And yet  the archetypal cowboy imprinted in the American psyche is a white Marlboro man. It is John Wayne  swaggering through Hollywoods vision of a frontier town  a fictional place where no black cowboys ever rode the range  where no bla… [+1267 chars],2019-09-14T09:06:41Z
5489,reuters,Reuters,A nun's brutal death shows lawlessness in Amazon,Reuters  the news and media division of Thomson Reuters  is the worlds largest international multimedia news provider reaching more than one billion people every day. Reuters provides trusted business  financial  national  and international news to profession… [+169 chars],2019-09-14T15:56:55Z
5493,business-insider,Business Insider,The world's largest oil plant in Saudi Arabia was attacked by 10 explosive drones ahead Aramco's plans for the biggest IPO ever,Yemen's Houthi rebel group claimed responsibility for two major Saudi oil refineries that were set ablaze after an apparent drone strike.    Interior ministry spokesman Mansour al-Turki reportedly confirmed that there were no casualties  but the extent of the… [+1991 chars],2019-09-14T15:05:40Z
