id,source_id,source_name,title,content,published_at
5148,abc-news,ABC News,Lawyers: Hastert trying to take back sexual-abuse admissions,Former U.S. House Speaker Dennis Hastert has sought to retract key admissions he made during his federal criminal case years ago that he sexually abused a then-high school student  a filing in an ongoing civil case alleges.  The document filed by lawyers for … [+2913 chars],2019-09-12T19:26:13Z
5152,the-new-york-times,The New York Times,For Poison-Dart Frogs  Markings Matter When It Comes to Survival,Hoping to get more insight into the results  the researchers trained chicks in the lab to associate images of either white-striped or yellow-striped frogs with bitter  unpalatable mealworms. They found that the chicks came to dislike yellow-striped frogs much… [+1249 chars],2019-09-12T13:53:21Z
5156,business-insider,Business Insider,A pair US F-15 fighter jets came close to taking out a couple of free-falling skydivers at nearly 350 mph,A pair of skydivers nearly had an unfortunate run-in with two US Air Force F-15 fighter jets in the skies above southern England earlier this year  a British air safety board reports.    The US fighters out of RAF Lakenheath  home to the US 48th Fighter Wing … [+2303 chars],2019-09-12T19:38:10Z
5160,the-irish-times,The Irish Times,Fine Gael takes aim at rivals after Taoiseach suggests election date,Taoiseach Leo Varadkar said that next May is the right time for a general election as he and his ministers readied the ground for election attacks on Fianna Fáil and other rivals.   The first day of the Fine Gael parliamentary party think-in in Garryvoe  Co C… [+3147 chars],2019-09-12T12:42:47Z
5164,cnn,CNN,Meet Victoria  one of the most complete T. rex fossils in the world,(CNN)After she hatched 66 million years ago  Victoria was the queen predator of her time during the Cretaceous period. But the Tyrannosaurus rex was struck down in her prime  before reaching her 30s  by an unlikely culprit.   Now  the second most complete T. … [+4192 chars],2019-09-12T13:53:41Z
5168,abc-news,ABC News,The Latest: NTSB says crew asleep during fatal boat fire,The Latest on a fatal boat fire that killed 34 people off the coast of Southern California (all times local):  11:20 a.m.  The National Transportation Safety Board says all six crewmembers were asleep when a fire broke out in a scuba diving boat off the coast… [+1460 chars],2019-09-12T18:22:15Z
5172,the-wall-street-journal,The Wall Street Journal,How to Navigate Awkward Money Situations at Work,,2019-09-12T11:00:00Z
5176,the-wall-street-journal,The Wall Street Journal,StarKist Hit With $100 Million Fine in Tuna Price-Fixing Case,StarKist Co. has been ordered to pay a $100 million penalty for its role in a conspiracy that prosecutors say inflated the prices consumers paid for canned tuna.The market leader for packaged tuna in the U.S.  StarKist worked with rivals Bumble Bee Foods LLC … [+2930 chars],2019-09-12T00:15:27Z
5180,cbs-news,CBS News,145 CEOs implore Senate to  take action  on gun legislation,With Congress now back in session after an August recess  the CEOs of 145 companies sent a letter to Senate leaders urging them to take action on gun background checks and  red flag  legislation. The push for more aggressive gun reforms comes in the wake of r… [+2400 chars],2019-09-12T12:26:15Z
5184,al-jazeera-english,Al Jazeera English,Dahlan drops libel case against MEE over article on Turkey coup,Mohammed Dahlan  the 57-year-old exiled former Fatah official  has decided to withdraw a legal case filed against UK-based Middle East Eye (MEE) and its editor-in-chief  the news outlet revealed.  It said on Wednesday that Dahlan dropped a libel action agains… [+1963 chars],2019-09-12T08:04:29Z
5188,cbs-news,CBS News,Protesters dangle from Houston bridge and close part of shipping channel,Greenpeace activists were hanging by bungie cords from the Fred Hartman Bridge in Houston in an effort to bring awareness to climate change by blocking the Houston Ship Channel. The protest  which comes hours a Democratic presidential debate  led to the closu… [+1749 chars],2019-09-12T16:47:28Z
5192,the-new-york-times,The New York Times,U.S. Poised to Send 150 Troops to Patrol Northeastern Syria,Mr. Erdogan threatened last month to carry out a major cross-border operation into Syria to rout the Syrian Kurds who took control there from ISIS. Turkey conducted previous missions into Afrin and Jarabulus west of the Euphrates River.  American officials ex… [+1792 chars],2019-09-12T18:51:31Z
5196,cnn,CNN,Blink and you'll miss this 6 599 mph hypersonic sled,Chat with us in Facebook Messenger. Find out what's happening in the world as it unfolds.,2019-09-12T16:27:43Z
5200,al-jazeera-english,Al Jazeera English,Trump vows to hit Taliban 'harder' as peace talks 'dead',US President Donald Trump has pledged to hit the Taliban  harder than they have ever been hit before   as the United States marked the 18th anniversary of the September 11 attacks on Wednesday.  Trump's comments came just days after he canceled a secret Camp … [+2105 chars],2019-09-12T10:08:32Z
5204,bbc-news,BBC News,California boat fire: Crew say there were no mechanical issues,Media captionFamily and friends mourn those lost in California dive-boat fire.  The crew of the boat destroyed by a fire off California's coast were not aware of any mechanical issues with the vessel  investigators say.    Initial interviews of three crew mem… [+664 chars],2019-09-12T18:59:42Z
5208,business-insider,Business Insider,Bond king Jeff Gundlach says the odds of a US recession before the 2020 election have grown,,2019-09-12T17:58:00Z
5212,business-insider,Business Insider,How to log out of Facebook Messenger on your iPad  which you can only do through the main Facebook app,The Facebook app on your iPad gives you access to most of the features you'd enjoy when using the social media platform on a computer: viewing friends' posts and pictures  adding your own photos and videos  updating your status  and more.    However  one thin… [+1304 chars],2019-09-12T17:29:00Z
5216,the-irish-times,The Irish Times,Experts’ view: What changes will Dublin and Kerry make and who will win?,What adjustments will Dublin make?  I suppose things didnt go as well as they would have hoped for the last day. Obviously theres talk of John Small being injured so I think Eoin Murchan could come into the team. He will probably take up Smalls position and d… [+9897 chars],2019-09-12T11:01:31Z
5220,bbc-news,BBC News,Saudi princess sentenced for plumber kidnapping,Image copyrightReutersImage caption   Princess Hassa is the sister of Mohammed bin Salman  the Crown Prince  A Saudi princess has received a 10-month suspended sentence over the beating and kidnapping of a plumber in her luxury Paris apartment.  Hassa bint Sa… [+2563 chars],2019-09-12T15:28:49Z
5224,al-jazeera-english,Al Jazeera English,UK: Court dismisses Northern Irish 'no-deal' Brexit challenge,A case arguing that a British withdrawal from the European Union without an exit agreement would contravene Northern Ireland's 1998 peace accord has been dismissed on all grounds by Belfast's High Court.  Judges ruled on Thursday that the matter was essential… [+3607 chars],2019-09-12T12:46:44Z
5228,reuters,Reuters,Reuters asks judge to release secret Propecia documents,SAN FRANCISCO (Reuters) - Reuters asked a U.S. judge on Thursday to unseal documents filed in court regarding potential risks associated with Propecia  Merck &amp; Co’s (MRK.N) popular baldness drug.   The motion was filed in federal court in Brooklyn  New Yo… [+2820 chars],2019-09-12T18:48:20Z
5232,bbc-news,BBC News,Ashes: Ben Stokes out after slashing a short ball up to Nathan Lyon,,2019-09-12T14:04:10Z
5236,reuters,Reuters,Telecom Italia may discuss savings shares' conversion at Sept. 26 board meeting,MILAN  Sept 12 (Reuters) - Telecom Italia (TIM) may resume discussions on a conversion of its savings shares into ordinary stock at a board meeting on Sept. 26  a source close to the situation said on Thursday.   The conversion of non-voting savings shares is… [+807 chars],2019-09-12T17:57:09Z
5240,reuters,Reuters,Climate change pushes U.S. fund managers to bet on AC makers,NEW YORK (Reuters) - Record heatwaves in Europe and Asia this summer are leading fund managers to buy shares of air conditioning manufacturers  betting that the public health risks of rising temperatures will compel businesses and apartment building owners to… [+3633 chars],2019-09-12T17:58:12Z
5244,al-jazeera-english,Al Jazeera English,Forced Out: Measuring the scale of the conflict in South Sudan,,2019-09-12T06:29:53Z
5248,cbs-news,CBS News,Why Biden has to  right the ship  during third Democratic debate,,2019-09-12T12:44:11Z
5252,abc-news,ABC News,Suspect in Florida stabbings worried about getting fired,Authorities say a Florida man was apparently concerned about getting fired when he stabbed five people with a knife shortly after an argument with his supervisor.  An arrest affidavit released late Wednesday by the Tallahassee Police Department says 41-year-o… [+494 chars],2019-09-12T15:25:40Z
5256,cbs-news,CBS News, Free  genetic testing scam exploiting seniors' cancer fears,The trouble began for Ken and Judy Johnson – a pair of retirees from Austin  Texas – at a Fort Lauderdale arts festival.     There was a couple of people in their saying 'come get your DNA tested '  Judy recalled. The company  Genexe Health  billed itself as … [+3732 chars],2019-09-12T11:36:34Z
5260,cbs-news,CBS News,EPA to announce repeal of Obama-era clean water rule,The Environmental Protection Agency is expected to announce Thursday that it has finalized a repeal of the Obama-era clean water rule that spells out protections for large and small bodies of water  according to two congressional aides familiar with the plans… [+2904 chars],2019-09-12T13:47:53Z
5264,newsweek,Newsweek,'Ring Fit Adventure' Releases on Nintendo Switch in October  Helps Players Exercise,Remember that odd video Nintendo released showing people playing with a ring and doing all sorts of strange moves? Well  the company held true to its September 12 reveal as they announced its new Nintendo Switch experience  Ring Fit Adventures.  In Ring Fit A… [+2240 chars],2019-09-12T14:22:13Z
5268,reuters,Reuters,New sanctions could extend to allies of Hezbollah in Lebanon: U.S. envoy,BEIRUT (Reuters) - Future U.S. sanctions could target allies of Hezbollah in Lebanon  extending beyond direct affiliates of the Iran-backed Shi’ite Muslim group  a U.S. envoy said on Thursday.   “In the future we will designate  because we have to  individual… [+1338 chars],2019-09-12T17:37:18Z
5272,bbc-news,BBC News,2019/09/12 19:00 GMT,The latest five minute news bulletin from BBC World Service.,2019-09-12T19:06:00Z
5276,business-insider,Business Insider,I asked a celebrity hair stylist how to use T3's hair rollers — and they gave me perfectly bouncy waves in 10 minutes,For the last year  T3's Bodywaver Curling Iron has been my cheat code to getting a salon blowout look. That's because I can achieve it without either dropping the $50 per visit or needing the dexterity to wield a round brush and blow dryer simultaneously at h… [+5381 chars],2019-09-12T19:30:00Z
5280,bbc-news,BBC News,County Championship: Lancashire beat Derbyshire by an in innings to win promotion,Lancashire players celebrated their seventh win of the season in 12 games  <table><tr><td>Specsavers County Championship Division Two  Emirates Old Trafford (day three):</td></tr><tr><td>Derbyshire 244: Godleman 111; Gleeson 5-64  Mahmood 3-45 &amp; 129: Bail… [+925 chars],2019-09-12T17:09:24Z
5284,newsweek,Newsweek,Remembering 9/11 Service Dogs — New Hampshire Man Pays Tribute to Search and Rescue Canines in Viral Thread,As Americans across the country commemorated the 18th anniversary of the 9/11 terror attacks on Wednesday  a heartwarming Twitter thread honoring the search and rescue hero dogs at ground zero went viral.  Andrew Schatz  a hunting guide from New Hampshire  fi… [+4337 chars],2019-09-12T00:09:32Z
5288,cnn,CNN,El Paso shooting: Prosecutor plans to pursue death penalty after capital murder indictment,(CNN)The man accused of opening fire in an El Paso  Texas  Walmart  killing 22 people and wounding several others  has been indicted on a capital murder charge  the El Paso County District Attorney's Office said following the grand jury's Thursday decision.   … [+1979 chars],2019-09-12T17:17:06Z
5292,reuters,Reuters,British Airways cancels flights on Sept. 27 due to strike,Sept 12 (Reuters) - British Airways said on Thursday it is cancelling some flights scheduled for Sept. 27 when its pilots are due to hold another strike.   “We are now contacting all those affected to offer them a full refund or a rebooking on an alternative … [+977 chars],2019-09-12T19:09:01Z
5296,cnn,CNN,Andrew Yang is the hottest 2020 candidate this side of Elizabeth Warren right now,THE POINT -- NOW ON YOUTUBE!   In each episode of his weekly YouTube show  Chris Cillizza will delve a little deeper into the surreal world of politics. Click to subscribe!,2019-09-12T18:46:32Z
5300,the-new-york-times,The New York Times,In the year of the strong woman  why are the clothes so… wimpy?,Almost two years since the news broke of Harvey Weinsteins abusive and predatory behavior  starting the #MeToo movement and altering the power structure in numerous industries; just as a raft of books are published and planned on the topic; in a year in which… [+3300 chars],2019-09-12T13:00:52Z
5304,the-wall-street-journal,The Wall Street Journal,Vaping-Related Lung Ailments Puzzle Doctors,As investigators look into more than 450 cases of people who became sick after vaping  doctors are working to identify the nature of their mysterious lung ailments.We havent identified an agent or agents that cause these illnesses  said Jonathan Meiman  chief… [+6215 chars],2019-09-12T16:00:00Z
5308,cbs-news,CBS News,NFL star Antonio Brown practices with the Patriots amid rape accusations,,2019-09-12T11:35:09Z
5312,business-insider,Business Insider,Trump's former ghostwriter Tony Schwartz says Trump discards staff like 'Kleenex filled with snot',This week  yet another senior White House adviser  National Security Adviser John Bolton  had a dramatic departure from President Donald Trump's administration.    The Trump White House and Trump's cabinet have seen record-high turnover. Six cabinet-level pos… [+3023 chars],2019-09-12T15:56:56Z
5316,reuters,Reuters,Avianca exchanges $475 mln in bonds  gets further United financing,BOGOTA  Sept 12 (Reuters) - Latin American airline Avianca announced the exchange of $475.2 million in bonds on Thursday  part of a plan to change its capital structure amid ongoing financial problems and enough to receive additional financing from United Air… [+1306 chars],2019-09-12T18:15:58Z
5320,abc-news,ABC News,El Paso police dispute man's story of heroism during attack,El Paso police say surveillance video does not back up the story told by a man who was honored this week at the White House for his actions during the Aug. 3 mass shooting at a Walmart.  Christopher Grant has said he threw bottles to try to stop the attack  w… [+496 chars],2019-09-12T16:50:26Z
5324,the-irish-times,The Irish Times,Ambulances take 5-8 minutes to travel to Dublin hospitals – study,Ambulance travel times for major trauma patients to Dublin hospitals are well within internationally recommended targets  a new study shows.  On average  it takes ambulances between five and eight minutes to travel from an incident to the emergency department… [+2105 chars],2019-09-12T18:12:50Z
5328,the-new-york-times,The New York Times,Couple’s Trek Across Continents Ended in an Iranian Prison,The British Foreign Office declined to speak about individual cases  but noted in a statement that Dominic Raab  Britains foreign secretary  had met with the Iranian ambassador on Wednesday and raised serious concerns about the number of dual national citizen… [+1361 chars],2019-09-12T12:00:12Z
5332,the-irish-times,The Irish Times,Bernard Shaw closure: Like business cycles and friends  some pubs just come and go,One of the endearing things about pubs in Ireland (as opposed to Irish pubs) is that customers of the best ones forge emotional bonds with the place.  It is partly why branded pub chains never took off here: how can you be expected to forge an emotional bond … [+6313 chars],2019-09-12T14:00:53Z
5336,business-insider,Business Insider,Traditional copper pans can be extremely expensive  but these under-$100 options use a slim copper core to achieve the same effect — here's why we recommend them,Copper cookware  while beautiful  can be expensive (a 10-inch pan from Mauviel  for example  retails for $250). However  the benefits of copper — namely  quick and even heat conduction — have many home cooks eyeing the powerful material for their pots and pan… [+4006 chars],2019-09-12T19:50:00Z
5340,the-irish-times,The Irish Times,Ignoring law around Brexit a ‘non-starter’  warns Bercow,Commons speaker John Bercow has warned Boris Johnson that parliament will not allow Britain to leave the European Union without a deal unless MPs explicitly vote for it. And he said it was astonishing that anyone in government would consider that the prime mi… [+400 chars],2019-09-12T19:07:17Z
5344,reuters,Reuters,Aspen's drug to prevent preterm birth approved by FDA,JOHANNESBURG (Reuters) - The U.S. Food and Drug Administration (FDA) has approved Aspen Pharmacare’s hydroxyprogesterone caproate (HPC)  which is used to prevent preterm birth in pregnant women  the South African drugmaker’s CEO said on Thursday.   Aspen  whi… [+2518 chars],2019-09-12T18:07:42Z
5348,abc-news,ABC News,Fox Business Network president stepping down after 20 years,Fox Business Network says its president  Brian Jones  is leaving the network.  Jones worked at the Fox Business Network and the Fox News Channel for 20 years and was promoted to president two years ago. No reason was given for his departure.  He's being repla… [+236 chars],2019-09-12T17:37:19Z
5352,the-irish-times,The Irish Times,Spin pays off for McIlroy as he returns to the top,Rory McIlroys equipment guru has explained how a new driver  a different ball and a new model of putter helped the Northern Irishman return to top form and win the 2019 PGA Tour Player of the Year award.  McIlroy  a four-times Major champion and on-and-off wo… [+2813 chars],2019-09-12T17:37:19Z
5356,abc-news,ABC News,Study finds the universe might be 2 billion years younger,The universe is looking younger every day  it seems.  New calculations suggest the universe could be a couple billion years younger than scientists now estimate  and even younger than suggested by two other calculations published this year that trimmed hundre… [+2761 chars],2019-09-12T18:16:40Z
5360,reuters,Reuters,Tropical Storm Humberto lashes Bahamas  seen becoming hurricane,NASSAU (Reuters) - Tropical Storm Humberto lashed already devastated parts of the Bahamas with heavy rain and strong winds on Saturday  and forecasters said it was likely to become a hurricane before the end of the weekend.   The storm is expected to leave th… [+1231 chars],2019-09-14T13:57:13Z
5364,cbs-news,CBS News,Raphael Saadiq opens up about his most personal project yet,Grammy Award-winning singer  songwriter and record producer  Raphael Saadiq says his new music may be his most honest ever.    I went down a rabbit hole and said 'It's time for me to talk about it '  Saadiq told CBS News' Anthony Mason.  I'm very surprised at… [+2134 chars],2019-09-14T16:27:27Z
5368,cnn,CNN,Felicity Huffman is a role model for how to own up to your crimes,Joey Jackson is a legal analyst for CNN and HLN  and a partner at New York City-based Watford Jackson  PLLC. The views expressed here are solely his. Read more opinion on CNN.    (CNN)Wealth  privilege and celebrity will not be keeping Felicity Huffman  56  o… [+4494 chars],2019-09-14T01:15:32Z
5372,abc-news,ABC News,Lying prisoners: New laws crack down on jailhouse informants,An effort to more tightly regulate the use of jailhouse informants is gaining momentum across the country in the wake of exonerations of people wrongly convicted of crimes.  A new Connecticut law approved in July will create the nation's first statewide syste… [+544 chars],2019-09-14T14:53:19Z
5376,bbc-news,BBC News,Rugby World Cup: Pick your all-time XV,Lomu  Pocock  Wilkinson and Hastings are among the stars vying to get into an all-time Rugby World Cup XV  Dan Carter or Jonny Wilkinson? Jonah Lomu or Shane Williams? John Eales or Martin Johnson? Gavin Hastings or Jason Robinson?  There are no easy choices … [+416 chars],2019-09-14T05:57:49Z
5380,abc-news,ABC News,Congo: Confirmed Ebola deaths near 2 000  cases over 3 000,Congo's National Ebola Response Committee says confirmed Ebola deaths in the east of the sprawling African nation are nearing 2 000 and confirmed cases of the virus have exceeded 3 000.  The committee released the latest numbers Friday after a discussion in G… [+602 chars],2019-09-14T13:03:27Z
5384,the-irish-times,The Irish Times,Robert Mugabe honoured as an icon  leader and intellectual at state funeral,Zimbabwes founder Robert Mugabe was honoured as an icon  principled leader and African intellectual giant at a state funeral on Saturday  after a week of disputes over his burial threatened to embarrass president Emmerson Mnangagwa.  Mugabe led Zimbabwe for 3… [+4449 chars],2019-09-14T09:10:51Z
5388,the-irish-times,The Irish Times,Further unrest as Hong Kong enters 15th week of mass protests,Rival groups of demonstrators clashed in Hong Kong and police made arrests in another weekend of mass protests after months of political unrest.  Dozens of pro-Beijing protesters waved Chinese flags and chanted support the police at a mall in Kowloon Bay on S… [+81 chars],2019-09-14T11:16:43Z
5392,reuters,Reuters,Europe retain one-shot Solheim Cup lead after foursomes,(Reuters) - Team Europe continued to hold a slender one-point advantage over the U.S. with a 6-1/2 to 5-1/2 lead after the second day’s foursomes in the Solheim Cup saw the teams share two wins each in gusty conditions at Gleneagles.   The American Korda sist… [+1013 chars],2019-09-14T12:20:08Z
5396,the-irish-times,The Irish Times,Margaret Atwood: ‘History changed and I saw a different way of doing the story’,ARRIVING 34 YEARS AFTER THE HANDMAIDS TALE  THE TESTAMENTS WAS A VERY LONG TIME COMING. MARGARET ATWOOD TURNS OUT TO BE RETURNING TO A WORLD NOT FAR FROM OUR OWN   Speaking to Margaret Atwood is no breezy endeavour. Extraordinarily focused and perfectly cordi… [+11884 chars],2019-09-14T05:00:00Z
5400,cbs-news,CBS News,Preview: A new podcast from  48 Hours:  Erin Moriarty's  My Life of Crime ,,2019-09-14T00:06:46Z
5404,newsweek,Newsweek,112-Year-Old Chicago White Sox Fan Sees His Favorite Team for the First Time Ever,The Chicago White Sox were the toast of the town and so-called best team in baseball a century ago. But after the Sox lost the World Series in 1919  a local newspaper launched an investigation that discovered the team intentionally lost the Series to the Cinc… [+2224 chars],2019-09-14T03:53:11Z
5408,reuters,Reuters,Afghan Taliban send team to Russia after U.S. talks collapse,PESHAWAR  Pakistan (Reuters) - The Taliban have sent a delegation to Russia to discuss prospects for a withdrawal of U.S. troops from Afghanistan following the collapse of talks with the United States this month  officials from the insurgent group said.   The… [+2344 chars],2019-09-14T06:34:46Z
5412,the-new-york-times,The New York Times,Bahamas  Still Reeling From Dorian  Braces for Tropical Storm Humberto,For those houses that are missing their roofs  the walls are there to be blown down  he said.  Hurricane Dorian damaged or destroyed nearly all structures in some settlements and towns in the Abacos  flattened entire neighborhoods and created vast debris fiel… [+1162 chars],2019-09-14T03:46:10Z
5416,bbc-news,BBC News,Wolves 2-5 Chelsea: Nuno says Europa League involvement not to blame for 'bad' performance,Wolves boss Nuno Espirito Santo says his side's  bad  performance is not due to their involvement in the Europa League qualifying rounds  and they have to improve going forwards after their 5-2 defeat against Chelsea at Molineux.  MATCH REPORT: Wolves 2-5 Che… [+127 chars],2019-09-14T16:34:02Z
5420,cbs-news,CBS News, Stand with Parkland  founder responds to Andrew Pollack's criticisms,,2019-09-14T01:05:39Z
5424,the-wall-street-journal,The Wall Street Journal,Trump Says Son of Osama bin Laden Killed in U.S. Operation,President Trump said that   Hamza bin Laden    a son of al Qaeda founder   Osama bin Laden    had been killed in a U.S. counterterrorism operation.  The president said in a statement released by the White House Saturday  that the death of Hamza bin Laden  who… [+1917 chars],2019-09-14T14:10:00Z
5428,reuters,Reuters,In push for race and religion  Malaysian opposition formalizes pact,KUALA LUMPUR (Reuters) - Malaysia’s two oldest political parties signed a charter of formal cooperation on Saturday  presenting arguably the largest political platform for the majority Malay-Muslims at a time of simmering racial and religious tensions.   Sout… [+1912 chars],2019-09-14T10:26:30Z
5432,abc-news,ABC News,Death toll rises to 6 in torrential rains in southeast Spain,Record rainfall claimed two more lives in southeastern Spain as it caused widespread flooding  raising the overall death toll to six from the storms  authorities said Saturday.  Emergency rescue workers saved thousands of people during the storm that slammed … [+2041 chars],2019-09-14T15:31:56Z
