id,source_id,source_name,title,content,published_at
2600,reuters,Reuters,Soccer-Unwell England midfielder Lingard withdraws from squad,LONDON (Reuters) - England’s Manchester United midfielder Jesse Lingard has pulled out of the national team squad and returned to his club due to illness  the Football Association said on Saturday.   Lingard  26  missed England training on Friday and was not … [+620 chars],2019-09-07T15:49:04Z
2604,reuters,Reuters,Biden gets a laugh with 'Donald Hump',Reuters  the news and media division of Thomson Reuters  is the worlds largest international multimedia news provider reaching more than one billion people every day. Reuters provides trusted business  financial  national  and international news to profession… [+169 chars],2019-09-07T15:43:50Z
2608,the-irish-times,The Irish Times,Johnny Sexton’s World Cup redemption starts now,One sidestep sparked the All Blacks run to retaining the World Cup in 2015.  It happened in August  before the tournament had even started  when Dan Carter created Dane Coles spectacular try against the Wallabies. Steve Hansen was able to keep faith in his ag… [+7700 chars],2019-09-07T05:30:03Z
2612,abc-news,ABC News,Jordan  Foxx debut injustice drama 'Just Mercy' at film fest,The starry based-on-a-true-story social-justice tale  Just Mercy  made a powerful impression in its world premiere Friday at the Toronto International Film Festival  drawing an emotional response for the courtroom drama led by Michael B. Jordan's crusading at… [+2481 chars],2019-09-07T05:18:45Z
2616,the-new-york-times,The New York Times,Fake Invasion  Real Defense Cuts,In July  the Supreme Court allowed the Pentagon to begin spending the $2.5 billion which came from programs for hiring military personnel  buying weapons and supporting the Afghan security forces while litigation over that matter continues.  Mr. Trump may thi… [+1548 chars],2019-09-07T00:46:19Z
2620,business-insider,Business Insider,The crypto whiz kid who paid $4.6 million for lunch with Warren Buffett asked Donald Trump and several crypto bosses to join them. Here's everyone he invited.,The crypto whiz kid who paid $4.6 million to have lunch with Warren Buffett asked Donald Trump and a slew of crypto bosses to join them.    Justin Sun — the founder and CEO of Tron  which operates the 15th largest cryptocurrency— can bring up to seven compani… [+786 chars],2019-09-07T09:00:00Z
2624,espn,ESPN,Sources: Falcons  Jones reach record extension,The Atlanta Falcons and star wide receiver Julio Jones have agreed to a three-year  $66 million contract extension  sources told ESPN's Adam Schefter and Chris Mortensen on Saturday.  The entire contract is guaranteed -- with $64 million due at signing -- and… [+2455 chars],2019-09-07T16:50:00Z
2628,abc-news,ABC News,Iran atomic energy spokesman says it is injecting uranium gas into advanced centrifuges  breaking new atomic deal term.,Iran atomic energy spokesman says it is injecting uranium gas into advanced centrifuges  breaking new atomic deal term.,2019-09-07T06:06:24Z
2632,bbc-news,BBC News,Bomb disposal team called out after 'hand grenade' found in Edinburgh,A bomb disposal team has been called to the Union Canal in Edinburgh after a device  thought to be an antique hand grenade  was found.  Police have closed the canal footpath at Harrison Place and Gibson Terrace.  Yeaman Place has also been closed to both road… [+71 chars],2019-09-07T15:01:07Z
2636,the-irish-times,The Irish Times,Ireland’s defective buildings: Not just a Celtic Tiger problem,DEFECTS IN NEW BUILDINGS ESPECIALLY COMMON DURING THE LAST BOOM CAN LEAVE OWNERS IN HUGE DEBT  WITH LITTLE LEGAL RECOURSE. AND THEY DIDNT STOP WHEN THE CELTIC TIGER DIED  AN IRISH TIMES INVESTIGATION REVEALS  John Gormley and his wife had been living in their… [+17344 chars],2019-09-07T05:00:00Z
2640,cbs-news,CBS News,What to know about New Hampshire's first 2020 cattle call,Nineteen presidential candidates are traveling to the New Hampshire Democratic Party convention for the state's first cattle call before the 2020 primaries. Here are some things to know and some things to look for during the convention speeches Saturday.    D… [+4544 chars],2019-09-07T14:09:57Z
2644,business-insider,Business Insider,The VSCO girl is taking over the internet — here's the ultimate starter kit for becoming the latest 'it' girl,,2019-09-07T14:43:00Z
2648,bbc-news,BBC News,Women's Super League highlights: Man City 1-0 Man Utd,Watch highlights as Manchester City beat Manchester United 1-0 in the first derby of the Women's Super League season.  Available to UK users only.,2019-09-07T16:30:23Z
2652,cnn,CNN,A blind man carried his disabled son to safety as Hurricane Dorian raged,,2019-09-07T01:33:04Z
2656,the-irish-times,The Irish Times,We should not get overly friendly with Facebook,As regulators on both sides of the Atlantic ominously circle Facebook  the Government here would be wise to not repeat past mistakes by allowing Ireland to be seen as too close a friend of the social networking giant.  On Friday  Facebooks shares fell when th… [+2203 chars],2019-09-07T04:42:10Z
2660,the-irish-times,The Irish Times,Mike Rutter set to leave Aer Lingus as chief operating officer,Aer Linguss chief operating officer Mike Rutter is believed to be leaving the Irish airline.   Mr Rutter joined Aer Lingus in early 2014 as chief commercial officer  having previously held roles with UK airline Flybe  security group G4S and American Express. … [+1096 chars],2019-09-07T04:23:14Z
2664,cbs-news,CBS News,What the NSA is doing to prepare for the 2020 election,The National Security Agency has begun revealing some of its preparations for the 2020 presidential elections  drawing in part from from its previous successes during the 2018 midterm elections. But officials also warned that cyber threats from foreign advers… [+4276 chars],2019-09-07T14:11:51Z
2668,cnn,CNN,House panel investigates military spending at Trump Turnberry,(CNN)The House Oversight Committee has been investigating for several months whether increased military expenditures benefiting the Trump Turnberry golf course and resort in Scotland represent a conflict of interest for the President  according to committee d… [+2596 chars],2019-09-07T02:56:37Z
2672,the-irish-times,The Irish Times,Get a taste of California without breaking the bank,For many wine drinkers here in Ireland  California starts and ends with two valleys  Napa and Central. The former is the Rolls-Royce  producing plush  expensive Cabernet Sauvignons that rival the best of Bordeaux in both quality and price; the latter is the e… [+4083 chars],2019-09-07T05:00:00Z
2676,the-irish-times,The Irish Times,Watford sack Gracia after poor start to season,Watford have sacked manager Javi Gracia with the club bottom of the Premier League and without a win this season.  The Hornets have managed to score just two goals so far and have not won in eight league matches stretching back to April.,2019-09-07T17:05:30Z
2680,cnn,CNN,Hurricane Dorian: Officials warn grim death toll of at least 43 people could rise,The Bahamas Health Minister  Duane Sands  acknowledged Friday that there are uncollected bodies evident in areas where Hurricane Dorian caused devastation  adding that he expected the death toll would rise significantly.   I am sure that your reporters have s… [+912 chars],2019-09-07T08:22:42Z
2684,the-irish-times,The Irish Times,All Blacks play with 14 men with eye on World Cup,The All Blacks got exactly what they wanted from their final match ahead of the World Cup when they demolished Tonga 92-7 on Saturday  and deliberately chose to play the last 15 minutes a man down  coach Steve Hansen said.  Inside centre Ryan Crotty  who was … [+2151 chars],2019-09-07T13:47:19Z
2688,the-irish-times,The Irish Times,‘We miss you’ - Taoiseach leads tributes to Noel Whelan at Kennedy Summer school,Taoiseach Leo Varadkar has led tributes to founder Noel Whelan at the Kennedy Summer School in Co Wexford this weekend.   Mr Whelans untimely death in July at the age of 50 came as a shock to the the legal  political and wider community.   Many of the speaker… [+3977 chars],2019-09-07T16:17:11Z
2692,al-jazeera-english,Al Jazeera English,The US jobs market is slowing  but not enough to cry recession,The US economy has been slow but steady because of the ongoing trade war.  Nearly 130 000 jobs were added last month - fewer than expected.  Al Jazeera's Alan Fisher reports from Washington  DC.,2019-09-07T14:36:38Z
2696,business-insider,Business Insider,400 murders a day: 10 reasons why Latin America is the world's most violent place,Illegal drugs are connected  at one level or another  to much of the crime and violence in Latin America.    The region is home to  the world's only producers of cocaine in Peru  Bolivia  and Colombia   Muggah said.  The power of this kind of drug  from the p… [+1535 chars],2019-09-07T13:19:17Z
2700,reuters,Reuters,Zimbabweans mourn founder Mugabe but confused over burial,HARARE (Reuters) - Zimbabweans on Saturday mourned the death of their founding father Robert Mugabe  but there was confusion over when his body would be returned from abroad for burial  two years after he was toppled in a coup.   Mugabe died on Friday aged 95… [+3793 chars],2019-09-07T12:52:48Z
2704,abc-news,ABC News,2019 hot car deaths surpass national average  automakers voluntarily commit to back seat alerts,Despite numerous warnings and national news stories on hot car deaths  children are dying of vehicular heatstroke at a staggering rate. Forty children have died after being left alone in a hot vehicle so far in 2019  according to the National Safety Council.  … [+3249 chars],2019-09-07T15:52:36Z
2708,cnn,CNN,Hurricane Dorian makes one final stop in the US before racing to Canada,,2019-09-07T06:31:56Z
2712,reuters,Reuters,Erdogan says expects Turkish interest rates to fall further,ISTANBUL (Reuters) - Turkish President Tayyip Erdogan said on Saturday he expected the central bank to keep cutting interest rates  five days before its monetary policy board is due to meet.   The central bank slashed its key interest rate by 425 basis points… [+1008 chars],2019-09-07T15:36:34Z
2716,bbc-news,BBC News,Iran tanker row: Released ship wanted by US 'seen off Syria',Image copyrightAFPImage caption   The Adrian Darya-1  formerly the Grace 1  was released after Iran said it would not head to Syria  The Iranian oil tanker at the centre of an international incident has been sailing just off the Syrian coast  satellite images… [+2760 chars],2019-09-07T12:27:21Z
2720,the-irish-times,The Irish Times,Claire Byrne: ‘My parents had to stand by the bed while I got the last rites’,THE RTÉ PRESENTER GREW UP IN A FAMILY THAT HAD BIG CONVERSATIONS ABOUT WHO TO VOTE FOR. CHILDHOOD MENINGITIS PERMITTING  IT WAS THE BEGINNING OF HER PASSION FOR POLITICS  DEBATE AND LIVE BROADCASTING   Claire Byrne is in the studio hosting the News at One  on… [+16204 chars],2019-09-07T05:03:00Z
2724,reuters,Reuters,Turkey calls on U.S. to lift barriers to boost trade,ISTANBUL  Sept 7 (Reuters) - Turkey asked the United States to lift trade barriers between the two countries during talks on Saturday aimed at sharply increasing bilateral commerce  Turkey’s trade minister said.   Washington and Ankara have set an ambitious g… [+1284 chars],2019-09-07T13:47:25Z
2728,abc-news,ABC News,Satellite images show Iran oil tanker sought by US off Syria,Satellite images appear to show the once-detained Iranian oil tanker Adrian Darya-1 near the Syrian port of Tartus  despite U.S. efforts to seize the vessel.  Images obtained by The Associated Press early Saturday from Maxar Technologies showed the vessel the… [+572 chars],2019-09-07T03:07:57Z
2732,al-jazeera-english,Al Jazeera English,Chad unrest: A new regional sultan to solve the crisis,Chad's government is hoping the appointment of a new regional sultan will help end a deadly conflict in the east of the country.  As many as 40 people have been killed since the start of August in clashes between cattle herders and farmers.  And it is getting… [+230 chars],2019-09-07T15:36:34Z
2736,the-irish-times,The Irish Times,How ballooning spiders fly through the sky,Abroad on a calm and meditative morning  walking a path between damp hedges  the faintest  softest touch on my cheek confirmed that it was autumn. I had collided  to put it clumsily  with a gossamer thread stretching skywards from a spider.  Given the arachno… [+4354 chars],2019-09-07T05:00:00Z
2740,reuters,Reuters,Buttigieg calls reported Air Force stay at Trump resort 'very strange',Reuters  the news and media division of Thomson Reuters  is the worlds largest international multimedia news provider reaching more than one billion people every day. Reuters provides trusted business  financial  national  and international news to profession… [+169 chars],2019-09-07T15:44:32Z
2744,abc-news,ABC News,In New Hampshire  2020 Dems urge voters to not play it safe,A trio of Democratic presidential candidates urged voters in New Hampshire on Saturday to not play it safe in the 2020 election  leveling an implicit critique of front-runner Joe Biden.  Biden has centered his campaign on his years of experience in Washington… [+2319 chars],2019-09-07T17:18:17Z
2748,the-new-york-times,The New York Times,Looming Over the College Admissions Case: Will Parents Like Felicity Huffman Get Jail?,I felt an urgency which built to a sense of panic that there was this huge obstacle in the way that needed to be fixed for my daughters sake  she wrote. As warped as this sounds now  I honestly began to feel that maybe I would be a bad mother if I didnt do wh… [+1925 chars],2019-09-07T01:11:15Z
2752,reuters,Reuters,In Mugabe's village  relatives say he was very bitter before death,KUTAMA  Zimbabwe (Reuters) - In the dusty village where Zimbabwe’s founding father Robert Mugabe grew up  family members speak of the deep bitterness Mugabe felt from his ousting as head of state two years ago until his death in Singapore on Friday.   Mugabe … [+3496 chars],2019-09-07T16:24:48Z
2756,the-irish-times,The Irish Times,Matt Williams: Residency rule endangers credibility of international game,There is a very large elephant sitting slap-bang in the middle of international rugbys room.   Around the globe  there is a disconcertingly large number of players from the Southern Hemisphere playing international rugby for Northern Hemisphere countries.  Wo… [+5295 chars],2019-09-07T05:05:00Z
2760,bbc-news,BBC News,Boy charged with murder over knife attack in London,Image copyrightMet PoliceImage caption   Santino Angelo Dymiter was found injured on 26 August  A 14-year-old boy accused of a stabbing murder has been remanded to a secure unit.  The teenager  from Barking  appeared at Thames Magistrates' Court on Saturday m… [+372 chars],2019-09-07T11:21:07Z
2764,cnn,CNN,An iPhone 11 Pro? What to expect at Apple's big event,New York (CNN Business)Apple(AAPL) is expected to unveil new iPhonesduring a closely watched media event on Tuesday but don't expect anything foldable  5G capable or radically different from the year before.  At the event  which will take place in its Cuperti… [+3870 chars],2019-09-07T16:39:43Z
2768,bbc-news,BBC News,Manchester City Women 1-0 Manchester United Women: Weir seals win in front of record WSL crowd,Caroline Weir's strike was the first goal of the new Women's Super League season  Caroline Weir's stunning long-range strike gave Manchester City victory over rivals Manchester United in the first Women's Super League derby in front of a record crowd of more … [+577 chars],2019-09-07T16:12:18Z
2772,the-wall-street-journal,The Wall Street Journal,Workers Are Fleeing Big Cities for Small Ones–and Taking Their Jobs with Them,Kelly Swift grew tired of the Los Angeles area a few years ago so she decided to leaveand take her job with her.Ms. Swift kept her role in health-care information-technology consulting  and her California salary  when she and her family settled in a suburb of… [+6395 chars],2019-09-07T11:13:59Z
2776,bbc-news,BBC News,Scotland 1-2 Russia: Captain Andy Robertson on pain of latest loss,Andy Robertson says it is  worrying  how far Scotland are behind Russia  Scotland captain Andy Robertson says Friday's Hampden defeat to Russia was  one of the most disappointing  of his career.   The 2-1 Hampden loss means Scotland have a mountain to climb t… [+1297 chars],2019-09-07T07:24:49Z
2780,cnn,CNN,Russia-Ukraine prisoner swap sees film director Oleg Sentsov  and MH17 suspect freed,Kiev  Ukraine and Moscow  Russia (CNN)A man suspected of involvement in the downing of Malaysia Airlines flight MH17 that killed 298 people has been released along with 69 other prisoners from Russia and Ukraine in a long-awaited exchange  according to Ukrain… [+3456 chars],2019-09-07T16:50:44Z
2784,business-insider,Business Insider,YouTube star Emma Chamberlain’s dad on what it's like when your teen daughter suddenly has millions of subscribers  and the advice he gave her,Emma Chamberlain's parents knew things were getting serious for her on YouTube when she began making money through Google AdSense only a few weeks after posting her first video — a 2017 summer look book  filmed by her dad — the summer before her junior year o… [+5729 chars],2019-09-07T13:15:00Z
2788,al-jazeera-english,Al Jazeera English,Unspeakable Crime: Rape as a Weapon of War in Libya,,2019-09-07T13:41:56Z
2792,abc-news,ABC News,Alaska reaches settlement in case brought by Muslim inmates,The Alaska Department of Corrections has agreed to policy changes to accommodate Muslim inmates who wish to practice their religion  settling a lawsuit brought last year.  A federal judge Friday signed the agreement in a case brought on behalf of two Muslim i… [+2426 chars],2019-09-07T00:13:56Z
2796,reuters,Reuters,Russia  Ukraine swap prisoners in first sign of thawing relations,MOSCOW/KIEV (Reuters) - Russia and Ukraine carried out a long-awaited prisoner swap on Saturday in a step that could thaw a deep freeze in relations since Moscow’s annexation of the Crimea region in 2014.   While the unfolding exchange could help rebuild conf… [+3105 chars],2019-09-07T11:42:53Z
2800,bbc-news,BBC News,Climate protesters target Venice Film Festival,,2019-09-07T12:30:00Z
2804,al-jazeera-english,Al Jazeera English,Pakistan denies Indian president's request to use airspace,Pakistan says it has refused a request by India's President Ram Nath Kovind to fly through its airspace due to New Delhi's recent  behaviour .  The decision on Saturday comes amid heightened tensions between the two neighbours over the disputed region of Kash… [+1917 chars],2019-09-07T11:05:00Z
2808,bbc-news,BBC News,US Open 2019: Serena Williams not thinking about 2018 final before facing Bianca Andreescu,Serena Williams will be playing in her 10th US Open singles final  20 years after winning her first Grand Slam title at Flushing Meadows  <table><tr><th>US Open 2019</th></tr>  <tr><td>Venue: Flushing Meadows  New York Dates: 26 Aug - 8 Sep</td></tr><tr><td>C… [+8635 chars],2019-09-07T00:55:55Z
2812,reuters,Reuters,Brown pleads for release from Raiders in Instagram post,While Oakland Raiders coach Jon Gruden expects Antonio Brown to play in the team’s season opener against the Denver Broncos  the wide receiver appears ready to walk away from Oakland without playing a snap or earning a dime.   Brown posted a message to Instag… [+3283 chars],2019-09-07T15:15:04Z
2816,abc-news,ABC News,Satellite images appear to show once-detained Iranian oil tanker pursued by the US near the Syrian port of Tartus,Satellite images appear to show once-detained Iranian oil tanker pursued by the US near the Syrian port of Tartus.,2019-09-07T02:57:39Z
2820,the-irish-times,The Irish Times,British politics this week like the mad scenes in King Lear,The great American humourist James Thurber recalled in his memoir a local character from his childhood in Columbus  Ohio: the Get-Ready Man. The Get-Ready Man was a lank unkempt elderly gentleman with wild eyes and a deep voice who used to go about shouting a… [+769 chars],2019-09-07T05:00:49Z
2824,bbc-news,BBC News,2019/09/07 15:01 GMT,The latest five minute news bulletin from BBC World Service.,2019-09-07T15:04:00Z
2828,reuters,Reuters,U.S. House panel poised to spell out Trump impeachment probe: source,WASHINGTON (Reuters) - The Democratic-led U.S. House of Representatives Judiciary Committee  criticized for an unorthodox impeachment probe of President Donald Trump  is poised to vote next week on a resolution to formalize the investigation  a person familia… [+2393 chars],2019-09-07T17:01:15Z
2832,cnn,CNN,These 2 women are the first sisters ever to become Army generals,,2019-09-07T04:18:54Z
2836,abc-news,ABC News,To set up 'safe zone ' US wades into muddled Syria politics,U.S. troops are patrolling border areas in northeastern Syria to oversee implementation of a new deal to defuse tension between its allies  Turkey and Syrian Kurds.  Armored vehicles move between villages in the area to ensure military bases occupied by the S… [+545 chars],2019-09-07T12:31:53Z
2840,reuters,Reuters,UPDATE 2-Motor racing-Ferrari's Leclerc takes Monza pole in qualifying farce,* Leclerc on pole for Ferrari   * Last lap farce under investigation   * F1 leader Hamilton lines up on front row (Adds detail and quotes)   By Alan Baldwin   MONZA  Italy  Sept 7 (Reuters) - Charles Leclerc put Ferrari on pole position for their home Italian… [+3758 chars],2019-09-07T15:49:01Z
2844,the-irish-times,The Irish Times,Subscriber Only: Anne Enright on Edna O’Brien: Girl captures what it is to be vulnerable  female and young,I dont want to hear about your little life  okay? This is what the late  great Toni Morrison used to tell her writing students  on the grounds  perhaps  that the world is a big place and the mirror a small one. Morrison believed it was important to make stori… [+464 chars],2019-09-07T05:15:00Z
2848,reuters,Reuters,British lawmakers prepare court action to enforce Brexit delay: BBC,LONDON (Reuters) - British lawmakers are preparing legal action in case Prime Minister Boris Johnson tries to defy legislation compelling him to seek a further delay to Brexit  the BBC reported on Saturday.   An opposition bill which would force Johnson to as… [+3369 chars],2019-09-07T12:07:59Z
2852,bbc-news,BBC News,2022 World Cup: Angola and Togo secure positive results away from home in qualifiers,Five African nations will qualify for the 2022 World Cup in Qatar  as they bid to become the first African team to lift the famous trophy  Angola and Togo made encouraging starts in their bids to reach the 2022 World Cup finals with positive away results in t… [+1245 chars],2019-09-07T11:55:28Z
2856,al-jazeera-english,Al Jazeera English,Sudan: Former president al-Bashir denied bail in corruption trial,Former Sudanese President Omar al-Bashir has been denied bail by a court in capital Khartoum in a corruption trial that began after he was removed from power earlier this year.  Al-Bashir  who ruled Sudan for nearly 30 years  is charged with illicit financial… [+3060 chars],2019-09-07T16:56:00Z
2860,cbs-news,CBS News,California dive boat owner says crew tried to save passengers from deadly fire,Santa Barbara  California — The owner of a dive boat that caught fire and sank near Santa Barbara this week  killing 34  spoke out about the disaster Friday and he's defending the actions of his crew.  Speaking for the first time  Glen Fritzler  the owner of … [+2170 chars],2019-09-07T15:27:00+00:00
2864,the-irish-times,The Irish Times,Even ‘crooks’ like Haughey ‘can do good’  Kennedy Summer School hears,Charles J Haughey as a politician did the State a disservice but even crooks can sometimes do some good  the authors of two books on the controversial Fianna Fáil leader have said.  Journalist Peter Murtagh and former Fianna Fáil TD Conor Lenihan have outline… [+4341 chars],2019-09-07T14:05:38Z
2868,the-irish-times,The Irish Times,Shattered Bahamas counts cost of Hurricane Dorian’s destruction,As Erica Roberts clung to a tall mango tree  the winds and sea water churned up by Hurricane Dorian pounding her face  a single thought ran through her head: I will not die like this.  Her home  in the small town of High Rock on the eastern side of Grand Baha… [+102 chars],2019-09-07T06:54:44Z
2872,bbc-news,BBC News,2019/09/07 16:01 GMT,The latest five minute news bulletin from BBC World Service.,2019-09-07T16:04:00Z
2876,reuters,Reuters,In Mugabe's village  relatives say he was very bitter before death,KUTAMA  Zimbabwe (Reuters) - In the dusty village where Zimbabwe’s founding father Robert Mugabe grew up  family members speak of the deep bitterness Mugabe felt from his ousting as head of state two years ago until his death in Singapore on Friday.   Mugabe … [+3495 chars],2019-09-07T16:41:04Z
2880,abc-news,ABC News,Lawyer: Ukraine-Russia prisoner exchange underway,A Russian lawyer who has defended a Ukrainian imprisoned for spying says a widely anticipated exchange of prisoners between Russia and Ukraine is underway.  A prisoner exchange could be a significant step toward easing Russia-Ukraine relations and raising cha… [+592 chars],2019-09-07T08:12:41Z
2884,business-insider,Business Insider,Trump returns to his comfort zone on the campaign trail to bounce back from his blundering summer,After a long  hot summer full of economic turmoil and bitter personal Twitter feuding  President Donald Trump and his team of advisers are hoping to bounce back with an ambitious campaign push in the coming months.    As the 2020 campaign season kicks into hi… [+6835 chars],2019-09-07T13:32:00Z
